name,url,category,subcategory,instructors,description,enrollment,views,rating,raters
Inequality and Democracy,https://www.coursera.org/learn/inequality-and-democracy,Arts and Humanities,Philosophy,"Yara Salman, Rutger Claassen, Michael Bennett","Most countries are getting more and more unequal. But the core of democracy is political equality: that everyone should have an equal say in how their country is run. Can we really expect these things to go together? Can people have equal political power while economic inequality grows and grows? Take this course and decide for yourself.

You’ll learn about:
•	The rise of economic inequality
•	Property rights and the corporation
•	Democracy: Its value and history 
•	Campaign finance and lobbying
•	Tax avoidance and capital flight
•	Alternatives to our economic system

This is an interdisciplinary course combining:
•	Politics
•	Philosophy
•	Economics
•	History
•	Law

Our course is for anyone looking for an accessible introduction to these topics. You might a concerned citizen, or someone who works in a field like politics, media, education, government or law. The difficulty level is similar to the first-year of an undergraduate degree. No prior knowledge is assumed.",11501.0,7610.0,4.8,27.0
Intellectual Humility: Practice,https://www.coursera.org/learn/intellectual-humility-practice,Arts and Humanities,Philosophy,"Dr. Ian Church, Professor Duncan Pritchard, Dr. Emma Gordon","We live in a polarised world where all too often people talk past each other. But do you know when to believe what others say? For example, how quick should we be to accept something that someone else tells us is true, and what should we be looking out for when assessing a person's trustworthiness? Meanwhile, what should we do when we encounter disagreements with people who seem to be our equals? How and when should we adjust our beliefs, and how does the appropriate response vary depending on the evidence? These challenges may be especially important in the arena of religious disagreements. How should we weigh the evidence for and against various theistic and atheistic stances?

Experts in psychology, philosophy, theology and education are conducting exciting new research on these questions, and the results have important, real-world applications. Faced with difficult questions people often tend to dismiss and marginalize dissent. Political and moral disagreements can be incredibly polarizing, and sometimes even dangerous. And whether it’s Christian fundamentalism, Islamic extremism, or militant atheism, religious dialogue remains tinted by arrogance, dogma, and ignorance. The world needs more people who are sensitive to reasons both for and against their beliefs, and are willing to consider the possibility that their political, religious and moral beliefs might be mistaken. The world needs more intellectual humility.

In this course. we will examine the following major questions about applied issues surrounding intellectual humility:
 
•         Should you believe what people say?
•         How should we handle disagreement?
•         What is the role of evidence in resolving religious disagreements?
 
All lectures are delivered by leading specialists, and the course is organised around a number of interesting readings and practical assignments which will help you address issues related to humility in your daily life. 

This course can be taken as a part of a series which explores the theory, the science and the applied issues surrounding intellectual humility. Before, we considered how to define and measure intellectual humility, what intellectual virtue is, whether we are born or can become humble, and what cognition and emotions can tell us about intellectual humility. If you are interested, complete all three courses to gain a broader understanding of this fascinating topic. Look for: 

•        Intellectual Humility: Theory - https://www.coursera.org/learn/intellectual-humility-theory
•        Intellectual Humility: Science - https://www.coursera.org/learn/intellectual-humility-science

Check out our trailer to hear more - https://youtu.be/x_CWjrYxKZU.",12564.0,3926.0,4.7,135.0
Intellectual Humility: Science,https://www.coursera.org/learn/intellectual-humility-science,Arts and Humanities,Philosophy,"Dr. Ian Church, Professor Duncan Pritchard, Dr. Emma Gordon","It’s clear that the world needs more intellectual humility. But how do we develop this virtue? And why do so many people still end up so arrogant? Do our own biases hold us back from becoming as intellectually humble as we could be—and are there some biases that actually make us more likely to be humble? Which cognitive dispositions and personality traits give people an edge at being more intellectually humble - and are they stable from birth, learned habits, or something in between? And what can contemporary research on the emotions tell us about encouraging intellectual humility in ourselves and others?

Experts in psychology, philosophy and education are conducting exciting new research on these questions, and the results have important, real-world applications. Faced with difficult questions people often tend to dismiss and marginalize dissent. Political and moral disagreements can be incredibly polarizing, and sometimes even dangerous. And whether it’s Christian fundamentalism, Islamic extremism, or militant atheism, religious dialogue remains tinted by arrogance, dogma, and ignorance. The world needs more people who are sensitive to reasons both for and against their beliefs, and are willing to consider the possibility that their political, religious and moral beliefs might be mistaken. The world needs more intellectual humility.
 
In this course, we will examine the following major questions about the science of intellectual humility:
• How do we become intellectually humble?
• What can human cognition tell us about intellectual humility?
• How does arrogance develop, and how can we become more open-minded?
• How do emotions affect our ability to be intellectually humble? 
 
All lectures are delivered by leading specialists, and the course is organised around a number of interesting readings and practical assignments which will help you address issues related to humility in your daily life. 

This course can be taken as a part of a series which explores the theory, the science and the applied issues surrounding intellectual humility. In the previous course on the theory behind intellectual humility, we considered how to define intellectual humility, the nature of an intellectual virtue, and how we know who is intellectually humble. If you are interested, complete all three courses to gain a broader understanding of this fascinating topic. Look for: 

•        Intellectual Humility: Theory - https://www.coursera.org/learn/intellectual-humility-theory
•        Intellectual Humility: Practice - https://www.coursera.org/learn/intellectual-humility-practice",12245.0,4505.0,4.7,172.0
Intellectual Humility: Theory,https://www.coursera.org/learn/intellectual-humility-theory,Arts and Humanities,Philosophy,"Professor Duncan Pritchard, Dr. Ian Church, Dr. Emma Gordon","Faced with difficult questions people often tend to dismiss and marginalize dissent. Political and moral disagreements can be incredibly polarizing, and sometimes even dangerous. And whether it’s Christian fundamentalism, Islamic extremism, or militant atheism, religious dialogue remains tinted by arrogance, dogma, and ignorance. The world needs more people who are sensitive to reasons both for and against their beliefs, and are willing to consider the possibility that their political, religious and moral beliefs might be mistaken. The world needs more intellectual humility.

But what is intellectual humility, anyway? And why do people seem so drawn toward intellectual arrogance? Psychologists, philosophers, theologians, and educationalists are now suggesting some answers.

In this course we try to define intellectual humility and intellectual virtues in general, and ask how we know who is humble. All lectures are delivered by leading specialists, and the course is organised around a number of interesting readings and practical assignments which will help you address issues related to humility in your daily life.

This course is a part of a series which explores the theory, the science and the applied issues surrounding intellectual humility (the latter two coming in June and November 2017). Completing all three courses will give you a broader understanding of this fascinating topic. Look for: 

• Intellectual Humility: Science - https://www.coursera.org/learn/intellectual-humility-science
• Intellectual Humility: Practice - https://www.coursera.org/learn/intellectual-humility-practice

You can also follow us on twitter: @EdiPhilOnline and #IHMOOC",27452.0,4513.0,4.5,344.0
Introducción a las humanidades digitales,https://www.coursera.org/learn/hd,Arts and Humanities,Philosophy,"Miriam Peña Pimentel, Adriana Álvarez Sánchez, Ernesto Priani Saiso","Las humanidades digitales integran a las humanidades con las ciencias sociales y las ciencias de la computación. 

Durante diez horas, disfrutarás de una serie de actividades y contenidos que te ayudarán a plantear, diseñar y elaborar tu propio proyecto. A lo largo de este curso explorarás y evaluarás proyectos de humanidades digitales de todo el mundo, conocerás la experiencia de humanistas digitales de Hispanoamérica, experimentarás con herramientas tecnológicas construidas por y para humanistas, e identificarás licencias de uso libre para tu proyecto.

Al finalizar el curso habrás elaborado un proyecto de humanidades digitales que podrás compartir y desarrollar de manera colaborativa.",,4574.0,,
Introduction to Korean Philosophy and Culture,https://www.coursera.org/learn/introduction-to-korean-philosophy-and-culture,Arts and Humanities,Philosophy,SO JEONG PARK,"This course will give you the cultural and historical background to begin your journey into Korean philosophy, and there is no prerequisite knowledge on philosophy required. Anybody who either has an interest in Korean culture, maybe through K-Dramas or K-pop, or an interest in philosophy from a cross-cultural perspective, are all welcome.

Despite the growing interest in Korean culture, there are few courses which explore the fascinating topic of Korean philosophy. On this course, you’ll be introduced to concepts in Korean philosophy through an exploration of the Korean language, culture and perspective.
The Korean cultural, social, and political environment has informed and transformed the intellectual assets of China and the West. You’ll explore the creative tensions that Koreans have experienced, and broaden your worldview as you discover a new philosophical approach.",10113.0,12954.0,4.9,134.0
Introduction to Philosophy,https://www.coursera.org/learn/philosophy,Arts and Humanities,Philosophy,"Dr.  Dave Ward, Professor Duncan Pritchard,  Professor Michela Massimi, Dr. Suilin Lavelle, Dr. Matthew Chrisman, Dr. Allan Hazlett, Dr. Alasdair Richmond, Guy Fletcher, Elinor Mason","This course will introduce you to some of the main areas of research in contemporary philosophy. Each module a different philosopher will talk you through some of the most important questions and issues in their area of expertise. We’ll begin by trying to understand what philosophy is – what are its characteristic aims and methods, and how does it differ from other subjects? Then we’ll spend the rest of the course gaining an introductory overview of several different areas of philosophy. 

Topics you’ll learn about will include: 

Epistemology, where we’ll consider what our knowledge of the world and ourselves consists in, and how we come to have it;

Philosophy of science, where we’ll investigate foundational conceptual issues in scientific research and practice;

Philosophy of Mind, where we’ll ask questions about what it means for something to have a mind, and how minds should be understood and explained;

Political Philosophy, where we'll investigate whether we have an obligation to obey the law;

Moral Philosophy, where we’ll attempt to understand the nature of our moral judgements and reactions – whether they aim at some objective moral truth, or are mere personal or cultural preferences, and;

Metaphysics, where we’ll think through some fundamental conceptual questions about free will and the nature of reality.

The development of this MOOC has been led by the University of Edinburgh's Eidyn research centre.

To accompany 'Introduction to Philosophy', we are pleased to announce a tie-in book from Routledge entitled 'Philosophy for Everyone'. This course companion to the 'Introduction to Philosophy' course was written by the Edinburgh Philosophy team expressly with the needs of MOOC students in mind. 'Philosophy for Everyone' contains clear and user-friendly chapters, chapter summaries, glossary, study questions, suggestions for further reading and guides to online resources. Please click ""Start Here"" and navigate to the ""Optional Reading"" page for more information.",590681.0,138084.0,4.7,8611.0
Introduction to Religions & Ecology,https://www.coursera.org/learn/intro-religions-ecology,Arts and Humanities,Philosophy,"Mary Evelyn Tucker, John Grim","At first glance the fields of religion and ecology may seem and unlikely pairing, but a deeper consideration reveals the two have a great deal to contribute to one another and are indeed inextricably linked. Religions recognize the unity and interdependence of humans with nature. Ecological sciences affirm this deep interconnection with the natural world. This partnership can inspire work for the wellbeing of the Earth community 

There is a need for broader literacy and deeper knowledge of the world’s religions and their ecological contributions. This specialization, starting with this course, contributes such a perspective. Each course celebrates the vitality of religiously-informed action for the Earth and recognizes the longstanding contributions of Indigenous peoples in offering visions and practices for ecological flourishing. 

This course is part one of the ""Religions and Ecology: Restoring the Earth Community"" series of classes that focuses on the ecological dimensions of religious traditions throughout the world. The course you are about to begin is designed as a gateway to the other classes. It describes the nature of religion as well as the emergence of the field of ecology. In addition, it highlights concerns for forestry issues, the climate emergency, global ethics, and environmental justice.

This course is for lifelong learners curious to know more about world religions and ecology, environmental professionals eager to deepen the discourse of environmental protection and conservation, those working with non-profit organizations and NGOs on issues of ecological justice, and religion leaders and laity who wish to know how they can contribute to interreligious dialogue on environmental projects.",2548.0,5856.0,4.9,35.0
Know Thyself - The Value and Limits of Self-Knowledge: The Examined Life,https://www.coursera.org/learn/know-thyself-the-examined-life,Arts and Humanities,Philosophy,"Mitchell Green, Dr Simon Fokt","According to legend, inscribed on walls of the temple on the sacred site of Delphi in Ancient Greece were two premier injunctions: NOTHING IN EXCESS, and KNOW THYSELF. This course will be an examination of the latter injunction in an effort to discover what self-knowledge is, why it might be valuable, and what, if any, limitations it might face. What is missing from a person lacking in self-knowledge that makes her less wise, virtuous, or competent in certain areas than others who have this capacity, and what if anything might she do to fill that gap?  Historical sources as well as recent research in philosophy, experimental social psychology, and neuroscience will inform our investigation, in the course of which we will become students of our own dreams, and cultivate some meditative practices.

Learning Outcomes: 
Learners will gain familiarity with prominent themes from Western, classical Chinese, and Buddhist approaches to our knowledge of ourselves. In the course of doing so, they will gain an appreciation of the relation of self-knowledge to wisdom, of the value of intellectual humility, as well as of methods of learning about oneself that do not depend on introspection. 

Learners will also become familiar with contemporary research in experimental social psychology, philosophy, and neuroscience into the emotions, the unconscious, the role of affect in decision making, and self-deception. They will also gain an appreciation of a challenge to the assumption of a coherent, unified self that derives from the Buddhist tradition.

---
This course was created by a partnership between The University of Edinburgh and Humility & Conviction and Public Life Project, an engaged research project  based at the University of Connecticut and funded by a generous grant from the John Templeton Foundation.",50441.0,35465.0,4.6,501.0
Know Thyself - The Value and Limits of Self-Knowledge: The Unconscious,https://www.coursera.org/learn/know-thyself-the-unconscious,Arts and Humanities,Philosophy,Mitchell Green,"A challenging but fascinating topic on the way to achieving self-knowledge is the unconscious. For well over a century, psychologists, philosophers, and many others have posited a level of mentality that is not immediately open to introspection; some would even say that certain unconscious elements cannot be known through introspection. This course will examine some of the most influential ideas about the unconscious starting with the work of Sigmund Freud, and follow the development of theories of the unconscious all the way to present research in experimental psychology. But be warned: some of the things you may learn about your unconscious mind may be surprising, and possibly even disturbing!

---
This course was created by a partnership between The University of Edinburgh and Humility & Conviction and Public Life Project, an engaged research project  based at the University of Connecticut and funded by a generous grant from the John Templeton Foundation.",64503.0,54870.0,4.7,642.0
"Le Bien, le Juste, l'Utile. Introduction aux éthiques philosophiques",https://www.coursera.org/learn/ethique,Arts and Humanities,Philosophy,"François Dermange, Ghislain Waterlot","Course in French with English and Chinese subtitles

Ce cours présente les principaux courants qui marquent aujourd'hui la réflexion éthique et touchent tout un chacun dans sa vie personnelle, sociale et citoyenne. D’Aristote à Kant, de Bentham à Derrida, à travers un voyage philosophique passionnant nous entrerons dans le vif du débat éthique contemporain.

Notre monde toujours plus complexe semble nous échapper. Réchauffement climatique, questions de début et de fin de vie, évolution vertigineuse des bio-technologies, inégale distribution des richesses, pressions migratoires accentuées… La tentation est grande d’une vie morale repliée sur elle-même à partir d’une éthique minimale : « fais ce que tu veux, du moment que tu ne mets pas en péril la liberté des autres ». Nous proposons de prendre le contre-pied : défendre l’idée d’une éthique qui nous plonge dans notre réalité sociale et politique, parmi nos semblables et avec eux. Et pour cela nous reposons la question de ce qui est juste, de ce qui est bien. Sans repartir de rien, sans tout réinventer.
C’est pourquoi nous présentons un cours qui permet de se familiariser avec les plus importantes perspectives éthiques traversant le monde contemporain : l’éthique des vertus (ou perfectionnisme) ; l’éthique du devoir (ou déontologisme) ; l’éthique utilitariste (ou conséquentialisme) ; l’éthique de l’amour (ou éthique du don). Ainsi chacun pourra mettre de l’ordre dans ses idées, repérer les différentes manières de s’orienter dans la vie morale, comprendre les différences d’appréciation face aux diverses situations qui interpellent et sollicitent.

Quels que soient votre champ de savoir académique, votre engagement professionnel ou vos choix personnels, il s’agit de proposer des clés d’analyse dont vous disposerez. Pour cela, nous alternerons tout au long de ce cours les présentations des grands courants, sous leur forme ancienne puis contemporaine, et des questions plus transversales ou des cas concrets. Avec un seul but : clarifier les idées pour mieux comprendre le réel et mieux orienter l’action.
- - - - - - - - - - - - - - - - - - - - - - - - - - -
About this course:

This course presents the main schools of thought that frame today’s ethical reflection and affect everyone in their personal, social and civic life. From Aristotle to Kant, from Bentham to Derrida, we will take you to the heart of contemporary ethical debates through a fascinating philosophical journey. Our increasingly complex world seems to elude our grasp. Global warming, beginning and end-of-life issues, the dizzying evolution of bio-technologies, the unequal distribution of wealth, heightened migratory pressures ... In response, we are tempted to make the moral life a self-legislating and isolated affair: ""do what you want, as long as you do not put at risk the freedom of others"". We propose to go against this trend and to defend the idea of ​​an ethics that immerses us in our social and political reality, in and amongst our peers. We thus reformulate the question of what is right and what is good. This is not to say we are starting from scratch and reinventing the wheel. Rather, we will offer a course that allows you to encounter the most important ethical perspectives of our contemporary world: virtue ethics (or perfectionism); ethics of duty (or deontology); utilitarianism (or consequentialism); ethics of love (or ethics of the gift). Everyone will thus have a chance to evaluate his or her ideas, to identify different approaches to the moral life, and to understand a range of perspectives on different situations that face us in our lives. Whatever your field of academic knowledge, your professional commitments or personal choices, this course presents key concepts for further analysis. Therefore, we will alternate discussions of the founding schools of ethical thought, in their ancient and contemporary formulations, with cross-disciplinary issues and applied case studies. The goal throughout is to clarify ideas in order to better understand reality and orient human action.

- - - - - - - - -- - - -- - - - - - - -- - - - - - -- 
善、正义、功用：哲学伦理学导论
 
本课程旨在向大家介绍伦理学的主要流派，这些流派对如今的伦理思考意义非凡，并且涉及到每个人的个人生活、社会生活和公民生活。
从亚里士多德到康德，从边沁到德里达，通过引人入胜的哲学之旅，我们将进入当代伦理学辩论的核心问题。",26313.0,15292.0,4.8,565.0
Love as a Force for Social Justice,https://www.coursera.org/learn/love-social-justice,Arts and Humanities,Philosophy,Anne Firth Murray,"The objectives of this course are:

-To introduce participants to different concepts of love, to empower them to be conscious of the power of love and the possibility of practicing it in everyday life, and to highlight in particular the idea of love as a force for social justice.

-To communicate a sense of personal strength and empowerment by actively learning from each other and beginning to define how participants can apply their learning in service to society.

This course will explore the concept of agape love (compassion/kindness) as a force for social justice and action and as the inspiration for service and the application of knowledge to positive social change. Biological, psychological, religious, and social perspectives of love will be discussed, drawing on the expertise of people from a variety of disciplines. 

During the six-week course, the following topics will be raised and discussed: kinds of love/defining love; non-violent communication; love and the biology of the brain; love as a basic concept of religious and ethical beliefs (e.g., Judaism, Christianity, Islam, Buddhism, Gandhian); love applied in action, and poetic expressions of love as a social force. This curriculum aims to foster a sense of the importance of love as a key phenomenon in creating community, connection, and functional societies among humans.

Course materials will draw from a variety of sources. One of the goals of the class is to provide participants with some knowledge of the literature of love, and readings for the course are listed in the outline of the course on the pages that follow.",33165.0,16090.0,4.7,376.0
