name,url,category,subcategory,instructors,description,enrollment,views,rating,raters
Reason and Persuasion: Thinking Through Three Dialogues By Plato,https://www.coursera.org/learn/plato-dialogues,Arts and Humanities,Philosophy,"John Holbo, Associate Professor","In this course we study the ancient, Socratic art of blowing up your beliefs as you go, to make sure they're built to last. We spend six weeks studying three Platonic dialogues - ""Euthyphro"", ""Meno"", ""Republic"" Book I - then two weeks pondering a pair of footnotes to Plato: contemporary moral theory and moral psychology. 

Platonic? Socratic? Socrates was the teacher, but he said he never did. Plato was the student who put words in his teacher's mouth. You'll get a feel for it.

We have a book: the new 4th edition of ""Reason and Persuasion"", by the instructor (and his wife, Belle Waring, the translator.) It contains the Plato you need, plus introductory material and in-depth, chapter-length commentaries. (Don't worry! John Holbo knows better than to read his book to the camera. The videos cover the same material, but the presentation is different.) 

The book is offered free in PDF form - the whole thing, and individual chapter slices. It is also available in print and other e-editions. See the course content for links and information.

The course is suitable for beginning students of Plato and philosophy, but is intended to offer something to more advanced students as well. We seek new, odd angles on old, basic angles. Tricky! The strategy is to make a wide-ranging, interdisciplinary approach.  Lots of contemporary connections, to make the weird bits intuitive; plus plenty of ancient color, still bright after all these years. So: arguments and ideas, new possibilities, old stories, fun facts. Plus cartoons. 

The results can get elaborate (some book chapters and some lesson videos run long.) But each video comes with a brief summary of its contents. The lessons progress. I put them in this order for reasons. But there's no reason you can't skip over and around to find whatever seems most interesting. There are any number of self-contained mini-courses contained in this 8-week course. You are welcome to them.

Plato has meant different things to different people. He's got his own ideas, no doubt. (Also, his own Ideas.) But these have, over the centuries, been worn into crossing paths for other feet; been built up into new platforms for projecting other voices. (Plato did it to Socrates, so fair is fair.) So your learning outcome should be: arrival somewhere interesting, in your head, where you haven't been before. I wouldn't presume to dictate more exactly.",34082.0,5317.0,4.5,278.0
Reasoning Across the Disciplines,https://www.coursera.org/learn/critical-reasoning,Arts and Humanities,Philosophy,Dr. Ram  Neta,"Critical reasoning skills are a key success factor for students entering their first year of college. They must be able to think logically and form arguments. This course, designed with incoming college freshmen in mind but open to anyone, provides an essential grounding in critical reasoning skills. Faculty from multiple disciplines at the University of North Carolina at Chapel Hill offer guidance on applying critical thinking skills in the context of specific disciplines. By developing these skills, students will learn more, enjoy their courses more, and experience greater academic success.

This course will help you understand what critical thinking skills are and why they're so important. You will also learn how critical thinking skills vary across disciplines, as well as see them applied across several fields, including, chemistry, history, psychology, law, English, and American Studies. You will develop your own critical thinking skills by working through scenarios or problems posed by scholars across these fields, and you will better understand how your college courses will differ from your earlier education.",13860.0,5805.0,4.3,56.0
Relativism,https://www.coursera.org/learn/relativism,Arts and Humanities,Philosophy,Annalisa Coliva,"Relativism is an ancient philosophical doctrine which has recurred time and again in the history of philosophy. It has also transcended the boundaries of that discipline, for it has shaped much of the methodology in anthropology and sociology, as well as in critical theory and literary studies. While often advocated for its supposed tolerance of differences, relativism has profound consequences for how we think of reality, for the possibility of knowledge, both in the factual and in the moral domain, and may engender the practice of double standard. 

If a wind is hot for me and cold for you and none of us is at fault, does this mean that reality is always perspectival, or that it admits of contradictory descriptions? If a belief turns out to be justified when evaluated within a certain epistemic system (such as religion, for instance), while it turns out to be unjustified if assessed from within a different one (science, say), does relativism undermine the very possibility of knowledge? If an action can be morally permissible within an ethical system and not so within a different one, does that challenge the idea that there are moral truths and moral progress? These are some of the questions we will engage in during the course, while considering examples taken from the history of science, such as the Bellarmine-Galileo dispute, and from everyday life.

This course is aimed at anyone who is interested in learning more about philosophy, along with those who are looking for strategies to combat extremism in their communities. Using these approaches, no matter what your skill levels in topics you would like to master, you can change your thinking and change your life.

In this course, learners will:

Explore the concept of Relativism
Discuss the role of Relativism in contemporary society
Identify common responses to Relativism
Compare/Contrast various forms of Relativism 
Recognize how epistemic relativism can be used to explain important events in the history of science and crucial discoveries in anthropology
Create a presentation with your personal perspective on one of the forms of relativism",6618.0,3735.0,4.2,35.0
Representaciones culturales de las sexualidades,https://www.coursera.org/learn/representaciones-culturales,Arts and Humanities,Philosophy,"Meri Torras Francès, Aina Pérez Fontdevila, Noemí Acedo Alonso, Jéssica Faciabén, Michelle Gama Leyva, Teresa López-Pellisa","¿Queer? ¿Género? ¿transgénero?

Desde los estudios de género, los estudios queer y los estudios culturales, este curso quiere familiarizaros con las representaciones culturales de las sexualidades no normativas en la cultura contemporánea.
Planteamos diversos marcos teóricos y ejemplos prácticos a partir de los cuales reflexionar sobre las construcciones corporales e identitarias de las personas lesbianas, gays, transgénero, transexuales, queer, heterosexuales, etc. en diversos soportes culturales como el cine, la literatura, internet, la televisión o las artes plásticas.
De este modo, queremos contribuir al análisis de los discursos normativos sobre el género y la sexualidad que nos construyen como sujetos y nos proporcionan posiciones jerárquicas dentro del marco social.
Entendemos que las representaciones culturales son espacios privilegiados para llevar a cabo este análisis, porque en ellos se materializan tanto los discursos hegemónicos como sus posibilidades de subversión. 
Si estás interesado en la cultura, el género y la sexualidad, te invitamos a descubrir este curso. No necesitas conocimientos previos. Si ya estás familiarizad@ con la temática, queremos ofrecer contenidos sugestivos sin descuidar las reflexiones y explicaciones necesarias para aquellos que os adentráis en ella por primera vez.",43259.0,17432.0,4.8,608.0
"Revolutionary Ideas: Borders, Elections, Constitutions, Prisons",https://www.coursera.org/learn/revolutionary-ideas-borders-elections-constitutions-prisons,Arts and Humanities,Philosophy,Alexander  Guerrero,"What is the purpose of government?  Why should we have a State?  What kind of State should we have?

Even within a political community, there may be sharp disagreements about the role and purpose of government.  Some want an active, involved government, seeing legal and political institutions as the means to solve our most pressing problems, and to help bring about peace, equality, justice, happiness, and to protect individual liberty.  Others want a more minimal government, motivated, perhaps, by some of the disastrous political experiments of the 20th Century, and the thought that political power is often just a step away from tyranny.  In many cases, these disagreements arise out of deep philosophical disagreements. 

All political and legal institutions are built on foundational ideas.  In this course, we will explore those ideas, taking the political institutions and political systems around us not as fixed and unquestionable, but as things to evaluate and, if necessary, to change.  We will consider the ideas and arguments of some of the world’s most celebrated philosophers, including historical thinkers such as Plato, Hugo Grotius, David Hume, Thomas Jefferson, and James Madison, and more contemporary theorists such as Michelle Alexander, Kwame Anthony Appiah, Bryan Caplan, Angela Davis, Ronald Dworkin, Jon Elster, John Hart Ely, H.L.A. Hart, Michael Huemer, Andrew Rehfeld, and Jeremy Waldron.

The aim of the course is not to convince you of the correctness of any particular view or political position, but to provide you with a deeper and more philosophically-informed basis for your own views, and, perhaps, to help you better understand the views of those with whom you disagree.",7514.0,2244.0,4.9,24.0
"Revolutionary Ideas: Utility, Justice, Equality, Freedom",https://www.coursera.org/learn/revolutionary-ideas-utility-justice-equality-freedom,Arts and Humanities,Philosophy,Alexander  Guerrero,"What is the purpose of government?  Why should we have a State?  What kind of State should we have?

Even within a political community, there may be sharp disagreements about the role and purpose of government.  Some want an active, involved government, seeing legal and political institutions as the means to solve our most pressing problems, and to help bring about peace, equality, justice, happiness, and to protect individual liberty.  Others want a more minimal government, motivated, perhaps, by some of the disastrous political experiments of the 20th Century, and the thought that political power is often just a step away from tyranny.  In many cases, these disagreements arise out of deep philosophical disagreements. 

All political and legal institutions are built on foundational ideas.  In this course, we will explore those ideas, taking the political institutions and political systems around us not as fixed and unquestionable, but as things to evaluate and, if necessary, to change.  We will consider the ideas and arguments of some of the world’s most celebrated philosophers, including historical thinkers such as Plato, Aristotle, Thomas Hobbes, John Locke, Immanuel Kant, Mary Wollstonecraft, and John Stuart Mill; and more contemporary theorists such as Elizabeth Anderson, Isaiah Berlin, Thomas Christiano, Frantz Fanon, Amy Gutmann, Friedrich Hayek, Robert Nozick, Martha Nussbaum, Julius Nyerere, Ayn Rand, John Rawls, Peter Singer, and Kok-Chor Tan. 

The aim of the course is not to convince you of the correctness of any particular view or political position, but to provide you with a deeper and more philosophically-informed basis for your own views, and, perhaps, to help you better understand the views of those with whom you disagree.",19282.0,6255.0,4.7,160.0
Science & Religion 101,https://www.coursera.org/learn/science-and-religion-101,Arts and Humanities,Philosophy,Denis Lamoureux,"This course examines the nature of both science and religion and attempts to explore the possible relationships between them. The primary purpose is to dispel the popular myth that science and religion are entrenched in a never-ending conflict. As a result, this course argues that if the limits of both science and religion are respected, then their relationship can be complementary.

Topics include: Science and Religion Categories and Foundational Principles, Definitions of Science and Religion, Science-Religion Models and Relationships, Intelligent Design and Natural Revelation, the Galileo Affair, Geology and Noah’s Flood, Evolution and Darwin’s Religious Beliefs, the Modern “Evolution” vs. “Creation” Debate, the Problem of Evil, and Interpretations of the Biblical Accounts of Origins in Genesis 1-11.

The course employs a Constructive Teaching Style in order that students can develop their personal views on the relationship between science and religion and on each of the topics listed above.

St. Joseph's College is a Catholic, undergraduate, liberal arts college on the University of Alberta campus. It is an independent institution that is affiliated with the University of Alberta.

Denis O. Lamoureux is Professor of Science and Religion at St. Joseph's College in the University of Alberta. He is the author of Evolutionary Creation: A Christian Approach to Evolution (2008),  Evolution: Scripture and Nature Say Yes! (2016), and The Bible & Ancient Science: Principles of Interpretation (2020). Lamoureux is a Research Associate in Paleontology and has contributed to a dozen scientific papers. He is cited in the Who’s Who of Theology and Science and has delivered over 600 lectures throughout the United States and Canada. Lamoureux holds three earned 
doctoral degrees—dentistry, theology, and biology.",9811.0,7888.0,4.5,120.0
Skepticism,https://www.coursera.org/learn/skepticism,Arts and Humanities,Philosophy,Professor Duncan Pritchard,"Skepticism is about doubt, and doubt is everywhere in the world around us today. There are doubts about whether man-made climate change is real, whether vaccinations are harmful, whether we can trust our politicians or our media, and so on. When is such skepticism warranted, and when does it stray into unreasonable territory? How widespread can such skepticism get while still being coherent? How might a radical skepticism have pernicious social consequences, such as by leading to relativism (and just what is relativism, and what is problematic about it)? 

These are all questions that we will be engaging with in this course Along the way we will consider some important philosophical issues, such as what the nature of knowledge is, whether there are any good arguments that show that knowledge is impossible, and how a moderate skepticism might accord with an ancient conception of the good life of human flourishing, one that essentially involves the intellectual virtues. 

This course is aimed at anyone who is interested in learning more about philosophy, along with those who are looking for strategies to combat extremism in their communities. Using these approaches, no matter what your skill levels in topics you would like to master, you can change your thinking and change your life.

In this course, learners will:

Explore the concept of Skepticism
Discuss the role of Skepticism in contemporary society
Identify common responses to Skepticism
Compare/Contrast various forms of Skepticism
Apply knowledge of Skepticism to form a personal stance 
Recognize why knowledge is more than just true belief",8202.0,7158.0,4.7,58.0
South Asian Religions & Ecology,https://www.coursera.org/learn/south-asian-religions-ecology,Arts and Humanities,Philosophy,"Mary Evelyn Tucker, John Grim","At first glance the fields of religion and ecology may seem and unlikely pairing, but a deeper consideration reveals the two have a great deal to contribute to one another and are indeed inextricably linked. Religions recognize the unity and interdependence of humans with nature. Ecological sciences affirm this deep interconnection with the natural world. This partnership can inspire work for the wellbeing of the Earth community

There is a need for broader literacy and deeper knowledge of the world’s religions and their ecological contributions. This specialization, ""Religions and Ecology: Restoring the Earth Community"", contributes such a perspective. Each course celebrates the vitality of religiously-informed action for the Earth and recognizes the longstanding contributions of Indigenous peoples in offering visions and practices for ecological flourishing. 

This course is part 3 of 5 of the ""Religions and Ecology: Restoring the Earth Community"" specialization that focuses on the ecological dimensions of religious traditions throughout the world.

The course you are about to begin is designed as a gateway to these aspects of the South Asian religions, philosophies, and practices of Hinduism, Jainism, Yoga, Buddhism, Sikhism, and Baha’i Faith. So much has emerged in the last several decades in this area, as you will see. While we have taught this course at Yale, we have adapted it for learners from a wide range of backgrounds.

This course is for lifelong learners curious to know more about world religions and ecology, environmental professionals eager to deepen the discourse of environmental protection and conservation, those working with non-profit organizations and NGOs on issues of ecological justice, and religion leaders and laity who wish to know how they can contribute to interreligious dialogue on environmental projects.",,3743.0,,
"Søren Kierkegaard - Subjectivity, Irony and the Crisis of Modernity",https://www.coursera.org/learn/kierkegaard,Arts and Humanities,Philosophy,"Jon Stewart, PhD, Dr theol & phil","It is often claimed that relativism, subjectivism and nihilism are typically modern philosophical problems that emerge with the breakdown of traditional values, customs and ways of life. The result is the absence of meaning, the lapse of religious faith, and feeling of alienation that is so widespread in modernity. 

The Danish thinker Søren Kierkegaard (1813-55) gave one of the most penetrating analyses of this complex phenomenon of modernity. But somewhat surprisingly he seeks insight into it not in any modern thinker but rather in an ancient one, the Greek philosopher Socrates.

In this course created by former associate professor at the Søren Kierkegaard Research Centre, Jon Stewart, we will explore how Kierkegaard deals with the problems associated with relativism, the lack of meaning and the undermining of religious faith that are typical of modern life. His penetrating analyses are still highly relevant today and have been seen as insightful for the leading figures of Existentialism, Post-Structuralism and Post-Modernism.",54690.0,12862.0,4.8,688.0
The Epistemic Quest for Truth: Introduction to epistemology,https://www.coursera.org/learn/epistemology,Arts and Humanities,Philosophy,Tim De Mey,"The introduction of the internet and of social media has drastically changed our information position. We live in a time of ‘truth decay’: the distinction between opinions and facts is blurred, opinions have more impact than facts, and sources of factual information are increasingly distrusted. Since philosophers love truth, they deplore these tendencies. But what can they do about them?

In this course, you will be invited to reflect on whether, in what sense and to what extent, 2500 years of normative epistemology, or theory of knowledge, can be put into practice and help to reduce truth decay. You’ll be invited, more specifically, to reflect on
- the theory of knowledge,
- the analysis of knowledge,
- the possibility of knowledge,
- the structure of knowledge,
- the kinds of knowledge, and
- the value of knowledge.
Think of a pressing example of truth decay that strikes you and wonder how epistemology may go against it.",,5039.0,,
The Modern and the Postmodern (Part 1),https://www.coursera.org/learn/modern-postmodern-1,Arts and Humanities,Philosophy,Michael S. Roth,"This course examines how the idea of ""the modern"" develops at the end of the 18th century in European philosophy and literature, and how being modern (or progressive, or hip) became one of the crucial criteria for understanding and evaluating cultural change. Are we still in modernity, or have we moved beyond the modern to the postmodern?",110831.0,31052.0,4.8,919.0
The Politics of Skepticism,https://www.coursera.org/learn/erasmus-philosophy-skepticism,Arts and Humanities,Philosophy,"Wiep van Bunge, Tim De Mey","This is a course about the history of Skepticism from the ancient Greeks to today, with special attention to the political ramifications of questioning man's ability to know the world and himself with any certainty. We will discuss the debates raging between Plato and the Sophists, the rise of Christianity in the Roman world, and the so-called 'Skeptical Crisis' of the Renaissance as well as Pierre Bayle's Skepticism and David Hume's. In addition the Natural Law tradition will be explored and the relationship between Skepticism and Conservatism.

In the second part, we will explore the systematic relations between Skepticism and politics. What is skeptical doubt? When is doubt relevant? How does Skepticism relate to tolerance and to freedom of expression? And can it help us to solve political problems not only in a critical, but also in a creative way?",8129.0,3175.0,4.4,36.0
Thought Experiments: An introduction to philosophy,https://www.coursera.org/learn/thought-experiments,Arts and Humanities,Philosophy,Tim De Mey,"Doing philosophy is like seeing a movie and wondering what will happen next, or what you would do in the same situation, or what’s real and what’s merely make-believe.

You’re probably not aware of it, but since you already know how to see movies and use your imagination, you’re well on your way to becoming a good philosopher. The only thing you still need and want to develop though, is the ability to use your imagination in the philosophical way, and that’s exactly what you’ll learn in this MOOC.

Firstly, you’ll learn how to use your imagination to put definitions, analyses or conceptions of philosophically relevant notions to the test by means of imaginary examples and counterexamples, addressing questions that have been part and parcel of Western philosophy since its very inception, such as 
- ‘what is knowledge?’;
- ‘what is the mind?’;
- ’what is moral responsibility?’; and
- ‘what is justice?’.

Subsequently, you’ll learn how to use your imagination to develop your worldview. You’ll learn to speculate about what might explain your experiences, ranging from the commonsense explanation in terms of a mind-independent world, to sceptical alternatives, such as that you’re systematically misled by an evil demon or that only your mind exists and that it confabulates all the rest.

Finally, since philosophy is not only about interpreting the world, but also about changing it -and hopefully, for the better- you’ll also learn how to use your imagination to evaluate what the right thing to do is in a given situation, what the criteria are to evaluate actions, and whether such criteria are established evermore or remain an open question.",2499.0,7270.0,,
Western Religions & Ecology,https://www.coursera.org/learn/western-religions-ecology,Arts and Humanities,Philosophy,"Mary Evelyn Tucker, John Grim","At first glance the fields of religion and ecology may seem and unlikely pairing, but a deeper consideration reveals the two have a great deal to contribute to one another and are indeed inextricably linked. Religions recognize the unity and interdependence of humans with nature. Ecological sciences affirm this deep interconnection with the natural world. This partnership can inspire work for the wellbeing of the Earth community

There is a need for broader literacy and deeper knowledge of the world’s religions and their ecological contributions. This specialization, ""Religions and Ecology: Restoring the Earth Community"", contributes such a perspective. Each course celebrates the vitality of religiously-informed action for the Earth and recognizes the longstanding contributions of Indigenous peoples in offering visions and practices for ecological flourishing. 

This course is part 5 of 5 of the ""Religions and Ecology: Restoring the Earth Community"" specialization that focuses on the ecological dimensions of religious traditions throughout the world.

The course you are about to begin is designed as a gateway to these aspects of the three Western religions of Judaism, Christianity, and Islam. So much has emerged in the last several decades in this area, as you will see. While we have taught this course at Yale, we have adapted it for learners from a wide range of backgrounds.

This course is for lifelong learners curious to know more about world religions and ecology, environmental professionals eager to deepen the discourse of environmental protection and conservation, those working with non-profit organizations and NGOs on issues of ecological justice, and religion leaders and laity who wish to know how they can contribute to interreligious dialogue on environmental projects.",,4710.0,,
