name,url,category,subcategory,instructors,description,enrollment,views,rating,raters
Soul Beliefs: Causes and Consequences - Unit 2: Belief Systems,https://www.coursera.org/learn/soulbeliefs2,Arts and Humanities,History,"Prof. Daniel M. Ogilvie, Prof. Leonard W. Hamilton","Throughout history, the vast majority of people around the globe have believed they have, however defined, a “soul.” While the question of whether the soul exists cannot be answered by science, what we can study are the causes and consequences of various beliefs about the soul and its prospects of surviving the death of the body. Why are soul and afterlife beliefs so common in human history? Are there adaptive advantages to assuming souls exist?  Are there brain structures that have been shaped by environmental pressures that provide the foundation of body/mind dualism that is such a prominent feature of many religions? How do these beliefs shape the worldviews of different cultures and our collective lives? What is the role of competing afterlife beliefs in religion, science, politics, and war? This course explores several facets of this relatively unexplored but profoundly important aspect of human thought and behavior.

The course consists mainly of 70 to 80 minute lectures, typically broken up into 3 segments, recorded from a course offered by Rutgers University School of Arts and Sciences.  These videos include slides and some embedded video clips.  Most lectures are accompanied by slides used during the lecture, also including recommended reading assignment which may provide additional opportunities to reflect on your studies.

Due to the lengthiness of this class and natural progression, the online course has been separated into 3 units, this is Unit 2.",16338.0,2313.0,4.6,167.0
Storytelling in Branding and Content Marketing,https://www.coursera.org/learn/brand-and-content-marketing,Arts and Humanities,History,Pedro Cifuentes Huertas,"Storytelling in Branding and Content Marketing is an IE University course for professionals who want to learn how to produce memorable content through quality storytelling.

Students will go through a learning process that will start with a deep understanding of the term Branded Content and its main differences with traditional advertising, simultaneously creating an effective storyline based on strong brand values and messages. The course analyses the production of quality journalism and explores how to create memorable and long-lasting connections with a given target audience in a world of constant content surplus. It concludes with a deeper insight into the term of Brand Entertainment, giving them the opportunity to amplify their knowledge about how to produce a good call to action and retain the audience's attention.",21979.0,45633.0,4.4,228.0
Structuring Values in Modern China,https://www.coursera.org/learn/structuring-values-modern-china,Arts and Humanities,History,Prof. John Lagerwey,"This sequence of four courses will propose a multi-disciplinary approach to the study of Chinese cultural history conceived of as a succession of modes of rationality (philosophical, bureaucratic, and economic). The focus will be on the moments of paradigm shift from one mode of rationality to another. For each of these moments, cultural facts and artifacts—thought, literature, ritual—will be examined in relationship to changing social, political, and economic systems.

The first two courses will cover the periods of the Warring States (481-256 BCE) and the Period of Division (220-589 CE), with a brief excursion into the Han (206 BCE-220 CE). The Warring States laid the social and cultural foundations for the emergence of the imperial mode of rationality; the Period of Division saw the Buddhist “conquest” of China and the emergence of a rationality defined by the opposition of the Three Teachings to shamanism, that is, of a clear contrast between elite and popular culture.

The third and fourth courses will focus on the emergence of modern China in the Song-Yuan (960-1368) and of today’s China 1850 to the present. We will see how the modern attack on religion, redefined as ""superstition"", led not only to religious reform movements but also to a society in which science and the nation became the primary value systems promoted by the state.

The courses are listed below:

A Critical Cultural History of China - Early China I: Intellectual Change in the Warring States and Han (481 BCE-220 CE)
A Critical Cultural History of China - Early China II: Religious Transformation in the Period of Division (220-589 CE)
A Critical Cultural History of China - Modern China I: Religion and Thought in the Song, Jin, and Yuan (960-1368) 
A Critical Cultural History of China - Modern China II: Structuring Values (1850-2015)",3287.0,16434.0,4.7,29.0
Sustainable Development - Ideas and Imaginaries,https://www.coursera.org/learn/sustainable-development-ideas-and-imaginaries,Arts and Humanities,History,Bo Fritzbøger,"Ideas and imaginaries inspire human capacity for great endeavours, but ‘conventional wisdom’ frequently prevents necessary change. Achievement of global sustainable development is, therefore, dependent on a profound comprehension of the preunderstandings and implicit imaginaries that form both our perception of reality and our basic confidence in the viability of transgressive action.  

The present-day concept and ideal of sustainable development contains many interlaced meanings and many contradictions. In order to bring out the concept’s indisputable transformative potential, and be able to gain support, promote decision-making and take action in it, it is, therefore, requisite to disentangle this mélange and shed light to the implicit preunderstandings .

This course will contribute to doing so by focusing on the historical roots and multiple layers of meaning of sustainable development, and by exploring questions such as: ‘What is the historical background of the current Sustainable Development Goals?’, ‘Which imaginaries about relations between individual and collective tend to promote and prevent sustainable solutions?’, ‘How can ideas about humans and nature affect global development?’, And ‘how do we as humans react on inconstant notions of time and change?’

During this course, you will meet associate professor in history Bo Fritzbøger from Centre for Sustainable Futures as the primary lecturer and a range of cultural, natural and social scientists, all from the University of Copenhagen working with different aspects of sustainability thinking.

We hope that you will join us in the course and qualify your participation in current discussions about how to achieve common sustainable development in a divided world.",,2791.0,,
"Textual Elements of Design: Fonts, Typography, and Spacing",https://www.coursera.org/learn/fonts-typography-spacing,Arts and Humanities,History,Lori Poole,"Graphic design is telling a story by using both images and text. With that definition in mind, this course will focus on the textual elements of graphic design. From the history of typography, the difference between type, fonts and text as well as exposure to typography spacing, students will learn the value of selecting the best kind of type and combinations of fonts to get their message across in a visually pleasing manner.",15383.0,13337.0,4.7,226.0
The Ancient Greeks,https://www.coursera.org/learn/ancient-greeks,Arts and Humanities,History,"Andrew Szegedy-Maszak, PhD","This is a survey of ancient Greek history from the Bronze Age to the death of Socrates in 399 BCE. Along with studying the most important events and personalities, we will consider broader issues such as political and cultural values and methods of historical interpretation.",99647.0,44190.0,4.7,1872.0
"The Bible's Prehistory, Purpose, and Political Future",https://www.coursera.org/learn/bible-history,Arts and Humanities,History,Dr. Jacob L. Wright,"With its walls razed to ground by Babylon’s armies, Jerusalem joined a long line of ancient vanquished cities—from Ur and Nineveh and Persepolis to Babylon itself. While some recovered from the destruction, others did not.  But none responded to political catastrophe by fashioning the kind of elaborate and enduring monument to their own downfall that we find in the Bible. Most conquered populations viewed their subjugation as a source of shame. They consigned it to oblivion, opting instead to extol the golden ages of the past.  The biblical authors in contrast reacted to loss by composing extensive writings that acknowledge collective failure, reflect deeply upon its causes, and discover thereby a ground for collective hope.  

Working through colorful biblical and ancient Near Eastern texts, and drawing on an array of comparative examples, the course illustrates the thoroughgoing manner with which biblical authors responded to defeat by advancing a demotic agenda that places the community at the center. The aim of the biblical authors was to create a nation, and they sought to realize this goal via a shared text, which includes stories and songs, wisdom and laws. This corpus of writings belongs, without a doubt, to humanity’s greatest achievements. Whereas the great civilizations of the Near East invested their energies and resources into monuments of stone that could be destroyed by invading armies, the biblical authors left a literary legacy that has been intensively studied until the present day. More important, these authors’ visionary response to defeat brought to light a radical new wisdom:  the notion that a people is greater than the state which governs it, and that a community can survive collapse when all of its members can claim a piece of the pie and therefore have a reason to take an active part in its collective life.",25503.0,10195.0,4.7,266.0
The Changing Landscape of Ancient Rome. Archaeology and History of the Palatine Hill,https://www.coursera.org/learn/palatine-hill-archaeology-history,Arts and Humanities,History,Paolo Carafa,"Studying ancient - as well as medieval or modern - cities basically means telling local urban stories based on the reconstruction of changing landscapes through the centuries. Given the fragmentary nature of archaeological evidence, it is necessary to create new images that would give back the physical aspect of the urban landscape and that would bring it to life again. We are not just content with analyzing the many elements still visible of the ancient city. The connections between objects and architectures, visible and non visible buildings, which have been broken through time have to be rejoined, to acknowledge the elements that compose the urban landscape. 

Landscape and its content are a very relevant and still vital part of any national cultural heritage. The course will introduce students to the way we have been reflecting on over the last twenty years and still are engaged with the study of the past of our cities, beginning from the most complex case in the ancient Mediterranean World: the core of Italy and of Roman Empire. On the other hand, knowledge means also preservation and defense of material remains and cultural memory.

“The Changing Landscape of Ancient Rome. Archeology and History of the Palatine Hill” presents to a large public the topographical lay-out of the most relevant part of the city (according the Greek and Roman Historians Rome was founded on the Palatine). Research developed on the Palatine since the end of last century by the team of Sapienza Classical Archaeologists opened a new phase in the urban archaeological investigation and in the scientific debate about the relation between archaeological features and literary tradition as well as the “correct use“ of both kind of evidence, key issues of wide archaeological and historical significance.",12851.0,20566.0,4.4,284.0
The Cosmopolitan Medieval Arabic World,https://www.coursera.org/learn/medieval-arabia,Arts and Humanities,History,Prof. dr. Petra Sijpesteijn,"Did you know that Arabic was for centuries the lingua franca in an area stretching from the south of Spain to the Chinese border? Did you know that the Middle East under Muslim rule in those days was the world’s beating heart of trade, but also of science and scholarship? 

Did you know that Islam in its formative period was heavily influenced by existing cultures in the region, like Indian, Greek, Persian and Byzantine culture? Did you know that for many centuries after the establishment of the Muslim Empire the majority of the population remained largely Christian and Jewish? 

Did you know that they held a protected status in Islamic law? Did you know that this generally open-minded, curious and open society stimulated many great innovations and inventions? 

Did you know that European scholarship in the Renaissance leaned heavily on the texts and inventions from the Middle East which were the outcome of this sophisticated advanced society? 

In this course we will focus on the fascinating history of the Arabic Medieval World. We will take you on a journey through the Middle Ages starting off in eighth-century Baghdad. Along the old pilgrim trails we will go to places like Mecca, Jerusalem and Najaf.  We will show you the impressive markets of places like Cairo and Samarkand. However we will not hide the dark sides of society either, by  introducing you to the flourishing widespread slave trade. We will visit the Abbasid court, the Harem of the caliph, and the palace of the Mamluk Sultan. We will show you some beautiful medieval manuscripts, that live on as the silent witnesses of the impressive achievements of scientists and medical doctors of this forgotten era. All along we will present you with historiographical debates and dilemma’s. Reflecting on the way we look at and interpret history. And while taking you on this journey, we will travel back and forth in time explaining to you how  events of the past affected and shaped the world as we know it today. 

Welcome to the Cosmopolitan Medieval Arabic World! Enroll now and follow this course for free.

---

Testimonial:

Dear Prof. Sijpesteijn
 
I am sending this email in gratitude for the Leiden University team for this course. Please thank the Faculty of Governance and Global Affairs for offering it on Coursera, the Faculty of Humanities for creating the lovely course content and the excellent reading material. Rarely have I seen an MOOC that is this well-researched and thought through. This is in addition to the excellent resources provided and the creative media. I finished the course and presently doing the honors-track.
 
If I may introduce myself, I am Radi Radi, a Palestinian-Jordanian who lives on ""Shajaret Al Dur"" St. in Amman, Jordan. It was quite an coincidence to learn about her here.  I work as a pilot and currently we are not flying anywhere currently so I thought of finishing this course. I am a Bachelor of Civil Engineering from Ryerson Univeristy, Canada and this really felt like the 100-level electives I took in that it really is a university-level course. 
 
I have bought a few books that I have read about in your course and that meant that I have something else to do in this corona-imposed hiatus. After
 
Once aviation kicks back into gear, I hope to be flying to Amsterdam Again. When that happens, I plan on bringing you guys a gift from Amman for your efforts.  
 
Many Thanks
Radi Radi",18861.0,11212.0,4.8,335.0
The Emergence of the Modern Middle East - Part I,https://www.coursera.org/learn/modern-middle-east-1,Arts and Humanities,History,Professor Asher  Susser,"This course will review the emergence of the modern Middle East from the fall of the Ottoman Empire, at the end of the First World War to the present. We will discuss the Ottoman legacy in the region and the Western imperial impact on the creation of the Arab state system. The course will review the rise and retreat of Arab nationalism, the problems of internal cohesion of the Arab states, issues of religion and state, and the evolution of Islamist politics. We will also focus on the evolution of the Arab-Israeli conflict and its impact on the region and will conclude with an in depth analysis of the “Arab Spring” by placing these contemporary revolutionary events in their historical context.

Please note that there is a second part to this course which is a direct extension of this part. We highly recommend to continue to the second part after you finish this one (https://www.coursera.org/learn/modern-middle-east-2/home/info).

This course will temporarily close for enrollment from March 1st, 2022 to August 31st, 2022. During this time, the course will be closed for new enrolments. All of the course materials will continue to be able available to previously enrolled learners; however, the course staff will not provide support in the Discussion Forums during this period. 

Best,
The Tel Aviv University Team",43744.0,10508.0,4.7,1073.0
The Emergence of the Modern Middle East - Part II,https://www.coursera.org/learn/modern-middle-east-2,Arts and Humanities,History,Professor Asher  Susser,"This course will discuss the developments in the Middle East from the early 20th century to the present. It will discuss the rise and retreat of Arab nationalism, the problems of internal cohesion of the Arab states, issues of religion and state, and the evolution of Islamist politics. It will also focus on the evolution of the Arab-Israeli conflict and its impact on the region and will conclude with an in depth analysis of the “Arab Spring” by placing these contemporary revolutionary events in their historical context.

Please note that this course builds upon a previous course -  The Emergence of the Modern Middle East - Part I (https://www.coursera.org/learn/modern-middle-east-1/home/welcome)

Learn about the history of the Middle East for a deeper understanding of current regional developments!

This course will temporarily close for enrollment from March 1st, 2022 to August 31st, 2022. During this time, the course will be closed for new enrolments. All of the course materials will continue to be able available to previously enrolled learners; however, the course staff will not provide support in the Discussion Forums during this period. 

Best,
The Tel Aviv University Team",17285.0,5858.0,4.8,474.0
The Fall and Rise of Jerusalem,https://www.coursera.org/learn/jerusalem,Arts and Humanities,History,"Professor Oded  Lipschits, Ph.D.","The destruction of the First Temple in Jerusalem and the Babylonian Exile were a great catastrophe in the history of the Jewish Nation.  

What really happened during that dark, fateful age, and how did new opportunities arise from the ashes?

This course will temporarily close for enrollment from March 1st, 2022 to August 31st, 2022. During this time, the course will be closed for new enrolments. All of the course materials will continue to be able available to previously enrolled learners; however, the course staff will not provide support in the Discussion Forums during this period. 

Best,
The Tel Aviv University Team",19281.0,7757.0,4.6,315.0
The French Revolution,https://www.coursera.org/learn/french-revolution,Arts and Humanities,History,Peter McPhee,"The French Revolution was one of the most important upheavals in world history. This course examines its origins, course and outcomes. 

This course is designed for you to work through successfully on your own. However you will not be alone on this journey. Use the resources included in the course and take part in the suggested learning activities to get the most out of your learning.  To successfully complete this course, it is recommended that you devote at least six hours to every module over the six weeks of the course. In that time you should watch the video lectures, reflect and respond to in-video pause points, and complete the quizzes.

As part of the required reading for this course, during each week of this course you will have free access to a chapter of Peter McPhee's textbook, The French Revolution, which is also available for purchase as an e-book.

View the MOOC promotional video here: http://tinyurl.com/gstw4vv",28701.0,4286.0,4.8,322.0
The History of Modern Israel -  Part II: Challenges of Israel as a sovereign state,https://www.coursera.org/learn/history-israel-sovereign-state,Arts and Humanities,History,"Professor Eyal Naveh, Professor Asher  Susser","This course deals with the Israeli politics, economy, society and culture, since its creation in 1948 till today. It analyzes the construction of the Israeli historical narrative as an identity-building narrative, intending to inculcate a collective memory to a diverse society. We will focus on key events and essential components that shaped the Israeli society from the fifties till the present. We will also discuss the changes that the Israeli society experiences in its almost seventy years of existence and how it affects its politics and culture. Among the topics we will discuss issues such as immigration, economic transformation, political upheaval, religious Zionism and post-Zionism, privatization and Americanization, Holocaust increasing role in shaping Israel's identity, diversity and multiculturalism, as well as the enduring conflict with the Palestinians and the Arab world.

This course is a direct extension of the first part ""The History of Modern Israel: From an Idea to a State"", so if you have not yet taken it, we highly recommend you start your learning from there (https://www.coursera.org/learn/history-israel/).

In order to receive academic credit for this course you must successfully pass the academic exam on campus. For information on how to register for the academic exam – https://tauonline.tau.ac.il/registration

Additionally, you can apply to certain degrees using the grades you received on the courses. Read more on this here – 
https://go.tau.ac.il/b.a/mooc-acceptance

Teachers interested in teaching this course in their class rooms are invited to explore our Academic High school program here – https://tauonline.tau.ac.il/online-highschool


* This course is a joint effort of Tel Aviv University &  Israel Institute (www.israelinstitute.org)
* This course uses media material from various archives, courtesy to Yad Vashem Archive for their help.
* This course is self-paced. Once you register,  you can participate in the course anytime, as often as you wish and over any stretch of time",10535.0,3227.0,4.8,322.0
The History of Modern Israel - Part I: From an Idea to a State,https://www.coursera.org/learn/history-israel,Arts and Humanities,History,"Professor Eyal Naveh, Professor Asher  Susser","How did the State of Israel come to be? How is it that an idea, introduced in 19th century Europe, became a reality? And how does that reality prevail in the harsh complexities of the Middle East?

Presented by Professor Eyal Naveh, with additional units from Professor Asher Sussers' ""The Emergence of the Modern Middle East"" course, This course will take you on a journey through the history of Modern Israel. In this 1st part of the course we will explore:

How did the 19th century idea of a Jewish state become a reality? 

So the next time you hear about Israel in the news, you will be informed enough about the history of this area to comprehend the many sides and narratives that interact to shape the complex reality of Israel today.

Please note that there is a second part to this course ""The History of Modern Israel - Part II: Challenges of Israel as a sovereign state"" which is a direct extension of this part. We highly recommend to continue to the second part after you finish this one (https://www.coursera.org/learn/history-israel-sovereign-state).

In order to receive academic credit for this course you must successfully pass the academic exam on campus. For information on how to register for the academic exam – https://tauonline.tau.ac.il/registration

Additionally, you can apply to certain degrees using the grades you received on the courses. Read more on this here – 
https://go.tau.ac.il/b.a/mooc-acceptance

Teachers interested in teaching this course in their class rooms are invited to explore our Academic High school program here – https://tauonline.tau.ac.il/online-highschool


* This course is a joint effort of Tel Aviv University &  Israel Institute (www.israelinstitute.org)
* This course uses media material from various archives, courtesy to Yad Vashem Archive for their help.
* This course is self-paced. Once you register,  you can participate in the course anytime, as often as you wish and over any stretch of time",36831.0,5815.0,4.6,756.0
