name,url,category,subcategory,instructors,description,enrollment,views,rating,raters
A Brief History of Human Spaceflight,https://www.coursera.org/learn/human-spaceflight,Arts and Humanities,History,Dr. Chuck Layne,"This course provides a view of the history of spaceflight, from early writings telling of human's fascination of space through the early Russian and American space stations. Developed as an interesting and entertaining slice of space history that is accessible to anyone with an interest in human spaceflight",16198.0,4052.0,4.4,406.0
A Journey through Western Christianity: from Persecuted Faith to Global Religion (200 - 1650),https://www.coursera.org/learn/western-christianity-200-1650,Arts and Humanities,History,Bruce Gordon,"This course follows the extraordinary development of Western Christianity from its early persecution under the Roman Empire in the third century to its global expansion with the Jesuits of the early modern world. We explore the dynamic and diverse character of a religion with an enormous cast characters. We will meet men and women who tell stories of faith as well as of violence, suppression, and division. Along the way, we encounter Perpetua and her martyrdom in Carthage; the struggles of Augustine the bishop in North Africa; the zeal of Celtic monks and missionaries; the viciousness of the Crusades; the visions of Brigit of Sweden; and the fracturing of Christianity by Martin Luther’s protest. We hear the voices of great theologians as well as of those branded heretics by the Church, a powerful reminder that the growth of Christianity is a story with many narratives of competing visions of reform and ideals, powerful critiques of corruption and venality, and exclusion of the vanquished.  The troubled history of Christian engagement with Jews and Muslims is found in pogroms and expulsions, but also in the astonishing ways in which the culture of the West was transformed by Jewish and Islamic learning.

We shall explore the stunning beauty of the Book of Kells, exquisitely prepared by monks as the Vikings terrorized the coast of England. We will experience the blue light of the windows of Chartres, and ponder the opening questions of Thomas Aquinas’ great Summa. We will read from the Gutenberg Bible of the fifteenth century, which heralded the revolution brought by the printing press. We will travel from Calvin’s Geneva to Elizabeth’s England to Trent, where a Catholic Council met to inaugurate a modern, missionary Catholic church. We will walk through the great Escorial of Philip II of Spain, hear the poetry of John of the Cross, and follow the Jesuits to Brazil and China.
 
Christianity in the West was forged in the fires of conflict and tumult, and it brought forth both creativity and violence. It echoed with calls for God’s world to be transformed, it inspired the most sublime art and architecture, yet it also revealed the power of the union of cross and sword to destroy. The course is a journey through the formation of the West as one strand of Christianity, as one chapter in a global story. It is a journey that has shaped our world.",33909.0,25899.0,4.8,570.0
A Voice of Their Own. Women's Spirituality in the Middle Ages.,https://www.coursera.org/learn/womens-spirituality,Arts and Humanities,History,"Delfi I. Nieto-Isabel, Blanca Garí, Núria Jornet","Have you ever heard about medieval mysticism or medieval heresies? Have you ever wondered about the particular role women played in medieval spirituality? Do Hildegard of Bingen, Clare of Assisi, Marguerite Porete, the Cathar ladies or Isabel de Villena ring a bell? Have you ever felt like you wanted to know more about them? If your answer to any of these questions was yes, then this MOOC, A voice of their own. Women’s spirituality in the Middle ages is what you were looking for. 

A Voice of their own is much more than a course. It is an invitation to follow the paths traced by the spiritual experiences of medieval women. It is a challenge that, should you let it, will take you to places where you will see and hear things that will astonish you. Here you will find medieval women playing a major role in the spiritual transformations of the Middle Ages, founding monastic movements and orders, writing about their experiences, traveling the roads of Europe to spread their ideas, creating spiritual landscapes, as well as both material an intangible architectures. In this MOOC, these women will speak to you from the past, and you'll see that their voices still hold great validity in the present.",11877.0,8855.0,4.5,90.0
A l’avènement du christianisme : l’archéologie des derniers païens,https://www.coursera.org/learn/archeology,Arts and Humanities,History,"Patrizia Birchler Emery, Matteo Campagnolo, Anne-Françoise Jaccottet-Muller , Jean Terrier, Lorenz E. Baumer, André-Louis Rey, Christophe Schmidt","Dans ce MOOC, vous explorerez une vision différenciée du rapport entre païens et chrétiens durant l’Antiquité tardive, basée essentiellement sur les témoignages archéologiques. Nous verrons ensemble que la confrontation et le conflit religieux, souvent évoqués dans les écrits de l’époque notamment par les historiens de l’église, étaient l’exception plutôt que la norme.

Le premier module de ce MOOC vous permettra de définir le cadre et le contexte historique de l’Antiquité tardive. Vous découvrirez dans la suite du cours des thèmes plus spécifiques de cette période fascinante. Iconographie, architecture, sculpture, mosaïque et numismatique seront ainsi illustrés par de nombreux cas d’études et documents visuels. 
Après avoir suivi ce MOOC, vous connaîtrez les textes officiels et les événements importants de l’avènement du christianisme comme religion d’Etat. Vous saurez prendre une distance critique avec des aprioris sur « l’imperméabilité » des sphères païenne et chrétienne. Vous serez enfin à même d’analyser la permanence d’architecture ou de thèmes iconographiques et mythologiques païens dans une société christianisée. 
Différent-es enseignant-es du Département des sciences de l’Antiquité de l’Université de Genève vous accompagneront tout au long de ce MOOC.",,1974.0,4.6,24.0
Activism in Sports and Culture,https://www.coursera.org/learn/activism-sports-culture,Arts and Humanities,History,Chris Webber,"Sports have become an ever-present reflection of American culture, and an important symbol of the divisions and alliances in our society. Sports and political change walk hand in hand in America. The way that athletes and institutions deal with questions of race, economic hardship, nationalism, and political ties have become central to the way that we understand ourselves and our society. And yet, there are those who would prefer their sports free of controversy and opinion. Dedicated athletes, coaches, and media personalities have pushed back against this refrain, demanding to be seen not just as entertainers but as fully formed humans with political opinions and experiences. Their struggles against injustice have changed the face of America and kicked off a reckoning within modern-day sports. 

How does context inform the shape and outcome of protests? What is it about sports that provides space — or doesn't — for political statements? Why do some of us expect athletes to be activists, when others would rather they ""shut up and dribble""? We'll explore all of these questions and more in this class. 

Your professor will be NBA All-Star and TNT Sports journalist and commentator Chris Webber, who leads interviews with iconic activists, including John Carlos and Jemele Hill as they wrestle with the meanings and outcomes of their activism. You'll read and watch primary source documents about acts of protest, and academic and journalistic work that reckons with the legacies of those acts. By the end of the course, you'll have a better understanding of historical and contemporary protest moments, and be able to create and apply new ways of thinking about the activism within the world of sports in history and today.",,2616.0,4.5,11.0
Age of Cathedrals,https://www.coursera.org/learn/age-of-cathedrals,Arts and Humanities,History,Howard Bloch,"An introduction to some of the most astonishing architectural monuments the world has ever known—Gothic cathedrals.  We shall study the art, literature, intellectual life, economics, and new social arrangements that arose in the shadow of the cathedrals and that were such an important part of the revival of cities in the twelfth and thirteenth centuries.  The goal of the course is a better appreciation of the High Middle Ages, a world that is still recognizably our own.",32578.0,16543.0,4.7,438.0
Age of Jefferson,https://www.coursera.org/learn/ageofjefferson,Arts and Humanities,History,Professor Peter S. Onuf,"This course provides an overview of Thomas Jefferson's work and perspectives presented by the University of Virginia in partnership with Thomas Jefferson’s Monticello. Together, UVA and Monticello are recognized internationally as a UNESCO World Heritage Site.",27251.0,17836.0,4.7,422.0
Alle origini della civiltà  mediterranea: archeologia  della città dal Levante  all’Occidente - III-I millennio a.C.,https://www.coursera.org/learn/nigro-levante-occidente,Arts and Humanities,History,Lorenzo Nigro,"Quali sono le radici più profonde di quel mix di culture che chiamiamo ‘civiltà mediterranea’? Quali commistioni e quali scambi hanno prodotto il suo frutto più completo, ossia la città, come luogo delle comunità che plasmano il loro territorio e i loro spazi? Quali elementi formarono il sostrato condiviso di usanze, tradizioni, idee, scoperte ed innovazioni che hanno messo a confronto e mischiato popoli diversi per millenni. Cosa ha fatto, dalla ceramica alla metallurgia, dalla gastronomia all’architettura, dall’arte alla religione di un mare una culla di civiltà? L’archeologia può servire a sviluppare queste domande e cercare delle risposte non scontate, toccando con mano quello che gli antichi popoli del Mediterraneo ci hanno lasciato. Punto di osservazione privilegiato del corso è l’antica città fenicia di Mozia, posta al centro del “mare di mezzo”. Attraverso l’esperienza diretta dello scavo, con immagini prese dal vivo, il corso vuole far toccare a chi vorrà parteciparvi le tessere del grande mosaico della civiltà mediterranea. Il diario dello scavo - il libro dell’archeologo - e la piccozzina usata per scavare saranno i due strumenti che ci condurranno attraverso il mare a scoprire cosa furono realmente queste antiche città, e come il loro contributo è ancora parte della nostra memoria condivisa.",2540.0,2063.0,4.9,113.0
America Through Foreign Eyes,https://www.coursera.org/learn/america-through-foreign-eyes,Arts and Humanities,History,"Dr. Julie Fette, Dr. Anne S. Chao, Dr. Jeffrey Fleisher, Dr. Moramay López-Alonso,   Dr. Lida Oukaderova","The United States has always been a source of fascination — both attraction and repulsion — for the people of France, Mexico, China, and African countries such as Nigeria, Ghana, and Sudan.  ""America Through Foreign Eyes"" is a rich, interdisciplinary, international course that features Rice University faculty from a variety of disciplines and area studies. Focused on perceptions of America abroad, the course is a cross between World Cultures and American Studies. The course features five core modules, each covering the perceptions and interactions of particular regions with America, Americans and Americanization.",16222.0,22234.0,4.7,348.0
"American Education Reform: History, Policy, Practice",https://www.coursera.org/learn/edref,Arts and Humanities,History,"Dr. John L. Puckett, Dr. Michael Charles Johanek","Discover what shapes how we talk about schools today by exploring the history of U.S. education reform. Engage with the main actors, key decisions, and major turning points in this history. See how social forces drive reform. Learn about how the critical tensions embedded in U.S. education policy and practice apply to schools nationally, globally— and where you live.",10856.0,21757.0,4.8,96.0
Antisemitism: From Its Origins to the Present,https://www.coursera.org/learn/antisemitism,Arts and Humanities,History,"Dr. Yossi Kugler, Dafna Dolinko, Dmitry Kolotilenko","In this course, 50 leading scholars from all over the world will explore questions and issues relating to antisemitism including: what is antisemitism? How has it changed throughout history? Why can it be found among so many diverse cultures, and even among opposing ideologies? What happened to antisemitism after the Holocaust? How is antisemitism expressed today, and what are the main spheres in which it can be found?",5309.0,10177.0,4.8,52.0
Antisemitismo: Desde sus orígenes hasta el presente,https://www.coursera.org/learn/antisemitismo,Arts and Humanities,History,"Dr. Yossi Kugler, Dafna Dolinko, Dmitry Kolotilenko","En este curso, 50 destacados académicos de todo el mundo explorarán preguntas y cuestiones relacionadas con el antisemitismo, incluyendo: ¿qué es el antisemitismo? ¿Cómo ha cambiado a lo largo de la historia? ¿Por qué se puede encontrar entre tantas culturas diversas, e incluso entre ideologías opuestas? ¿Qué pasó con el antisemitismo después del Holocausto? ¿Cómo se expresa el antisemitismo hoy y cuáles son los principales ámbitos en los que se puede encontrar?",,2358.0,,
"Applied Public History: Places, People, Stories",https://www.coursera.org/learn/uol-public-history,Arts and Humanities,History,Catherine Clarke,"This course introduces learners to applied public history: understanding and interpreting the past today, and engaging diverse communities in the practice of making and sharing histories. The course draws on project case studies, expert insights and diverse perspectives to model exciting approaches to researching and sharing the history of places and people. Learners will develop a toolkit to apply in their own practice, by participating in discussion, quizzes, creative activities and mini masterclasses.

What kinds of stories can we discover through research into the history of places and people? How do we engage diverse communities with those stories today? What kinds of imaginative approaches can we use to interpret the past? And what tools and opportunities can we create to include new groups and individuals in local research initiatives? Led by the Centre for the History of People, Place and Community at the Institute of Historical Research, University of London – the UK’s national centre for history – this course investigates these questions and helps learners develop transferable approaches to their own local history and heritage interpretation.",3692.0,4612.0,4.9,67.0
Arch of Titus: Rome and the Menorah,https://www.coursera.org/learn/archoftitus,Arts and Humanities,History,Steven Fine,"The Arch of Titus: Rome and the Menorah explores one of the most significant Roman monuments to survive from antiquity, from the perspectives of Roman, Jewish and later Christian history and art. The Arch of Titus  commemorates the destruction of Jerusalem by the emperor Titus in 70 CE, an event of pivotal importance for the history of the Roman Empire, of Judaism, of Christianity and of modern nationalism.  

Together with your guide, Professor Steven Fine, you will examine ancient texts and artifacts, gaining skills as a historian as you explore the continuing significance of the Arch of Titus from antiquity to the very present.   Course members will accompany Professor Fine on virtual ""fieldtrips"" to museums and historical sites in Los Angeles and New York where you will ""meet"" curators, scholars and artists.  You will attend an academic colloquium and even ""participate"" in office hours.  Students will participate in the latest advancement in the study of the Arch - the restoration of its original colors.  You will learn how color was used in Roman antiquity and apply that knowledge to complete your own 'color restoration' of the Arch of Titus menorah relief.",10628.0,3486.0,4.5,117.0
Art of the MOOC:  Experiments with Sound,https://www.coursera.org/learn/experiments-with-sound,Arts and Humanities,History,"Pedro Lasch, Candice Hopkins, Jace Clayton, Mathias Hinke","Students of this course may try their hand at their own sound interventions and musical compositions, or simply focus on learning more about diverse musical traditions, sonic experimentation, and acoustic phenomena in everyday life. Designed by artist and Duke professor, Pedro Lasch, and UdK composer Mathias Hinke, this course is also co-taught by scholar and musician Jace Clayton (DJ Rupture) and curator Candice Hopkins (Documenta 14). The lectures link major artistic developments of recent decades to wider ideas about sound in specific social and spatial contexts.

Also included are guest presentations from key thinkers and practitioners, like: Christopher DeLaurenti, Jen Delos Reyes, Tina Haver Currin, Quran Karriem, Christina Kubisch, Thomas Kusitzky, Scott Lindroth, Mark Anthony Neal, Bill Seaman, and John Supko. As the ‘ART of the MOOC’ title implies, learners and participants are encouraged to treat the MOOC itself as a public art medium. This happens mostly through the course’s optional practical components, local project productions, global exchanges, and critical feedback. While no prior sound production or musical experience is required, projects also offer challenging options for advanced learners. 

For other course offerings or language versions in this series, just search 'ART of the MOOC' in the Coursera catalog.",6446.0,4312.0,4.8,61.0
Asian American History and Identity: An Anti-Racism Toolkit,https://www.coursera.org/learn/asian-american-history-identity-antiracism-toolkit,Arts and Humanities,History,"Maxwell Cassity, Kariann Yokota","In this course, students will develop a greater understanding of Asian American history and identities, explore the problematic history of anti-Asian discrimination in the US, and develop skill sets that they can use to address anti-Asian hate and violence in their community. Target learners include students interested in Asian American history and Anti-Racism, but also any learner interested in creating more inclusive communities for AAPI Americans and stopping racism, hate, and violence in their community.  

Drawing from a diverse range of Asian American experiences, this course will utilize a variety of course-specific and open-source materials and activities that include facilitated conversations, interviews, videos, articles, podcasts, and art to guide the learner through 3 weekly modules. Week 1 focuses on the history of Asian American cultures and identities in the US. Week 2 tightens this lens to examine contextual examples of anti-Asian racism in US history and culture as well as artists, activists, and communities who have actively resisted Anti-Asian violence. Week 3 explores examples of Asian American activism and anti-racism using a humanities-centered approach and encourages learners to think about ways to deploy the skills developed throughout the course in their own communities and lives. During the course, learners will have the opportunity to complete self-guided reflections and responses to course material that will develop their knowledge of anti-racist practices and active bystander intervention. Learners who complete the course will be offered the opportunity to earn a Coursera badge/certificate and all participants will be encouraged to take the knowledge and skills gained from the course into their communities.",,1617.0,,
At the Origins of the Mediterranean Civilization: Archaeology of the City from the Levant to the West - 3rd-1st millennium BC,https://www.coursera.org/learn/archaeology-city-levant-west,Arts and Humanities,History,Lorenzo Nigro,"Which are the deepest roots of that mix of cultures that we use to call ‘Mediterranean Civilization’? Which are comminglings and exchanges which produced its most complete fruit, i.e. the city, a place for landscape-modelling communities? And which elements did contribute to build up that baulk of customs, ideas, and innovations which compelled to confrontation and hybridizations different peoples for millennia? What did it made, from pottery to metallurgy, from gastronomy to architecture, from art to religion, of a sea a cradle of civilization? Archaeology may help in disentangling such questions, seeking unexpected answers , by tinkering what ancient Mediterranean peoples left buried in the ground. A privileged point of view of our course is the ancient Phoenician city of Motya, located exactly at the centre of the “sea in the middle”. Throughout the live experience of excavation, with images taken on the field, this course will let you touch the many tesserae of the great mosaic of the Mediterranean Civilization. The field diary of the archaeologist, and the handpick will be the two tools, which will lead us across the sea to discover what such early cities actually were, and how their contribute is still a major part of our shared memory.",17083.0,18912.0,4.5,384.0
Basic Elements of Design: Design Principles and Software Overview,https://www.coursera.org/learn/basic-elements-design,Arts and Humanities,History,Lori Poole,"Designing for an organization, while requiring technical skill, is not just about knowing how to use a pagination program such as InDesign or manipulate photos using Photoshop. A designer is a visual storyteller, a person who pairs words with images and typography to best convey information to an audience. Good design evokes emotion and presents the news of the day with clarity and the proper tone. A business card, brochure, or website that has good design provides content that is more inviting, more easily comprehensible and is faster to process. Design isn’t about “making it look pretty,” it’s also about content, layout and audience analysis.",46058.0,27475.0,4.7,851.0
Big History: Connecting Knowledge,https://www.coursera.org/learn/big-history,Arts and Humanities,History,A/Professor Iain Hay,"We currently face unprecedented challenges on a global scale. These problems do not neatly fall into disciplines. They are complicated, complex, and connected. Join us on this epic journey of 13.8 billion years starting at the Big Bang and travelling through time all the way to the future. Discover the connections in our world, the power of collective learning, how our universe and our world has evolved from incredible simplicity to ever-increasing complexity. Experience our modern scientific origin story through Big History and discover the important links between past, current, and future events. You will find two different types of lectures. ‘Zooming In’ lectures from multiple specialists enable you to understand key concepts through the lens of different disciplines, whilst David Christian's ‘Big History Framework’ lectures provide the connective overview for a journey through eight thresholds of Big History.",92666.0,41184.0,4.8,1683.0
Black Lives Matter,https://www.coursera.org/learn/black-lives-matter,Arts and Humanities,History,"Tristan Cabello, PhD","The #BlackLivesMatter movement is the most significant political movement in African American life in the United States in the last fifty years. BLM leaders denounced anti-black racism, white supremacy, and police brutality and reshaped how we think about gender, sexuality, social justice, economic injustice, and crime. The movement is grounded in a long history of African American activism. From slave revolts to the Black Panther Party, from the founding of the Congressional Black Caucus, to the eruption of the #BLM Movements, this course is an interdisciplinary and historical exploration of the BlackLivesMatter movement.",2848.0,6623.0,4.4,48.0
Burgos: Deciphering Secrets of Medieval Spain,https://www.coursera.org/learn/burgos-deciphering-secrets-medieval-spain,Arts and Humanities,History,Dr. Roger Louis Martínez-Dávila,"This advanced course focuses on two primary goals: (1) appraising how Jews, Christians, and Muslims shaped the history of medieval Spain and (2) mastering the craft of Spanish paleography, the skill of identifying Spanish handwriting in the 11th- through 15th-century manuscripts. Through the lens of the medieval history of Burgos, we dedicate 75% percent of our efforts to developing pragmatic expertise in the interpretation of Carolingian/French/Gothic handwriting. 

Specifically, the course explores how the royal Castilian city of Burgos influenced, and was influenced by, Jews, Christians, and Muslims. We closely evaluate the Spanish Christian Reconquest, the Plague and the 14th-century Castilian civil war, anti-Jewish pogroms, the emergence of elite conversos (Jewish converts to Christianity), and the role of the king and Roman Catholic Church in the creation of Catholic Spain. Through onsite interviews in archives and museums in Burgos, we experience the medieval city, artifacts, and manuscripts. While we teach using Spanish manuscripts, very little or no knowledge of the Spanish language is necessary to complete the course.

Using an intensive array of paleography practices, exams, independent projects, and collaborative efforts, you will garner exceptional skills that you can apply to interpreting any medieval European handwriting. To demonstrate your mastery of paleography you will (1) create a 14th-15th-century alphabet, numeral, and abbreviation guide using manuscript images, and (2) transcribe one selection from a medieval manuscript.",2553.0,2304.0,4.1,11.0
