name,url,category,subcategory,instructors,description,enrollment,views,rating,raters
Luther and the West,https://www.coursera.org/learn/luther-and-the-west,Arts and Humanities,Philosophy,Christine Helmer,"In this course we will discuss the history of some ideas that have been hugely influential in the modern west and that were taken out to the rest of the world. The discussion centers on an extraordinary and historically important figure, a sixteenth century German man named Martin Luther. Luther is recognized today as the originator of many of the most significant ideas that continue to affect and shape who we as modern people are and how we see the world and ourselves for better and for worse.

In the first section, we will explore why Luther thought the Bible was the most important volume for everyone to have and read. Included here will be a careful consideration of Luther's anti-Judaism, which contributed to western antisemitism and some of the greatest horrors of the twentieth century.

In the second section, we will talk about the idea of freedom and how Luther's understanding of freedom in Christ affected the way modern thinkers understood what it means to be human in community. Important in this section is the consequential contradiction between freedom and slavery in western thought and their co-existence in western societies.

The third section will be all about the many complicated relations between religion and politics.

NOTE:  Students wishing to sign up for free access to all instructional course content should click on the ""Sign-In"" button in the upper right hand corner. Those who wish to take the course and complete a certificate that requires payment, please click the Enroll button on the left side of this page.",7793.0,3419.0,4.6,95.0
Meditation: A way to achieve your goals in your life,https://www.coursera.org/learn/self-reflection-meditation,Arts and Humanities,Philosophy,Duck-Joo Lee,"Do we truly think that we have lived for ourselves? Perhaps we have lived for money, love, fame, family and pride etc.? Therefore, we don’t seem to be satisfied even though we are full of those things. It is because that we don’t know ourselves.

Eric Fromm talked about human nature as two modes of being: “To Have” and “To Be”.  If we are “Having” the nature of possessions, we are not satisfied, and feel empty and futile. Then, how can we be “Being” the nature of our inner-selves?

Sometimes, we happened to be aware of this “Being” nature and try to change ourselves, but fail. But, because of our daily routines, it’s easily forgotten. And more it is hard to escape from our unwanted minds controlling us.

From now on, let us reflect on ourselves and look at our minds leading up to today! Don’t we achieve our goals after knowing ourselves? And let us find the “Being” nature of our original selves after escaping from the minds restraining and controlling us.

In this lecture, the definition and principle of the mind are explained in simple and clear ways. You can make sure and practice the methodology of finding the true original mind of inner-self by escaping from the false mind of possession. 

Self-reflection is the first step to meditate. You can know yourselves most objectively through meditation and you will realize that all the thoughts and actions are due to your minds which are nonexistent and false. If you throw away the false mind, you will find the true mind.

Meditation is now world-wide sensation. There are many research reports that show people can be leaders if you have a habit of self-reflection through meditation. Now meditation at school and the workplace are popular.

Happiness is having no worries. You can really relax yourself if there is no bundle of thoughts and you can be successful when you know yourself truly. Worries come from the memorized thoughts of the false mind. Your inner potential of positive power are revealed, your peaceful and happiest mind will be in your mind, and you can live the life you wanted through meditation.

This method of meditation is very practical and everybody can follow the methodology. As an engineer, I will guide you step by step to practice this meditation. I am sure that this lecture becomes a turning point in your life.",88642.0,28831.0,4.6,934.0
Mind of the Universe - Genetic Privacy: should we be concerned?,https://www.coursera.org/learn/mind-of-the-universe-genetic-privacy,Arts and Humanities,Philosophy,"Lotte Pet, Robert Zwijnenberg","Should all our genetic information be made public in order to eradicate genetic diseases from this world?

Who owns your genetic data once it becomes publicly accessible? What is your responsibility to family members when you know more about genetic diseases than they do? Who decides what kind of genetic information is relevant to a person? And what does genetic privacy mean to you?

In this challenge with Robert Zwijnenberg (Professor in Art and Science Interactions) you will critically reflect upon the issue of genetic privacy. You will dive into the ethical questions that come up with the disclosure of genetic data in biobanks and through genetic tests. This course encourages you to think about the cultural, philosophical and political tensions present in the debate around genetic privacy. You are invited to identify and listen to the viewpoints and values provided by the different stakeholders that shape this debate: corporations, researchers, consumers and patients. Furthermore, you will go off the beaten track by exploring the issue from the unique perspective of art and culture. After a lot of thinking, supplementing, deleting and adjusting, you will be asked to share a recommendation on how to regulate practices of disclosing genetic information, while taking into consideration the concept of genetic privacy. Your advice could serve as an eye-opener for policy makers!

This online learning experience is a spin-off of The Mind of the Universe documentary series created by the Dutch broadcasting company VPRO and professor Robbert Dijkgraaf, Princeton University. A number of universities in the Netherlands have used the open source material of the documentary series as a starting point to create similar experiences.",3112.0,1505.0,4.1,16.0
Mind of the Universe: Science in Progress,https://www.coursera.org/learn/mind-of-the-universe-science-in-progress,Arts and Humanities,Philosophy,Tim De Mey,"From William Harvey discovering the circulation of blood to Albert Einstein developing the theory of relativity: almost all scientific research starts from something odd and unexpected that hasn't been explained yet, and, subsequently, the scientist creatively imagining possible explanations for it, formulating hypotheses.

However, the problem with formulating hypotheses is the ""theory-ladenness of observation"": ones expectations and background theories curtail and determine what one observes. The best way to reduce the negative consequences of theory-ladenness of observation as much as possible, is not by adopting the highest methodological standards, but by continuing to think outside the box throughout the problem solving process, by tirelessly, creatively imagining alternative explanations and hypotheses.

In this learning experience you will be turned upside down by philosopher Tim de Mey, who will challenge you to think outside of your comfort zone. You will be challenged to reflect critically and creatively on what triggers your research, i.e., what is driving the scientist in you. Tim will show you how openness to and interaction with other disciplines generates new ideas, and how important it is that scientists, besides the possibilities of their own discipline, are also aware of its (and there) limitations. Take this challenge and you will construct the perfect out-of-the-box research question that will tease the Mind of the Universe scientists to explore even better answers in their research.

This online learning experience is a spin-off of The Mind of the Universe documentary series created by the Dutch broadcasting company VPRO and professor Robbert Dijkgraaf, Princeton University. A number of universities in the Netherlands have used the open source material of the documentary series as a starting point to create similar experiences.",4693.0,,4.7,13.0
Pensamiento científico,https://www.coursera.org/learn/ciencia,Arts and Humanities,Philosophy,Carlos Gershenson,"¿El pensamiento científico es sólo para científicos? Su utilidad va mucho más allá, ayudando a las personas a tomar mejores decisiones todos los días. El objetivo de este curso es fomentar en pensamiento científico en los alumnos para ayudarles a tomar mejores decisiones profesionales, personales y sociales. 

Para lograr este objetivo, el curso destila conceptos de ciencias y filosofía a un nivel accesible al público general, ilustrándolos con ejemplos actuales de diversas áreas.",116325.0,45458.0,4.8,1849.0
Philosophy and the Sciences: Introduction to the Philosophy of Cognitive Sciences,https://www.coursera.org/learn/philosophy-cognitive-sciences,Arts and Humanities,Philosophy," Professor Michela Massimi, Dr. Alasdair Richmond, Dr. Suilin Lavelle, Dr David Carmel, Dr Mark Sprevak, Professor Duncan Pritchard, Professor Andy Clark, Professor John Peacock, Professor Barbara Webb, Dr Kenny Smith, Dr Peggy Series","Course Description

What is our role in the universe as human agents capable of knowledge? What makes us intelligent cognitive agents seemingly endowed with consciousness? 

This is the second part of the course 'Philosophy and the Sciences', dedicated to Philosophy of the Cognitive Sciences. Scientific research across the cognitive sciences has raised pressing questions for philosophers. The goal of this course is to introduce you to some of the main areas and topics at the key juncture between philosophy and the cognitive sciences.
Each week we will introduce you to some of these important questions at the forefront of scientific research. We will explain the science behind each topic in a simple, non-technical way, while also addressing the philosophical and conceptual questions arising from it. Areas you’ll learn about will include:

          Philosophy of psychology, among whose issues we will cover the evolution of the human mind and the nature of consciousness.

           Philosophy of neurosciences, where we’ll consider the nature of human cognition and the relation between mind, machines, and the environment.


 Learning objectives

Gain a fairly well-rounded view on selected areas and topics at the intersection of philosophy and the sciences

Understand some key questions, and conceptual problems arising in the cognitive sciences.

Develop critical skills to evaluate and assess these problems.


Suggested Readings

To accompany 'Philosophy and the Sciences', we are pleased to announce a tie-in book from Routledge entitled 'Philosophy and the Sciences for Everyone'. This course companion to the 'Philosophy and the Sciences' course was written by the Edinburgh Philosophy and the Sciences team expressly with the needs of MOOC students in mind. 'Philosophy and the Sciences for Everyone' contains clear and user-friendly chapters, chapter summaries, glossary, study questions, suggestions for further reading and guides to online resources.

Please note, this companion book is optional - all the resources needed to complete the course are available freely and listed on the course site.",67089.0,17570.0,4.6,1298.0
Philosophy and the Sciences: Introduction to the Philosophy of Physical Sciences,https://www.coursera.org/learn/philosophy-physical-sciences,Arts and Humanities,Philosophy," Professor Michela Massimi, Dr. Alasdair Richmond, Dr. Suilin Lavelle, Dr David Carmel, Dr Mark Sprevak, Professor Duncan Pritchard, Professor Andy Clark, Professor John Peacock, Professor Barbara Webb, Dr Kenny Smith, Dr Peggy Series, Louise Connelly","What is the origin of our universe? What are dark matter and dark energy?

This is the first part of the course 'Philosophy and the Sciences', dedicated to Philosophy of the Physical Sciences. Scientific research across the physical sciences has raised pressing questions for philosophers. The goal of this course is to introduce you to some of the main areas and topics at the key juncture between philosophy and the physical sciences.
Each week we will introduce you to some of these important questions at the forefront of scientific research.

 We will explain the science behind each topic in a simple, non-technical way, while also addressing the philosophical and conceptual questions arising from it.  We’ll consider questions about the origin and evolution of our universe, the nature of dark energy and dark matter and the role of anthropic reasoning in the explanation of our universe.

Learning Objectives

Gain a fairly well-rounded view on selected areas and topics at the intersection of philosophy and the sciences

Understand some key questions, and conceptual problems arising in the natural sciences.

Develop critical skills to evaluate and assess these problems.

Suggested Reading

To accompany 'Philosophy and the Sciences', we are pleased to announce a tie-in book from Routledge entitled 'Philosophy and the Sciences for Everyone'. This course companion to the 'Philosophy and the Sciences' course was written by the Edinburgh Philosophy and the Sciences team expressly with the needs of MOOC students in mind. 'Philosophy and the Sciences for Everyone' contains clear and user-friendly chapters, chapter summaries, glossary, study questions, suggestions for further reading and guides to online resources.

Please note, this companion book is optional - all the resources needed to complete the course are available freely and listed on the course site.",35270.0,9562.0,4.6,854.0
Philosophy of Science,https://www.coursera.org/learn/philosophy-of-science,Arts and Humanities,Philosophy,Michael Weisberg,"For the last four centuries, scientists have aimed to provide us with an understanding of the world around us. By all appearances, science has made substantial progress during this time. But is this progress real or illusory? And if it is real, how has this progress been made? This four-week course will consider these important questions. Specific topics will include how scientists generate knowledge through observations, experiments, and simulations; scientific objectivity and failures of scientific objectivity; the self-correcting nature of the scientific community; the positive and negative influences that values can have on science; the relationship between science and religion; and the role of the public in guiding the scientific enterprise.",14274.0,14773.0,4.7,178.0
"Philosophy, Science and Religion: Philosophy and Religion",https://www.coursera.org/learn/philosophy-science-religion-2,Arts and Humanities,Philosophy,"Dr Orestis Palermos, Professor Mark Harris, Professor Duncan Pritchard, Dr J Adam Carter, Dr Mog Stapleton","Philosophy, Science and Religion mark three of the most fundamental modes of thinking about the world and our place in it. Are these modes incompatible? Put another way: is the intellectually responsible thing to do to ‘pick sides’ and identify with one of these approaches at the exclusion of others? Or, are they complementary or mutually supportive? As is typical of questions of such magnitude, the devil is in the details. For example, it is important to work out what is really distinctive about each of these ways of inquiring about the world. In order to gain some clarity here, we’ll be investigating what some of the current leading thinkers in philosophy, science and religion are actually doing.

This course, entitled ‘Philosophy and Religion’, is the second of three related courses in our Philosophy, Science and Religion Online series, and in this course we will ask important questions about the age-old debate between science and religion, such as:
 
•  What kind of conflicts are there between religion and science?
•  Does current cognitive science of religion effectively explain away God?
•  If there is a God who has made us so that we can know him, why do some people not believe?
•  Is belief in science also a kind of fundamentalism?
•  What makes us good at getting, giving, or sharing, knowledge? Is this different when it is religious knowledge?

The first course in the Philosophy, Science and Religion series, 'Science and Philosophy' was launched early in 2017 and you can sign up to it at any time. The third course —‘Religion and Science’—will be launched early in 2018. Completing all three courses will give you a broader understanding of this fascinating topic. Look for: 

• Philosophy, Science and Religion I: Science and Philosophy https://www.coursera.org/learn/philosophy-science-religion-1/
• Philosophy, Science and Religion III: Religion and Science

Upon successful completion of all three courses, students will:

(1) Understand the main parameters at stake in the current debate between science and religion.
(2) Have some familiarity with the relevant areas of science that feature in the debate—including cosmology, evolution, and the neurosciences—and will have begun to engage with them conceptually.
(3) Have encountered key philosophical approaches to the interface between science and religion, and will have had the opportunity to engage them in practice.
(4) Have embarked constructively in cross-disciplinary conversations.
(5) Have demonstrated an openness to personal growth through a commitment to dialogue across intellectual and spiritual boundaries.

You can also follow us on Twitter at https://twitter.com/EdiPhilOnline and you can follow the hashtag #psrmooc",26766.0,11899.0,4.6,435.0
"Philosophy, Science and Religion: Religion and Science",https://www.coursera.org/learn/philosophy-science-religion-3,Arts and Humanities,Philosophy,"Dr Mog Stapleton, Dr J Adam Carter, Dr Orestis Palermos, Professor Mark Harris, Professor Duncan Pritchard","Philosophy, Science and Religion mark three of the most fundamental modes of thinking about the world and our place in it. Are these modes incompatible? Put another way: is the intellectually responsible thing to do to ‘pick sides’ and identify with one of these approaches at the exclusion of others? Or, are they complementary or mutually supportive? As is typical of questions of such magnitude, the devil is in the details. For example, it is important to work out what is really distinctive about each of these ways of inquiring about the world. In order to gain some clarity here, we’ll be investigating what some of the current leading thinkers in philosophy, science and religion are actually doing.

This course, entitled ‘Religion and Science’, is the third of three related courses in our Philosophy, Science and Religion Online series. The course will address five themes, each presented by an expert in the area. 

1. Science, Religion, and the Origin of the Universe (Professor Tim Maudlin, NYU )
2. Buddhism and Science (Professor Graham Priest, CUNY)
3. Evolution and Design (Dr Kevin Scharp, St Andrews)
4. Sin Suffering and Salvation: Evolutions Thorny Issues (Dr Bethany Sollereder, Oxford)
5. Human Uniqueness in Science, Theology, and Ethics (Professor David Clough, Chester)

The first and second courses in the Philosophy, Science and Religion series, 'Science and Philosophy' and 'Philosophy and Religion' were launched in 2017 and you can sign up to these at any time. It is not necessary to have completed these courses to follow this course. However, completing all three courses will give you a broader understanding of this fascinating topic. Look for: 

• Philosophy, Science and Religion I: Science and Philosophy - https://www.coursera.org/learn/philosophy-science-religion-1
• Philosophy, Science and Religion II: Philosophy and Religion - https://www.coursera.org/learn/philosophy-science-religion-2

Upon successful completion of all three courses, students will:

(1) Understand the main parameters at stake in the current debate between science and religion.
(2) Have some familiarity with the relevant areas of science that feature in the debate—including cosmology, evolution, and the neurosciences—and will have begun to engage with them conceptually.
(3) Have encountered key philosophical approaches to the interface between science and religion, and will have had the opportunity to engage them in practice.
(4) Have embarked constructively in cross-disciplinary conversations.
(5) Have demonstrated an openness to personal growth through a commitment to dialogue across intellectual and spiritual boundaries.

You can also follow us on Twitter at https://twitter.com/EdiPhilOnline and you can follow the hashtag #psrmooc",16510.0,14200.0,4.6,166.0
"Philosophy, Science and Religion: Science and Philosophy",https://www.coursera.org/learn/philosophy-science-religion-1,Arts and Humanities,Philosophy,"Dr J Adam Carter, Dr Orestis Palermos, Professor Mark Harris, Professor Duncan Pritchard","Philosophy, Science and Religion mark three of the most fundamental modes of thinking about the world and our place in it. Are these modes incompatible? Put another way: is the intellectually responsible thing to do to ‘pick sides’ and identify with one of these approaches at the exclusion of others? Or, are they complementary or mutually supportive? As is typical of questions of such magnitude, the devil is in the details. For example, it is important to work out what is really distinctive about each of these ways of inquiring about the world. In order to gain some clarity here, we’ll be investigating what some of the current leading thinkers in philosophy, science and religion are actually doing.

This course, entitled ‘Science and Philosophy’, is the first of three related courses in our Philosophy, Science and Religion Online series. The first launch is now closed to enrolments. We will launch a new version of the course in July 2018. The course will address four themes each presented by guest lecturers:

1. Are Science and Religion in conflict? (Professor Michael Murray, Franklin & Marshall)
2. Neuroscience and Free Will (Professor Al Mele, Florida State)
3. Creationism and Evolutionary Biology--Science or Pseudo-science? (Dr. Mark Harris and Dr. David de Pomerai, University of Edinburgh)
4. Do Scientific claims constitute absolute truths? (Professor Martin Kusch, University of Vienna)

The second and third courses in the Philosophy, Science and Religion series are ‘Philosophy and Religion’ and ‘Religion and Science’. They may be taken in any order and completing all three courses will give you a broader understanding of this fascinating topic. Look for: 

• Philosophy, Science and Religion II: Philosophy and Religion
• Philosophy, Science and Religion III: Religion and Science

Check out our trailer to hear more: https://youtu.be/OifqTI5VKek
You can also follow us on Twitter at https://twitter.com/EdiPhilOnline and you can follow the hashtag #psrmooc",46404.0,17524.0,4.5,885.0
Re-imaging God in Korean Context,https://www.coursera.org/learn/god-korean-context,Arts and Humanities,Philosophy,Soo-Young Kwon,"This course will be an overview of a development of the theological methods in relation to Korea’s cultural context. Completing the course, the learners can understand cultural influences on the dynamic development of Korean churches and indigenous theology; they can also gain an insight into their own image of God and theological imagination in their own cultural context.",4672.0,2586.0,4.8,81.0
Reality Bites: Introduction to metaphysics,https://www.coursera.org/learn/metaphysics,Arts and Humanities,Philosophy,Tim De Mey,"Speculative metaphysics is challenging, but this course will whet your appetite for it, because it explains fundamental metaphysical problems and views in terms of what you can find in your kitchen and what happens in it when you cook and enjoy food. Here are the 8 bites on the menu.

- The first module 1 explains that metaphysics is about the ingredients and recipes of the world, i.e., which kinds of entities exist and how they relate to one another.
- Modules 2 and 3 invite you to reflect on whether the properties of ingredients -such as their shape and weight- are separate from and if so, how they come together in the ingredients.
- Modules 4 to 7 are about cooking: its most important ingredient is time and most cooking consists in causing changes to the ingredients over time. Yet  some ingredients persist: although they undergo changes, they remain the same. Moreover, cooking minimally involves putting two or more ingredients together, so that they compose a whole. Hence modules 4 to 7 deal with time, causation, persistence and composition respectively.
- Finally, the last module touch on the smells, tastes and other qualitative aspects of our experiences when enjoying food.

Bon appétit!",,4061.0,,
