name,url,category,subcategory,instructors,description,enrollment,views,rating,raters
"Twitter, LinkedIn, and YouTube Marketing",https://www.coursera.org/learn/twitter-linkedin-youtube-marketing,Business,Marketing,"Digital Marketing Institute, Cathal Melinn","Digital Marketing Institute is the global standard in Digital Marketing Certification. Our mission is to give our students the confidence and knowledge they need to advance in their careers through this specialization.

YouTube is second only to Facebook in popularity as a social network in 2021, with almost 2.3 billion active users. Twitter has introduced new fact-checking tools in response to recent controversies and remains a key platform for businesses striving to serve and engage audiences in real-time. LinkedIn is critical for B2B marketing, both for organic and paid social content distribution. If you want to better understand the ever-shifting landscape and challenges marketers face to grow and sustain brands on social, this course will help you do so.

You will learn the basic principles of advertising on Twitter, LinkedIn, and YouTube. After completing this course, you will be able to: -
•	Apply best practices for publishing tweets and using hashtags on Twitter
•	Manage and optimize the performance of Twitter advertising campaigns
•	Build a company’s presence on LinkedIn
•	Measure the performance of LinkedIn advertising campaigns
•	Recognize the key role of social video and YouTube for online marketing
•	Create engaging advertising campaigns to run on YouTube

This course also introduces the concepts of social selling and personal branding for B2B sales and marketing. It covers the differences between traditional and social selling and why businesses are adopting social selling tactics to engage with buyers. This is the final course in the Digital Marketing Institute’s Social Media Marketing specialization.

On completion of all courses in your Specialization, you will also be awarded a Digital Marketing Institute Certified Digital Marketing Associate certification, along with three months of free Power Membership, allowing you to boost your career and unlock your next opportunity. 92% of DMI members have said their courses have had a positive impact on their careers, while 88% are now working at senior or manager level.",6031.0,45657.0,4.5,25.0
Understanding the average Facebook User,https://www.coursera.org/learn/understanding-the-average-facebook-user,Business,Marketing,Michelle Flores,"After completing this guided project, no matter if you are launching a new brand or want to optimize the social media strategy for an existing brand, you will be able to better understand and reach your Facebook target audience.

The goal of this project is to get to know and understand the average Facebook user. By achieving this goal, it will be possible to create a promising marketing strategy and to reach your target audience on Facebook. The objective of social media marketing is to find creative ways to attract the attention of users for its products and services, many times on a lean marketing budget.

Today, you will first create a Facebook Business Page Account. We will create our own Buyer Persona, which will serve you as a template for future projects. Later, I will introduce you to Facebook Insights. Facebook Insights is one of the most powerful Facebook marketing analytics tools available. When you dive into your Facebook Insights, you’ll receive a wealth of data to help you understand more about your Facebook Page and your target audience.",,,,
Use Canva to Create Desktop and Mobile-friendly Web Pages.,https://www.coursera.org/learn/use-canva-to-create-desktop-and-mobile-friendly-webpages,Business,Marketing,Chaitra Deshpande,"By the end of this project, you will be able to create a ready to publish Desktop friendly and  Mobile-friendly webpages  with the help of the Canva graphic design tool. These simple webpages can be independently published with help of Canva URL or URL shorteners. This course will include introduction to Canva, how to design Desktop and Mobile friendly webpages and linking these pages to Socail media channels and prepare these simple webpages for publishing or can be shared with the help of Canva URLs or URL shorteners.


Note: This course works best for learners who are based in the North America region. We’re currently working on providing the same experience in other regions.",29516.0,,4.7,734.0
Use Canva to Create Social Media Marketing Designs,https://www.coursera.org/learn/using-canva-create-social-media-marketing-design,Business,Marketing,Stacey Shanklin-Langford,"By the end of this project, you will create a sample social media graphic for business.  The graphic is shareable across your business’ social media platforms. You will be able to incorporate the color palette from your business style guide, in order to create brand recognition as part of your social media marketing strategy. This course will include an introduction to Canva, how to determine your canvas size for a social media post, incorporate images specific to your business into a social media post, and prepare a post for your social media channels.

Note: This course works best for learners who are based in the North America region. We’re currently working on providing the same experience in other regions.",27111.0,,4.6,1504.0
Use Canva to Create Social Media Visuals for Business,https://www.coursera.org/learn/use-canva-to-create-social-media-visuals-for-business,Business,Marketing,Chaitra Deshpande,"By the end of this project, you will create six social media visuals(Facebook Cover, Facebook Post, YouTube Thumbnail, YouTube Channel Art, Instagram Post and Twitter Header) for your  business. These visuals are shareable across other social media channels. This course will include an introduction to Canva, how to create social media visuals from scratch by keeping one business theme in mind and prepare them for publishing.


Note: This course works best for learners who are based in the North America region. We’re currently working on providing the same experience in other regions.",49386.0,,4.5,1009.0
Use Canva to Create an Interactive Mind Map,https://www.coursera.org/learn/canva-create-an-interactive-mind-map,Business,Marketing,Stacey Shanklin-Langford,"By the end of this project, you will create an interactive mind map that is shareable across teams,  business organizations, or with an audience, you want to market to. You will be able to incorporate a color scheme, images, and other design elements that will draw your audience in. This course will include an introduction to mind maps in Canva, a use for Canva that isn’t a widely known use, but is very useful when building ideas and strategies and effectively communicating them. You will also learn how to add interactive features to your mind map in order to create a useful tool for all.

Note: This course works best for learners who are based in the North America region. We’re currently working on providing the same experience in other regions.",10518.0,,4.7,381.0
Use Canva to Design Digital Course Collateral,https://www.coursera.org/learn/canva-design-digital-course-collateral,Business,Marketing,Stacey Shanklin-Langford,"By the end of this project, you will create digital course collateral for use in your digital courses. You will be able to incorporate a color scheme, images, and other design elements for aesthetically pleasing and value-added course collateral. This course will include intermediate to advanced level skills using the free version of Canva. You will create a course promo graphic, a fillable PDF, a worksheet, and a course certificate for your digital course collateral in this project.

Note: This course works best for learners who are based in the North America region. We’re currently working on providing the same experience in other regions.",37483.0,,4.6,1065.0
Use Mailchimp to Build an E-mail Marketing Campaign,https://www.coursera.org/learn/mailchimp-build-email-marketing-campaign,Business,Marketing,Stacey Shanklin-Langford,"By the end of this project, you will create a customized email for a business marketing campaign using a free version of Mailchimp. You will be able to create an interactive email complete with a call to action that is professional and engaging to your audience. You’ll set up an email campaign as one of several powerful digital marketing campaign tools available in Mailchimp.",12386.0,,4.5,300.0
Use SurveyMonkey to Create a Survey and Analyze Results,https://www.coursera.org/learn/create-survey-analyze-results-with-surveymonkey,Business,Marketing,Abby Saey,"In this project, we will walk through the survey making process and explore the many ways that SurveyMonkey streamlines and simplifies data collection. We will learn how the program is organized and how it operates, helping you feel comfortable and confident enough to create your own survey to meet your own individual needs.

SurveyMonkey is a cloud based survey software which allows its users to create online surveys for free. SurveyMonkey can help move a business in the right direction by collecting the opinions and thoughts of their employees, shareholders, customers, or any other invested group of individuals. After creating a survey with SurveyMonkey, you can easily email them to your target audience or post them on social media. The question templates provided by SurveyMonkey make creating a professional and thorough survey quick and easy. Its user friendly features and detailed options allow amateurs and marketing gurus alike to create the perfect survey to meet their needs. 

Note: This course works best for learners who are based in the North America region. We’re currently working on providing the same experience in other regions.",12684.0,,4.6,269.0
Veiculação de anúncios com o Meta,https://www.coursera.org/learn/veiculacao-de-anuncios-com-o-facebook,Business,Marketing,Daniel Kob,"Este curso é uma preparação para você se tornar especialista no Gerenciador de Anúncios do Facebook. Aprenda a estruturar campanhas no Gerenciador de Anúncios, selecionando os objetivos do anúncio, o público-alvo, o orçamento e o posicionamento que atendam às suas metas específicas. Aprenda a criar e gerenciar anúncios no Facebook e no Instagram e a avaliar e otimizar os resultados de suas campanhas no Gerenciador de Anúncios.  Você terminará o curso criando uma campanha publicitária real no Gerenciador de Anúncios do Facebook para ampliar não apenas seu conhecimento, mas também seu portfólio de marketing de mídias sociais. 

Ao final deste curso, você será capaz de:
• Estruturar campanhas no Gerenciador de Anúncios do Facebook
• Identificar os principais componentes e elementos de um anúncio no Gerenciador de Anúncios do Facebook
• Criar um anúncio que se alinhe com seus objetivos de marketing e direcione-o para o público-alvo
• Definir um orçamento, posicionamento e cronograma para anúncios no Gerenciador de Anúncios do Facebook
• Editar e solucionar problemas em anúncios no Gerenciador de Anúncios do Facebook
 
Este curso é destinado a pessoas que querem aprender a usar o Gerenciador de Anúncios do Facebook para criar, gerenciar e otimizar campanhas no Facebook e Instagram e receber a Certificação de Associado de Marketing Digital do Facebook. Os alunos não precisam de experiência em marketing, mas devem ter habilidades básicas de navegação na Internet e interesse em participar ativamente em redes sociais.  

Os alunos devem ter uma conta no Facebook, e também é útil ter uma conta no Instagram. Idealmente, os alunos já devem ter concluído os quatro cursos anteriores deste programa.

Observação: Neste momento, o Coursera não oferece suporte em português. No momento, o Coursera oferece suporte nos seguintes idiomas: árabe, inglês e espanhol.",,,,
Verbesserung und Bearbeitung von Facebook Werbeanzeigen,https://www.coursera.org/learn/verbesserung-bearbeitung-facebook-werbeanzeigen,Business,Marketing,Michelle Flores,"Nach Abschluss dieses Projekts kannst du, unabhängig davon, ob du eine neue Marke startest oder eine bestehende mithilfe deiner Social-Media-Strategie optimieren möchtest, deine Facebook Werbeanzeigen effektiv optimieren. 

Aufgabe des Social Media Marketings ist es, kreative Wege zu finden um die Aufmerksamkeit der User für ihre Produkte und Dienstleistungen zu gewinnen. Dies erfolgt oftmals auf Basis eines sehr geringen Marketing Budgets. 

Ziel dieses Projekts ist es, verschiedene Arten von Facebook Ads zu betrachten, und Methoden kennenzulernen, wie du deine Facebook Werbeanzeigen optimieren kannst.

Deine neu erworbenen Kenntnisse werden dir in Zukunft dabei behilflich sein die Reichweite deiner Facebook Werbeanzeigen zu erhöhen um möglichst viele Facebook User zu erreichen.

Du wirst heute zunächst einen Facebook Business Page Account erstellen. Anschließend werden wir uns verschiedene Facebook Werbeanzeigen genauer anschauen und anhand dieser Beispiele Eigenschaften von erfolgreichen Werbeanzeigen genauer analysieren.

Deine neu erworbenen Kenntnisse werden dir bei der Erstellung zukünftiger  Werbekampagnen behilflich sein.",,,,
Verstehe den durchschnittlichen Facebook Nutzer,https://www.coursera.org/learn/verstehe-den-durchschnittlichen-facebook-nutzer,Business,Marketing,Michelle Flores,"Nach Abschluss dieses Projekts kannst du, unabhängig davon, ob du eine neue Marke startest oder eine bestehende mithilfe deiner Social-Media-Strategie optimieren möchtest, besser auf deine Facebook Kundschaft eingehen und diese gezielt erreichen.

Ziel dieses Projekts ist es, sich mit den Interessen des durchschnittlichen Facebook User und dessen Gewohnheiten vertraut zu machen. Erst dann ist es möglich, eine Marketing Strategie zu erstellen und deine Kunden auf Facebook gezielt anzusprechen. 

Aufgabe des Social Media Marketings ist es, kreative Wege zu finden um die Aufmerksamkeit der User für ihre Produkte und Dienstleistungen zu gewinnen. Dies erfolgt oftmals auf Basis eines sehr geringen Marketing Budgets. 

Du wirst heute zunächst einen Facebook Business Page Account erstellen um anschließend die Funktionen Facebook Insights und und anzuwenden. Wir werden Statistiken auswerten und unsere eigene Buyer Persona erstellen, die dir als Vorlage für zukünftige Projekte dienen wird.",,,,
Viral Marketing and How to Craft Contagious Content,https://www.coursera.org/learn/wharton-contagious-viral-marketing,Business,Marketing,Jonah Berger,"Ever wondered why some things become popular, and other don't? Why some products become hits while others flop?  Why some ideas take off while others languish? What are the key ideas behind viral marketing? This course explains how things catch on and helps you apply these ideas to be more effective at marketing your ideas, brands, or products. You'll learn how to make ideas stick, how to increase your influence, how to generate more word of mouth, and how to use the power of social networks to spread information and influence. Drawing on principles from his best-selling book, ""Contagious: Why Things Catch On,"" Professor Jonah Berger illustrates successful strategies for you to use buzz to create virality so that your campaigns become more shareable on social media and elsewhere. By the end of this course, you'll have a better understanding of how to craft contagious content, build stickier messages, and get  any product, idea, or behavior to catch on.",263197.0,118741.0,4.8,4888.0
What is Social?,https://www.coursera.org/learn/what-is-social,Business,Marketing,Randy Hlavac,"The “What Is Social?"" MOOC is for business owners, executives, and marketing professionals who want to significantly improve their abilities to grow their social strategy using effective, proven methodologies. This hands on, ""how to"" program won’t just tell you how to grow your professional persona using social – you will actually do it! This course is the first in the six-course specialization, Social Media Marketing: How to Profit in a Digital World. 

While the course can be audited for free, paid learners will receive additional content beyond the course basics. For MOOC 1, the toolkit includes a special video from Alessandro Acquisti on Big Data and a set of studies done by IBM on engagement and social marketing strategies with bottom-line profits. 

This course has been designed to give you the tools, insights, knowledge, and skills to immediately impact your organization. In addition, we will help you network with thought leaders in social.  After completing this course, you and your organization’s staff will be able to position, engage, and grow relationships with the consumers of highest value to you.

Today, we are living in a period of massive disruption. New technologies are changing the way people engage with each other and with the organizations that interest them. This course will start you on the path to growing your own social strategy using effective, proven methodologies.

Additional MOOC 1 faculty include: 
* Judy Ungar Franks (President, The Marketing Democracy, Ltd. & Lecturer, Medill Integrated Marketing Communications, Northwestern)",147545.0,37607.0,4.6,4026.0
Wie können Sie mit Pinterest Shopping starten,https://www.coursera.org/learn/wie-konnen-sie-mit-pinterest-shopping-starten,Business,Marketing,Malakah Badea,"In diesem geführten Projekt werden sie werden das Grundkonzept des Pinterest-Shopping kennenlernen und die wichtigkeit es zu nutzen, einkaufbare produkt-pins einrichten lernen und Ads (werbungen) verwenden, und wie man Pinterest-Shopping richtig nutzen kann lernen.
Am Ende dieses Projekts haben sie gelernt wie sie mit Pinterest Shopping starten sollen und was sie damit brauchen um erfolgreiche pins zu posten.",,,,
Wie man Facebook Messenger für ein Unternehmen einrichtet,https://www.coursera.org/learn/wie-man-facebook-messenger-fur-ein-unternehmen-einrichtet,Business,Marketing,Ali khalil aoun,"In diesem geführten Projekt, werden Sie ( 3 lernziele ) lernen.
Wie erstellen Sie eine Geschäftsseite, wie aktivieren Sie Nachrichten auf Ihrer Geschäftsseite, und wie erstellen Sie die perfekte personalisierte Nachricht für Ihre Geschäftsseite.
Am ende dieses Projekts haben Sie gelernt, wie richten Sie ein Facebook-Messenger-Konto für ein kleines Unternehmen ein.",,,,
Working with the Media,https://www.coursera.org/learn/working-with-the-media,Business,Marketing,Erin Willis,"In this course, you will learn about branding and the role of public relations as opposed to adjacent fields like advertising and marketing. You will understand the media and how to leverage storytelling with different outlets and gatekeepers. Foundational mass communication and public relations theories will be discussed in terms of issue and crisis management.",1912.0,11202.0,4.4,13.0
Zielsetzung für eine Facebook Werbekampagne,https://www.coursera.org/learn/zielsetzung-facebook-werbekampagne,Business,Marketing,Michelle Flores,"Nach Abschluss dieses Projekts kannst du, unabhängig davon, ob du eine neue Marke startest oder eine bestehende mithilfe deiner Social-Media-Strategie optimieren möchtest, besser auf deine Facebook Kundschaft eingehen und diese gezielt erreichen.

Aufgabe des Social Media Marketings ist es, kreative Wege zu finden um die Aufmerksamkeit der User für ihre Produkte und Dienstleistungen zu gewinnen. Dies erfolgt oftmals auf Basis eines sehr geringen Marketing Budgets. 

Ziel dieses Projekts ist es, verschiedene Ziele für Facebook Werbekampagnen kennenzulernen, und dich mit ihnen vertraut zu machen. Deine neu erworbenen Kenntnisse werden dir in Zukunft dabei behilflich sein die richtige Zielstrategie für deine Facebook Werbekampagne auszuwählen, um möglichst viele FAcebook User zu erreichen.

Du wirst heute zunächst einen Facebook Business Page Account erstellen. Anschließend wirst du Facebook Insights kennenlernen, bevor wir  auf Facebook Ads zuzugreifen. Diese Schritte werden dich bei der Zielsetzung einer Werbekampagne unterstützen und dir für zukünftige Werbekampagnen behilflich sein.",,,,
¿Cómo funcionan las marcas?,https://www.coursera.org/learn/como-funcionan-las-marcas,Business,Marketing,Rafael José Arria Ramos,"En este primer estaremos curso  se estará revisando el manejo correcto de la marca en los negocios el cual es fundamental para crear una ventaja competitiva y así diferenciarse de sus competidores para  dar sustentabilidad a la empresa en el largo plazo y consolidarse en sus mercados. 

Durante este curso analizaremos los elementos básicos que conforman la gestión y el manejo de una marca, así como los elementos básicos que la componen. Al finalizar el curso podrán tener una visión básica de la gestión de una marca y el impacto que tiene en las organizaciones y para el logro de sus objetivos.

Los objetivos del curso son los siguientes:

•	Identificar los elementos básicos de una marca.
•	Entender los procesos de la gestión de marca. 
•	Definir las distintas metodologías para gestionar la marca.",,,,
¿Qué hacer con tu estrategia digital en tiempos de cambio?,https://www.coursera.org/learn/planificacion-marketing-digital-first-course-1,Business,Marketing,"Sidney A. Ornelas Sánchez, Gricel Deyanira Castillo Cantú, José Ernesto Grimaldo Tijerina","Este curso está dirigido a emprendedores y empresarios de pequeñas y medianas empresas, así como ejecutivos en áreas comerciales que busquen conocer los fundamentos y estrategias básicas de la estrategia digital. El curso hace énfasis en el uso de herramientas de comunicación en medios digitales en el contexto de situaciones que presentan desafíos específicos como el lanzamiento de un negocio o marca, o la superación de una crisis.",,,,
¿Qué son los medios sociales?,https://www.coursera.org/learn/what-is-social-es,Business,Marketing,Randy Hlavac,"El curso en línea abierto y masivo (Massive Open Online Course, MOOC) “¿Qué son los medios sociales?” está destinado a empresarios, ejecutivos y profesionales del marketing que quieren mejorar considerablemente sus capacidades para potenciar su estrategia en los medios sociales con métodos efectivos y eficaces. Con este curso práctico y útil, no solo aprenderás cómo usar los medios sociales para fortalecer tu identidad profesional,sino que también llevarás a la práctica lo que aprendiste. Este es el primero de los seis cursos del programa de especialización “Marketing en los medios sociales: Cómo obtener ganancias en un mundo digital”. 

Si bien se puede asistir de forma gratuita, los participantes que paguen el curso recibirán más recursos además de los básicos. Para el MOOC 1, el material incluye un video especial de Alessandro Acquisti sobre macrodatos y un conjunto de estudios realizados por IBM sobre estrategias de participación y de marketing en los medios sociales con obtención de ganancias netas. 

Diseñamos este curso para darte las herramientas, la información, los conocimientos y las habilidades para que logres potenciar tu organización de inmediato. Además, te ayudaremos a ponerte en contacto con expertos reconocidos en los medios sociales.  Después de realizar el curso, tú y los miembros de tu organización podrán posicionarse, interactuar y establecer relaciones con los consumidores de mayor valor para ustedes.

Actualmente, estamos atravesando un período de muchísimas innovaciones. Las nuevas tecnologías están cambiando la forma en la que las personas se relacionan entre sí y con las organizaciones que les interesan. Este curso te mostrará el camino que debes seguir para definir tu propia estrategia de marketing en los medios sociales con métodos efectivos y eficaces.

Algunos de los profesores del MOOC 1 son: 
* Judy Ungar Franks (presidenta de The Marketing Democracy, Ltd., y profesora de Comunicación integrada de marketing en la Escuela Medill (Medill School) de la Universidad Northwestern (Northwestern University)",,,,
