name,url,category,subcategory,instructors,description,enrollment,views,rating,raters
Introduction to Social Media Marketing with Visme,https://www.coursera.org/learn/introduction-social-media-marketing-visme,Business,Marketing,Michelle Flores,"By the end of this project, you will create an instagram post and an instagram story post using the free version of Visme. Your new acquired skills will help you market your business and products on social media.

Consumers are constantly overloaded with information and images in social media. Part of social media marketing is learning creative ways to draw attention to products and services, oftentimes on a lean budget. In this project, learners will create edited social media photo posts using the free version of Visme. Visme is a web based all-in-one tool that helps you create visual content online. Learners can easily create and implement creative edits with online design tools to use when marketing their business.

We can use Visme to complete this project because it provides all the tools you need to create an organized and visually appealing product while offering a variety of options for sharing and collaboration. 

Note: This course works best for learners who are based in the North America region. We’re currently working on providing the same experience in other regions.",,,4.6,21.0
Introduction to the Digital Advertising Landscape,https://www.coursera.org/learn/digital-advertising-landscape,Business,Marketing,"Chris J. Vargo, Harsha Gangadharbatla","The digital advertising landscape is complex. There are many different types of ads, including: display, video, audio, sponsored, native, social media and search. Consumer data and the ad tech that action on that data are both ubiquitous and complicated. As a result the sheer number of options available to digital marketers is hard to comprehend and manage. This course covers the major forms of digital advertising, from basic display ads to search to cutting-edge programmatic advertising concepts. The Trade Desk, the leading programmatic advertising provider, joins us as our programmatic experts and offers an actionable roadmap on how small businesses can leverage state of the art advertising technologies to accomplish business objectives. In all, this course leaves students with an understanding of digital advertising in its various forms, and how to strategically identify digital advertising opportunities.",27156.0,17656.0,4.5,329.0
Introdução ao Marketing Analítico,https://www.coursera.org/learn/marketing-analitico,Business,Marketing,"Carlos R. F. Bara, Danny Claro, Silvio Laban","Público-Alvo

Profissionais, estudantes e interessados da área de Marketing que desejam conhecer os fundamentos básicos de Marketing Analítico e sua aplicação prática.
 
Objetivo do Curso
O curso tem como objetivo central introduzir o conceito de Marketing Analítico e apresentar de forma simplificada e prática algumas técnicas, de modo que o participante possa avaliar e recomendar decisões e ações em Marketing baseadas em análise de dados.

Objetivos de Aprendizagem
Ao final do curso o aluno será capaz de:
•	Explicar a importância de definir e utilizar métricas em Marketing.
•	Desenvolver métodos de levantamento de dados primários e secundários.
•	Desenvolver hipóteses testáveis inferindo causalidades. 
•	Segmentar o mercado com base no comportamento do consumidor. 
•	Gerar insights para o posicionamento de marca. 
•	Suportar a tomada de decisões em Marketing com base em fatos e dados.

Dedicação e Carga-Horária
Cinco módulos temáticos de aproximadamente 3h cada, totalizando 15h. Cada módulo tem duração estimada de uma semana.

Assista ao vídeo de divulgação do curso: https://youtu.be/FvtgLAW_s8Y",46842.0,9524.0,4.7,762.0
Introdução ao Marketing Digital,https://www.coursera.org/learn/introducao-ao-marketing-digital,Business,Marketing,"Kleber Oliveira, Tatti Maeda","Nossas boas-vindas ao Curso Introdução ao Marketing Digital.

Neste curso, você aprenderá sobre os aspectos gerais que ajudam a organização a compreender a aplicabilidade de estratégias de Marketing Digital para o seu contexto.

Ao final deste curso, você será capaz de compreender as interconexões entre o marketing e as ferramentas digitais, pensando estrategicamente sobre a incorporação das ações digitais nos diversos ambientes de conexão com os clientes. 

Este curso é composto por quatro módulos, disponibilizados em semanas de aprendizagem. Cada módulo é composto por vídeos, leituras e testes de verificação de aprendizagem. Ao final de cada módulo, temos uma avaliação de verificação dos conhecimentos.

Estamos muito felizes com sua presença neste curso e esperamos que você tire o máximo de proveito dos conceitos aqui apresentados.

Bons estudos!",,,,
Introdução ao marketing de mídias sociais,https://www.coursera.org/learn/introducao-ao-marketing-de-midias-sociais,Business,Marketing,Anke Audenaert,"Este curso aborda os conceitos básicos do marketing de mídias sociais. Você aprenderá sobre o escopo do marketing de mídias sociais, incluindo sua história e os diferentes canais de mídia social. Você aprenderá a selecionar um canal de mídia social que atenda às suas necessidades, definir metas e métricas de sucesso e descobrir quem é seu público-alvo. Ao final deste curso, você será capaz de: 

• Entender o ambiente do marketing tradicional, digital e de mídias sociais
 • Entender como receber o certificado de Digital Marketing Associate 
 • Entender as principais plataformas de mídia social, como funcionam e o papel dessas plataformas no marketing
 • Definir o público-alvo e a jornada do cliente
 • Escolher as plataformas de mídia social certas e aprender a criar políticas de mídia social

Qualquer que seja seu nível de conhecimento inicial, este curso o ajudará a construir uma base sólida para o marketing de mídias sociais e a ganhar habilidades práticas para ter mais sucesso em suas iniciativas de marketing de mídias sociais, com resultados tangíveis. 

Os alunos não precisam de experiência em marketing, mas devem ter habilidades básicas de navegação na Internet e interesse em participar ativamente em redes sociais. Os alunos devem ter uma conta no Facebook, e também é útil ter uma conta no Instagram.

Observação: Neste momento, o Coursera não oferece suporte em português. No momento, o Coursera oferece suporte nos seguintes idiomas: árabe, inglês e espanhol.",,5033.0,4.7,25.0
Intégrer des applications dans votre Dashboard Hootsuite,https://www.coursera.org/learn/integrer-applications-dashboard-hootsuite,Business,Marketing,Sara Nefzaoui,"À la fin de ce projet, vous aurez toutes les compétences de base pour intégrer des applications dans votre Dashboard Hootsuite. Vous serez en mesure de découvrir les différents types d’applications que vous pouvez installer et vous pourrez les intégrer facilement et rapidement à votre tableau de bord sur Hootsuite.",,,,
Investigación de mercados y comportamiento del consumidor,https://www.coursera.org/learn/investigacion-de-mercados,Business,Marketing,Shameek Sinha,"El primer curso de este especialización consta de dos bloques que te proveerán de los conocimientos necesarios para comenzar tu trayectoria en Marketing.

Aprende las herramientas y técnicas para convertir una decisión en una investigación real, esto lo verás en el primer módulo: Investigación de Mercado. Cómo plantear la investigación, analizar los datos recogidos, interpretarlos correctamente y comunicarlos a través de recomendaciones precisas serán algunas de las cuestiones tratadas en este curso. 

El segundo módulo se enfoca en el proceso de toma de decisiones por parte del consumidor, resaltando los momentos clave en el proceso de compra y consumo de un producto. Adapta tu enfoque “cliente-céntrico” en decisiones de marketing mediante el análisis de cómo tus clientes toman sus decisiones, reflexionando en qué sucede en sus corazones y mentes al momento de tomar decisiones y analizando las variables que son influyentes para tomarlas.",18965.0,10561.0,4.5,652.0
Kreiere Logos für dein Unternehmen mit Canva,https://www.coursera.org/learn/kreiere-logos-unternehmen-canva,Business,Marketing,Michelle Flores,"Nach Abschluss dieses Projekts, kannst du verschiedene individuelle und exklusive Logos mit  Hilfe der gratis Version von Canva kreieren und gestalten. 

In diesem angeleiteten Projekt wirst du lernen, verschiedene Arten von Logos zu designen. Deine persönlichen Logos kannst du auf verschiedenen Produkten anbringen und an deine Kundschaft zum Beispiel auf Messeständen verteilen.  Deine neu erworbenen Kenntnisse werden dir dabei helfen, deine Firma zu bewerben. 

Canva ist ein web basiertes Online-Gestaltungs-Tool, dass jedem User erlaubt, einfache oder komplexe Grafiken zu erstellen. Canva setzt keine Installation von Software voraus um Projekte zu kreieren.
Die web basierte Plattform Canva bietet alle nötigen Werkzeuge um visuell attraktive und organisierte Produkte alleine, oder als Team  zu kreieren und zu teilen. Am Ende dieses Projekts wirst du gelernt haben, Grafikdesign Tools anzuwenden um kreative und visuell ansprechende Projekte zu gestalten.",,,,
Kreiere animierte Posts für soziale Medien mit Canva,https://www.coursera.org/learn/kreiere-animierte-posts-soziale-medien-canva,Business,Marketing,Michelle Flores,"Nach Beendigung dieses Projekts, kannst du animierte Posts für soziale Medien mit Hilfe der gratis Version von Canva kreieren und gestalten. 

Egal, ob du eine neue Marke startest oder eine bestehende mithilfe deiner Social-Media-Strategie optimieren möchtest – visuelle Inhalte unterstützen dich bei der Etablierung deiner Online-Identität.
User von sozialen Netzwerken werden im heutigen Zeitalter von Informationen und Bildern regelrecht überschwemmt. Aufgabe des Social Media Marketings ist es daher, kreative Wege zu finden um die Aufmerksamkeit der User für ihre Produkte und Dienstleistungen zu gewinnen. 

Die web basierte Plattform Canva bietet alle nötigen Werkzeuge um visuell attraktive und organisierte Produkte alleine, oder als Team  zu kreieren und zu teilen. Am Ende dieses Projekts wirst du gelernt haben, Grafikdesign Tools anzuwenden um kreative und attraktive animierte Grafiken für soziale Medien zu gestalten.",,,,
L'analyse marketing,https://www.coursera.org/learn/uva-darden-market-analytics-fr,Business,Marketing,Rajkumar Venkatesan,"Les organisations, quelle que soit leur taille, sont inondées de données sur les choix des consommateurs. Mais cette abondance d'informations ne se traduit pas toujours en de meilleures décisions. Savoir interpréter les données est le défi à relever, et il est de plus en plus attendu que les professionnels du marketing utilisent l'analyse pour éclairer et justifier leurs décisions.

L'analyse marketing leur permet de mesurer, gérer et étudier la performance marketing pour maximiser son efficacité et optimiser les retours sur investissement (ROI). Au-delà des applications évidentes de génération de ventes et de clients éventuels, l'analyse marketing peut offrir des informations détaillées sur les préférences et tendances des clients, qui peuvent être alors utilisées lors de décisions commerciales et de marketing ultérieures.

Ce cours, développé à la Darden School of Business auprès de la University of Virginia, vous donne les outils qui vous permettront de mesurer les actifs du client et de la marque, comprendre l'analyse de régression, et concevoir des expériences comme moyens d'évaluation et d'optimisation des campagnes marketing. À la fin de ce cours, vous aurez acquis une compréhension solide des diverses façons d'utiliser l'analyse marketing pour prédire des résultats et allouer systématiquement des ressources.

Vous pouvez suivre mes messages sur Twitter, @rajkumarvenk, et sur LinkedIn : https://www.linkedin.com/in/education-marketing.

Merci,
Raj
Professeur de gestion d'entreprise à Darden",,2016.0,,
L'utilisation optimal de LinkedIn,https://www.coursera.org/learn/utilisation-optimal-linkedin,Business,Marketing,Lamia Labello,"À la fin de ce projet, vous aurez une meilleure compréhension de LinkedIn et des possibilités que votre profil peut vous offrir. Nous vous guiderons étape par étape pour que vous ayez un profil plus fort et que vous vous familiarisez avec les outils offerts par LinkedIn.Nous allons explorer les bases de la meilleure configuration de profil et toutes les options qui sont offertes. Vous pouvez même apprendre quelque chose que vous ne connaissez pas déjà sur votre profil si vous en avez déjà un.

Remarque : ce cours fonctionne le mieux pour les étudiants basés en Amérique du Nord. Nous nous efforçons actuellement d'apporter la même expérience dans d'autres régions.",,,,
Lancer une campagne publicitaire sur Pinterest,https://www.coursera.org/learn/lancer-une-campagne-publicitaire-sur-pinterest,Business,Marketing,Hiba Assi,"Dans ce projet guidé, nous avons découvert Pinterest et son importance pour lancer une campagne publicitaire en plusieurs étapes, d'abord créer un compte professionel puis choisir une cible pour notre publicité,ensuite nous avons déterminé notre audience, encore nous avons détfinniser l'obejctif et l'emplacement et enfin le budget et calendrier de notre nouveau annonce.
À la fin de ce projet, vous aurez appris à comment lancer une campagne publicitaire sur Pinterest.",,,,
Las redes sociales en acción,https://www.coursera.org/learn/red-social,Business,Marketing,"José Antonio Cano Chambonnet, María de los Angeles Ramos Solano ","Como un mercadólogo, tenemos claro que nuestra función principal en las empresas es identificar las necesidades del mercado y con base en ellas establecer estrategias de compra – venta que causen impacto y satisfagan las necesidades de los consumidores. Éste es un reto importante, pero además de ser creativos en la definición de estas estrategias, tenemos que tener en cuenta el desarrollo que a través de los últimos años ha tenido el Internet y atrás de él las redes sociales. Es por ello que hay que estar conscientes de la importancia que las redes van teniendo y cómo pueden ayudar a la promoción de los productos y servicios que como proveedor estamos ofreciendo. 

En este curso podrás conocer cómo se ejecuta una estrategia de redes sociales y las consideraciones que debes de tener para controlar y medir el desempeño de tu estrategia. Podrás identificar cómo evaluar si es posible gestionar la estrategia con recursos propios, si es necesario utilizar una agencia o si es apropiado hacerlo con un esquema mixto; también reconocerás la importancia de realizar una escucha activa y las herramientas que te permitirán desarrollar esta actividad, las plataformas más convenientes y la frecuencia más apropiada para tu negocio, los indicadores clave de medir y cómo hacerlo y finalmente las técnicas para optimizar el desempeño de tu estrategia de redes sociales y lograr tus objetivos.

Seguramente te serán de gran utilidad dentro del ámbito de la mercadotecnia.",24336.0,2225.0,4.6,683.0
Launch Your Online Business,https://www.coursera.org/learn/launch-online-business,Business,Marketing,Joan Decollibus,"Learners who complete the course will:

- gain an understanding of different business models
- learn strategies for naming their business
- create customer personas
- create their brand identity
- create their Unique Value Proposition and learn how to make their business stand out from their competitors
- know every step needed to build their website including best practices
- production do's and don'ts for copywriting, photography and video
- have a pre-launch checklist and website maintenance
- gain foundational knowledge of marketing and pr
- create a Pitch Deck about their business that they can deliver to potential partners and investors",30231.0,82372.0,4.8,282.0
Le marketing dans un monde numérique,https://www.coursera.org/learn/marketing-digital-fr,Business,Marketing,Aric Rindfleisch,"Ce cours aborde la manière dont les nouveaux outils numériques (Internet, smartphones, impression 3D) révolutionnent le monde du marketing en modifiant les rôles et les habitudes des entreprises comme des clients. Avec plus de 500 000 étudiants, le cours « Le marketing dans un monde numérique » est l’un des plus populaires de Coursera, et Class Central le considère comme l’un des 50 meilleurs MOOC de tous les temps (https://www.class-central.com/report/top-moocs/).

Vous pourrez :
•	Comprendre comment les outils numériques modifient la nature du marketing
•	Expliquer comment les outils numériques permettent aux clients de jouer un rôle plus actif dans le développement, la promotion, le placement et le prix des produits
•	Acquérir un nouvel ensemble de concepts, d’outils et de récits pour améliorer vos activités de marketing digital

Ce cours fait partie de la suite de programmes en ligne du Gies College of Business, notamment l’iMBA et l’iMSM. Pour en savoir plus sur l’inscription à ces programmes et découvrir comment utiliser votre travail Coursera en cas d’admission dans un programme diplômant, consultez le site https://degrees.giesbusiness.illinois.edu/idegrees/.",,4309.0,,
Les Statistiques d'Audience Facebook,https://www.coursera.org/learn/les-statistiques-d-audience-facebook,Business,Marketing,Zahra Kamaledin,"Dans ce projet guidé, vous apprendrez comment les statistiques d'audience Facebook vous aident à cibler vos publicités Facebook. Vous découvrirez l'outil, apprendrez la méthode pour y accéder, et connaissez l'audience potentielle, en terminant par la stratégie à suivre pour trouver de vraies pages Facebook à cibler.
A la fin de ce projet, vous aurez appris à accéder aux statistiques d'audience Facebook et valider la taille d'un marché potentiel, analyser les fans de vos pages Facebook, et valider les intérêts à cibler pour votre ciblage avancé, et valider les pages ciblées Facebook.",,,,
MailChimp pour les débutants,https://www.coursera.org/learn/mailchimp-debutants,Business,Marketing,Sara Nefzaoui,"À la fin de ce projet, vous aurez toutes les compétences de base pour créer une campagne d’Emails Marketing pour votre marque en utilisant gratuitement MailChimp, plateforme d’automatisation de campagnes Marketing digitales. Grâce à ce projet, vous serez en mesure d’utiliser facilement MailChimp et de découvrir les diverses options et fonctionnalités de la plateforme.

Remarque : ce cours fonctionne le mieux pour les étudiants basés en Amérique du Nord. Nous nous efforçons actuellement d'apporter la même expérience dans d'autres régions.",,,,
"Make the Sale: Build, Launch, and Manage E-commerce Stores",https://www.coursera.org/learn/make-the-sale,Business,Marketing,Google Career Certificates,"Make the Sale: Build, Launch, and Manage E-commerce Stores is the sixth of seven courses in the Google Digital Marketing & E-commerce Certificate. This course explores how businesses and individuals sell products online, including using popular platforms like Shopify.  You’ll go through the process of creating a mock e-commerce store. To do this, you’ll build a Shopify store, add the necessary information, and create product listings. You’ll explore how to reach customers online through e-commerce customer outreach methods like advertisements and campaigns.

Google employees who currently work in the field will guide you, providing hands-on activities and examples that simulate common digital marketing and e-commerce tasks while showing you some of the best tools and resources used on the job.

Learners who complete the seven courses in this program will be ready to apply for entry-level jobs in digital marketing and e-commerce. No previous experience is necessary.

By the end of this course, you will be able to do the following: 
- Understand essential e-commerce strategies and practices
- Explain how to conduct market research and product research
- Set up a mock e-commerce store using Shopify
- Use Google Ads to engage e-commerce customers
- Explain how trends and seasonality affect e-commerce businesses
- Use best practices to create an engaging customer experience online
- Describe the order fulfillment process through checkout, point of sale (POS), shipping, and delivery. 
- Optimize a checkout flow for customers",20271.0,370941.0,4.8,224.0
Managing Uncertainty in Marketing Analytics,https://www.coursera.org/learn/uncertainty-marketing-decisions,Business,Marketing,David Schweidel,"Marketers must make the best decisions based on the information presented to them. Rarely will they have all the information necessary to predict what consumers will do with complete certainty. By incorporating uncertainty into the decisions that they make, they can anticipate a wide range of possible outcomes and recognize the extent of uncertainty on the decisions that they make. In Incorporating Uncertainty into Marketing Decisions, learners will become familiar with different methods to recognize sources of uncertainty that may affect the marketing decisions they ultimately make. We eschew specialized software and provide learners with the foundational knowledge they need to develop sophisticated marketing models in a basic spreadsheet environment. Topics include the development and application of Monte Carlo simulations, and the use of probability distributions to characterize uncertainty.",9775.0,,4.2,62.0
Market Research and Consumer Behavior,https://www.coursera.org/learn/market-research,Business,Marketing,Shameek Sinha,"Your marketing quest begins here! The first course in this specialization lays the neccessary groundwork for an overall successful marketing strategy. It is separated into two sections: Market Research and Consumer Behavior.

Gain the tools and techniques to translate a decision problem into a research question in the Market Research module. Learn how to design a research plan, analyze the data gathered and accurately interpret and communicate survey reports, translating the results into practical recommendations.

You will then focus in on the consumer decision-making process, highlighting the key moments from identifying a need to buying and consuming a product. Adopt a true “consumer focus” in your managerial decisions by analyzing how consumers make decisions, what happens (in their hearts and minds) at different stages of the decision making process, and the variables that influence those decisions.

This course will equip you with the knowledge required to understand the state of your product before approaching the market strategy. There’s no better place to build the foundations of your marketing journey!",105647.0,61986.0,4.4,4451.0
Market and Competition in Pricing Strategy,https://www.coursera.org/learn/uva-darden-bcg-pricing-strategy-market-competition,Business,Marketing,"Jean Manuel Izaret, Ronald T. Wilcox, Thomas Kohler","If you haven’t considered what the competition is charging, you may not be maximizing your revenue. Spend time analyzing the market and you can influence price and improve margins. In this course, we'll show you how to implement competitive pricing and avoid common legal pitfalls of market-based pricing. You will also learn how to predict, influence and respond to competitors’ pricing moves. Developed at the Darden School of Business at the University of Virginia, and led by top-ranked Darden faculty and Boston Consulting Group global pricing experts, this course provides an in-depth understanding of market-based pricing and how to use it to capture more revenue.",9210.0,9378.0,4.8,213.0
Market your new business with Canva,https://www.coursera.org/learn/market-new-business-canva,Business,Marketing,Michelle Flores,"By the end of this project, you will know how to use Canva to promote and market your new business. You will have learned how to create a business logo, a business card and a flyer using Canva. We will both use templates, and create designs from scratch.

You will be able to incorporate a color scheme, images, and other design elements for aesthetically pleasing.

This project will include intermediate to advanced level skills using the free version of Canva.

Note: This course works best for learners who are based in the North America region. We’re currently working on providing the same experience in other regions.",,,4.7,20.0
