name,url,category,subcategory,instructors,description,enrollment,views,rating,raters
Design a Product Package on Mockup using Adobe Photoshop,https://www.coursera.org/learn/design-a-product-package-on-mockup,Business,Marketing,Amr Ellaithy,"By the end of this project, you will create a product package design with mockups using Adobe Photoshop CC. Throughout the tasks, you will be able to use the vanishing point tool to insert designs on the mockup layer, use the wrap transformation to replace irregular shape mockup with graphic design. Also, you will be able to duplicate layers, relight mockup layers and add different shadow types. finally, you will export your design for final use. 

This guided project is for intermediate designers  since we will develop from the basic knowledge of designing tools in photoshop like brush tools, Layer styles, and masks, also designers who are familiar with Perspective drawing

This project will provide you with the ability to create a product design with mockups based on the amazing designing and transformation tools in photoshop which merge perspective and standard transformation environment. Knowing how to make package designs using mockups enriches your designing career in many promising fields like Retail Business, Advertising, Printing and packaging, and of course Social media!",,,4.8,12.0
Design a Professional Business card with QR code using Canva,https://www.coursera.org/learn/design-professional-business-card-with-qr-code-using-canva,Business,Marketing,Abhishek Jha,"In this 1-hour long project-based course, you will learn how to design a high-quality business card that is professional, attractive and suited for the digital age. With this card, your clients can save your contact details on their mobile in an offline mode with just a click. They will also be able to connect with your Facebook Business page, LinkedIn Id, Twitter and Snapchat. They can Whatsapp you and they will also be able to watch your Youtube promotional videos.  They will be able to take a look at all the products and services that you offer on your website. They can text you, call you and email you with just a click. They can also have access to the Google map location of your business. So we will be creating a business card that will be able to do all of these and more.

We will also be building a cloud-based Virtual Business card that you can easily share with your clients digitally. In the final task, we will integrate this virtual business card with the physical one in order to maximize the benefits of using both cards: virtual and paper-based.

Note: This course works best for learners who are based in the North America region. We’re currently working on providing the same experience in other regions.",3231.0,,4.7,60.0
Design an eBook Cover that stands out using Canva,https://www.coursera.org/learn/design-an-ebook-cover-that-stands-out-using-canva,Business,Marketing,Abhishek Jha,"In this 1-hour long project-based course, you will learn how to design an eBook cover using Canva that looks professional, elegant and eye-catching. You will be designing two ebook covers: one using Professional ebook cover pre-built templates and another completely from scratch. You will also learn about important things that as a writer you must know before choosing a Template, Title and Pen name.

We will be primarily focusing on Amazon Kindle Direct Publishing(KDP) although the eBook cover can also be used for other marketplaces. I myself have published 4 books through Amazon KDP available in both ebook and Paperback versions. By the end of this project, you will be confident in creating an eBook cover that is of extremely High Quality. You can just download the eBook cover and upload it on Amazon.

So, whether you are a writer who is looking to self publish an ebook on Amazon Kindle or you are a Freelancer looking to get into the ebook freelancing market, you will find this guided project extremely beneficial. We will be using Canva for our guided project. Canva is a Cloud-based graphic design online software that has thousands of templates and designs to choose from. It is free and has lots of features to choose from. 

You don't need any prior experience in ebook cover design or graphics design inorder for you to complete this project. 

Note: This course works best for learners who are based in the North America region. We’re currently working on providing the same experience in other regions.",3113.0,,4.3,79.0
Design engaging Facebook / Instagram Stories with Visme,https://www.coursera.org/learn/design-engaging-facebook-instagram-stories-visme,Business,Marketing,Michelle Flores,"By the end of this project, you will learn how to create and design engaging stories for Instagram and Facebook to promote your business using the free version of Visme. 

You will be able to incorporate a color scheme, images, and other design elements for aesthetically pleasing and value-added business marketing collateral.  We can use Visme to complete this project because it provides all the tools you need to create organized and visually appealing products while offering a variety of options for sharing and collaboration. You will learn how to plan and organize your ideas and utilize graphic design tools as you create social media stories to advertise your brand or products.",,,,
Design engaging Stories for Instagram and Facebook in Easil,https://www.coursera.org/learn/design-engaging-stories-instagram-facebook-easil,Business,Marketing,Michelle Flores,"By the end of this project, you will learn how to create and design engaging stories for Instagram and Facebook in Easil to promote your business. An essential role of your social media marketing strategy is to establish your online identity and appeal to your users.

In this guided project, we will use the free version of Easil. You will be able to incorporate a color scheme, images, and other design elements for aesthetically pleasing and value-added business marketing collateral.  We can use Easil to complete this project because it provides all the tools you need to create organized and visually appealing products while offering a variety of options for sharing and collaboration. You will learn how to plan and organize your ideas and utilize graphic design tools as you create social media stories to advertise your brand or products.",,,,
Designe Facebook / Instagram Story Posts mit Canva,https://www.coursera.org/learn/designe-facebook-instagram-story-posts-canva,Business,Marketing,Michelle Flores,"Nach Beendigung dieses Projekts, kannst du Story Posts für Instagram und Facebook mit Hilfe der gratis Version von Canva kreieren und designen. 

User von sozialen Netzwerken werden im heutigen Zeitalter von Informationen und Bildern regelrecht überschwemmt. Aufgabe des Social Media Marketings ist es daher, kreative Wege zu finden um die Aufmerksamkeit der User für ihre Produkte und Dienstleistungen zu gewinnen. Dies erfolgt oftmals auf Basis eines sehr geringen Marketing Budgets. 

Die web basierte Plattform Canva bietet alle nötigen Werkzeuge um visuell attraktive und organisierte Produkte alleine, oder als Team zu kreieren und zu teilen. Am Ende dieses Projekts wirst du gelernt haben Grafikdesign Tools anzuwenden um kreative und attraktive Story Posts für Instagram und Facebook zu kreieren. Diese Posts werden dir dabei behilflich sein, dein Business zu bewerben.",,,,
Designe dein Ebook mit Canva,https://www.coursera.org/learn/designe-ebook-canva,Business,Marketing,Michelle Flores,"Nach Abschluss dieses Projekts, kannst du ein Ebook mit Hilfe der gratis Version von Canva kreieren. Hierfür wirst du ein Titelblatt, ein Inhaltsverzeichnis und Statistiken erstellen. Deine neu erworbenen Kenntnisse werden dir in Zukunft dabei behilflich sein, Ebooks zu designen und zu vermarkten.

Eine sehr beliebte und Erfolg versprechende Methode um deine Leidenschaft in ein monetäres Business zu verwandeln besteht darin Ebooks zu schreiben und zu veröffentlichen. Jeder von uns hat einen bestimmten Bereich in dem er über viel Wissen verfügt. Du kannst anderen Menschen helfen, indem du dein  Wissen weitergibst und es mit ihnen teilst.

Die web basierte Plattform Canva bietet alle nötigen Werkzeuge um visuell attraktive und organisierte Produkte alleine, oder als Team  zu kreieren und zu teilen.",,,,
Develop a Company Website with Wix,https://www.coursera.org/learn/develop-a-company-website-with-wix,Business,Marketing,Abby Saey,"By the end of this project, you will create a high-quality website with Wix. Wix is a free program that helps you design and build your own personalized website. This project will teach you how to maximize the design features of Wix to create a business website. Wix can help you to create a professional website to highlight your company’s brand, mission, and products/services. A strong online presence can help to solidify a company’s brand, attract new customers, and provide important information to the public.

This project will walk you through the website development process with Wix from start to finish. From creating an account to launching your website, this project will cover it and get you on your way to better managing your company’s online presence and brand!

Note: This course works best for learners who are based in the North America region. We’re currently working on providing the same experience in other regions.",46499.0,,4.5,1022.0
Developing Customer Insights with Empathy Map Canvas,https://www.coursera.org/learn/developing-customer-insights-with-empathy-map-canvas,Business,Marketing,Omodiaogbe Samuel,"By the end of this guided project, you will be able to use the empathy map canvas to develop empathetic insight on your customers. Empathy mapping is a visualization tool that allow you to articulate what you know about the customers.  It’s considered as part of the design thinking methodology, and it empower you to create a shared understanding of customer functional, psychological and emotional needs. The canvas has 6 blocks comprising the goal (who, and what), see, say, do, hear, and think &feel (pains and gains). By analyzing each of the blocks, you would be able to develop deeper insights on the customers, and therefore come up with solutions that resonates with their expectations 

For us to practically demonstrate how to use the Empathy Map Canvas to conduct analysis and make strategic decisions, we will use a spreadsheet to analyze a Fintech startup company as a case study. Example of the case study would empower you to apply the model to your company or any other company of your choice. The project is for marketers, customer experience designers, startup founders, and innovation professionals that want to develop customer-focused strategy. At the end of the project, you will be able to use the canvas to develop customer-centric insights, and therefore understand your business from the customer worldview",,,,
Developing a Marketing Mix for Growth,https://www.coursera.org/learn/marketing-management-two,Business,Marketing,Hayden Noel,"In this course, you will further examine how businesses create value for customers. In Marketing Management I, you learned the major elements of the marketing mix - product policy, channels of distribution, communication, and pricing - and saw how they fit within different analytical frameworks that are useful to managers. In this course, you will complete a more detailed analysis of these elements in order to conduct a thorough strategic analysis of marketing opportunities and to communicate marketing decisions. This will enable you to see “marketing in action” in the business world.

You will be able to: 

• Define all elements of the marketing mix and explain the role each element plays in creating value 
• Compare different pricing models 
• Evaluate the use of different channels of distribution by existing businesses 
• Critique advertising execution 
• Create a persuasive advertising piece

This course is part of Gies College of Business’ suite of online programs, including the iMBA and iMSM. Learn more about admission into these programs and explore how your Coursera work can be leveraged if accepted into a degree program at https://degrees.giesbusiness.illinois.edu/idegrees/.",24377.0,46430.0,4.8,659.0
Developing a Winning Marketing Strategy,https://www.coursera.org/learn/marketing-management,Business,Marketing,Hayden Noel,"In this course, you will learn how businesses create value for customers. We will examine the process by which Marketing builds on a comprehensive understanding of buyer behavior to create value. You will learn the major elements of the marketing mix -- product policy, channels of distribution, communication, and pricing -- and see how they fit within different analytical frameworks that are useful to managers. This will enhance your understanding of how marketing works in the business world. 

You will be able to: 
• Define marketing and describe how marketing creates value 
• Describe the elements of the marketing mix 
• Explain how these elements interact to create value for consumers 
• Use different analytical frameworks to examine how managers solve business problems 
• Evaluate brand extensions 
• Develop a marketing plan proposal
This course is part of Gies College of Business’ suite of online programs, including the iMBA and iMSM. Learn more about admission into these programs and explore how your Coursera work can be leveraged if accepted into a degree program at https://degrees.giesbusiness.illinois.edu/idegrees/.",45217.0,168842.0,4.8,1630.0
Digital Business Marketing with Easil,https://www.coursera.org/learn/digital-business-marketing-easil,Business,Marketing,Michelle Flores,"By the end of this project, you will know how to use Easil to digitally promote and advertise your business on Social Media. You will have learned how to create a Facebook Ad and a Facebook Cover with help of Easil. We will both use templates, and create designs from scratch.

Consumers are constantly overloaded with information and images in social media. Part of social media marketing is learning creative ways to draw attention to products and services, oftentimes on a lean budget. In this course, learners will create edited social media photo posts using the free version of Easil. Easil is a web based all-in-one tool that helps you create visual content online. 

Learners can easily create and implement creative edits with online design tools to use when marketing their business.

We can use Easil to complete this project because it provides all the tools you need to create an organized and visually appealing product while offering a variety of options for sharing and collaboration.


Note: This course works best for learners who are based in the North America region. We’re currently working on providing the same experience in other regions.",,,,
Digital Channel Planning and E-Commerce Strategy,https://www.coursera.org/learn/digital-channel-planning-ecommerce-strategy,Business,Marketing,"Digital Marketing Institute, Cathal Melinn","Digital Marketing Institute is the global standard in Digital Marketing Certification. Our mission is to give our students the confidence and knowledge they need to advance in their careers through this specialization.

Research shows that retail customers switch channels during their purchase-decision journey. Many of us research products online at home, or on-the-go using a mobile device, while checking online reviews and comparing prices. The final decision to purchase may happen online, or in a traditional brick-and-mortar store. Omnichannel marketing is a response to modern buying habits, providing consumers with a consistent brand experience across all touchpoints, whether traditional or digital. If you want to understand how marketers plan campaigns to reach consumers at every possible point of contact and how effective digital strategies can help businesses grow and thrive today, this course will help you do so.

You will learn about cross-media planning and the digital channel mix before diving deeper into topics including digital channel planning, and inbound and outbound channel strategy. After completing this course, you will be able to: -
• Use best practices to create an omnichannel marketing strategy with a unified message, voice, and brand and a seamless customer experience
• Demonstrate an understanding of the key tactics and strategies associated with inbound channels including social media marketing, content marketing, search engine marketing, and email marketing
• Demonstrate an understanding of the key tactics and strategies associated with outbound channels including digital display, video, and YouTube advertising

This course also covers the critical topic of e-commerce and how to develop an effective e-commerce and social customer service strategy that delivers real value for customers. This is the second course in the Digital Marketing Institute’s Digital Strategy specialization.

On completion of all courses in your Specialization, you will also be awarded a Digital Marketing Institute Certified Digital Marketing Associate certification, along with three months of free Power Membership, allowing you to boost your career and unlock your next opportunity. 92% of DMI members have said their courses have had a positive impact on their careers, while 88% are now working at senior or manager level.",6710.0,22747.0,4.7,47.0
Digital Leadership and Digital Strategy Execution,https://www.coursera.org/learn/digital-leadership-digital-strategy-execution,Business,Marketing,"Digital Marketing Institute, Cathal Melinn","Digital Marketing Institute is the global standard in Digital Marketing Certification. Our mission is to give our students the confidence and knowledge they need to advance in their careers through this specialization.

The ability and willingness to strategically adopt digital initiatives to support business goals has never been more critical to an organization’s survival than it is today. If you want to better understand the knowledge, skills, and behaviors demanded of digital leaders as well as the forces driving and transforming businesses today, this course will help you do so.

You will learn to use techniques to develop and hone your strategic thinking skills and develop skills to help you transition smoothly from a senior or management role to a leadership role. After completing this course, you will be able to: -
• Demonstrate an understanding of how an iterative approach to Customer Experience (CX) design can improve an organization’s performance
• Use best practices for recruiting, training, and developing digital marketing personnel
• Demonstrate an understanding of how to combine an optimal channel and budget mix, supported by a paid media and campaign action plan, to execute a digital marketing strategy
• Recognize the types of risks associated with digital and why businesses need to protect against them

This course also covers the key concepts, actions, and behaviors that underpin effective digital leadership in business. You will learn about the key international data protection and data privacy laws applicable to digital campaigns and the risks associated with digital, as well as effective strategies to mitigate the risks. This is the final course in the Digital Marketing Institute’s Digital Strategy specialization.

On completion of all courses in your Specialization, you will also be awarded a Digital Marketing Institute Certified Digital Marketing Associate certification, along with three months of free Power Membership, allowing you to boost your career and unlock your next opportunity. 92% of members have said their courses have had a positive impact on their careers, while 88% are now working at senior or manager level.",3044.0,12037.0,4.5,33.0
Digital Marketing Capstone,https://www.coursera.org/learn/digital-marketing-capstone,Business,Marketing,"Aric Rindfleisch, Kevin Hartman, Vishal Sachdev, Mike Yao","This four-week Capstone of the Digital Marketing Specialization is designed to help you apply the principles you have learned in the previous  courses.

This capstone course is designed to give you hands-on experience in executing a digital marketing campaign for a fictitious firm selling electronics. In the previous courses on analytics and channels, you came up with strategies to identify a firm’s objectives, specify a few key ones, research alternatives to reaching the customer in their decision journey and finally propose a multi-channel digital marketing plan. In this capstone, you will execute a campaign, rather than creating another ""plan"".

You will use an online simulation to do this. You will be a marketing manager for a firm selling digital cameras online through their webstore. You will be reviewing the products, pricing, margins, and historical sales. You will create a targeted ad campaign after researching appropriate keywords for the products you are selling. You will also review the basics of landing page design and search engine optimization. You will then create and execute an email campaign. Once these campaigns are executed, you get feedback on the KPI's such as revenue, profits, traffic, conversions. You will get an opportunity to redo this campaign, with new strategies, to improve your KPI's in the second round. 

This course is part of the iMBA offered by the University of Illinois, a flexible, fully-accredited online MBA at an incredibly competitive price. For more information, please see the Resource page in this course and onlinemba.illinois.edu.",21633.0,11894.0,4.5,564.0
"Digital Marketing Strategy with Goldman Sachs 10,000 Women",https://www.coursera.org/learn/10kw-digital-marketing,Business,Marketing,"Dionysius Ang, Goldman Sachs 10,000 Women","This elective course is an introduction to digital marketing, with a particular focus on social media campaigns. The course supplements the Goldman Sachs 10,000 Women course collection, designed for entrepreneurs ready to take their business to the next level.

In this course, you will learn top tips for an effective digital marketing campaign and how to plan and evaluate social media campaigns to maximize business opportunities.
 
You will develop a practical understanding of the planning process of a social media campaign, and how to effectively use paid, earned and owned media in your digital marketing. You will also consider the role of influencers in your marketing, explore viral marketing, paid search, website placement and other digital marketing tools and techniques that help create a successful digital marketing campaign. 

At the end of this elective course, you can apply and practice what you have learned by working on a digital marketing campaign.  

This course is one of three elective courses complementing the 10,000 Women core collection.  It is a great introduction or follow up to the Fundamentals of Sales and Marketing course with Goldman Sachs 10,000 Women in the core collection but you may choose to take any additional courses to suit your needs. 

The 10,000 Women course collection offers a truly flexible online learning experience. You have the freedom to approach the program in any way that works for you – take any course, or combination of courses, to tailor your learning journey to your individual business growth needs. 

Find out more about the Goldman Sachs 10,000 Women collection in the FAQs.",3335.0,11499.0,4.7,65.0
Digital Media and Marketing Principles,https://www.coursera.org/learn/marketing-channels,Business,Marketing,Mike Yao,"The Digital Revolution has led to a titanic shift in the landscape of marketing communications, while also creating new opportunities for businesses to reach and engage consumers through smart, social, and mobile media technologies. In this course, you will learn about the impacts of digital technologies on marketing communication strategies and practices. By understanding the underlying processes of marketing communication and the core features of new media technologies, you can strategically select the appropriate channels to deliver the right marketing message to the right audience at the right moment.

You will be able to:
-	Examine marketing as a process of highly strategic communication 
-	Understand the impacts of digital media and information technologies on communication and marketing
-	Develop a conceptual understanding of several digital marketing strategies
-	Consider the rise of exciting new technologies, such as  AI, Internet of Things, and Mix Reality, as new tools for digital marketing
This course is part of Gies College of Business’ suite of online programs, including the iMBA and iMSM. Learn more about admission into the program and explore how your Coursera work can be leveraged if accepted into a degree program at https://degrees.giesbusiness.illinois.edu/idegrees/.",90972.0,80863.0,4.4,2713.0
