name,url,category,subcategory,instructors,description,enrollment,views,rating,raters
A Organização Centrada na Jornada do Cliente,https://www.coursera.org/learn/a-organizacao-centrada-na-jornada-do-cliente,Business,Marketing,Carlos Alves,"Nossas boas-vindas ao Curso A Organização Centrada na Jornada no Cliente.

Neste curso, você aprenderá que objetivos de negócio de uma empresa somente podem ser atingidos se houver co-criação de valor entre seus profissionais e fornecedores. Para tanto, os clientes devem estar no centro de suas definições e atividades. Ao discutir os objetivos em conjunto, é possível entender os desafios, construir soluções efetivas em conjunto e ser mais assertivo no uso de recursos corporativos, que efetivamente entreguem valor.

Ao final deste curso, você será capaz de:

- Identificar e discutir os objetivos de negócio do cliente.
- Desenhar e acompanhar sua jornada e experiência com o provedor de serviço.

Este curso é composto por quatro módulos, disponibilizados em semanas de aprendizagem. Cada módulo é composto por vídeos, leituras e testes de verificação de aprendizagem. Ao final de cada módulo, temos uma avaliação de verificação dos conhecimentos.

Estamos muito felizes com sua presença neste curso e esperamos que você tire o máximo de proveito dos conceitos aqui apresentados.

Bons estudos!",,,,
A Start Guide: Product Marketing Using G Suite,https://www.coursera.org/learn/product-marketing-using-gsuite,Business,Marketing,Radwa Fathi,"In this 1-hour 40-minutes long project-based course, you will be able to identify your product mix, draw your product hierarchy levels as well as analyzing the sales performance of your product item or what we call stock-keeping unit (SKU). You will learn how to build successful product lines by identifying the problems and finding solutions for each product item or the stock-keeping unit ( SKU).

Note: This course works best for learners who are based in the North America region. We’re currently working on providing the same experience in other regions.",1875.0,,4.6,32.0
Adding Special Effects in Adobe Photoshop,https://www.coursera.org/learn/adding-special-effects-in-adobe-photoshop,Business,Marketing,Daniel Marshall,"Adobe Photoshop can be used to create wondrous works of art. Its tools allow a skilled artist to blend the boundaries of reality and art with the strokes of a brush, or lines of a pencil.  In this lesson, you will learn to augment the use of these basic tools through the implementation of special effects. From drop shadows, to outer glows, a whole universe of artistic variation is about to become unlocked; and it’s waiting just for you.",,,,
Advanced Content and Social Tactics to Optimize SEO,https://www.coursera.org/learn/seo-tactics,Business,Marketing,Eric Enge,"Discover the content marketing and social media ecosystems and how these interconnected channels drive search results to a website. Leverage content marketing and social media as part of your SEO strategy, and how to use influence marketing to establish a website’s authority.",60585.0,32654.0,4.5,1033.0
Advanced Search Engine Optimization Strategies,https://www.coursera.org/learn/seo-strategies,Business,Marketing,Dave Lloyd,"This course focuses on technical, mobile and social strategies for increasing site traffic. Learn how to build SEO for international audiences through content localization, global team alignment and optimizing for local search engines. Discover techniques to optimize mobile-friendly websites, get mobile apps discovered, and leverage social media to drive organic SEO traffic.  You will also learn how to identify key SEO metrics and collect, interpret, validate, and report success to your clients and stakeholders.",46026.0,28800.0,4.5,502.0
Advertise YouTube Videos with Zapier,https://www.coursera.org/learn/advertise-youtube-videos-zapier,Business,Marketing,Carmen Rojas,"Zapier is the industry leader in task automation and gives users the ability to not only organize but to automate social media posting about a new YouTube video upload. 

By the end of this project, you will be able to set up an account with Zapier. You will learn how to connect your YouTube Channel to Zapier and then send out automated social media messages to your owned social media accounts whenever a new video is posted.  This will save you time and allow you to share your video content with your audience immediately - rather than when you remember too! Zapier is the industry leader in task automation and gives users the ability to not only organize but to automate social media posting. 

Note: This course works best for learners who are based in the North America region. We’re currently working on providing the same experience in other regions.",,,,
Advertise and grow your business on Facebook with Canva,https://www.coursera.org/learn/advertise-grow-business-facebook-canva,Business,Marketing,Michelle Flores,"By the end of this project, you will know how to use Canva to promote and advertise your business on Facebook. You will learn how to create a Facebook Ad, a Facebook Post and a Facebook Cover with the help of Canva. We will use templates, and create designs from scratch.

You will be able to incorporate a color scheme, images, and other design elements. Creating high quality advertisements is the perfect way to proactively engage with your target audience. 

This project will include intermediate to advanced level skills using the free version of Canva.

Note: This course works best for learners who are based in the North America region. We’re currently working on providing the same experience in other regions.",,,4.9,15.0
Advertise your Fundraiser using Canva,https://www.coursera.org/learn/advertise-fundraiser-canva,Business,Marketing,Michelle Flores,"By the end of this project, you will know how to use Canva to promote and advertise your fundraiser both digitally and locally. You will have learned how to create a Facebook Post, an event poster and a flyer with the help of Canva. We will both use templates, and create designs from scratch. You will be able to incorporate a color scheme, images, and other design elements for aesthetically pleasing. Creating high quality advertisements is the perfect way to proactively engage with your target audience both digitally and in your local community.

This project will include intermediate to advanced level skills using the free version of Canva.

Note: This course works best for learners who are based in the North America region. We’re currently working on providing the same experience in other regions.",,,4.9,10.0
Advertising with Meta,https://www.coursera.org/learn/advertising-with-facebook,Business,Marketing,Daniel Kob,"This course will establish you as an expert in Meta Ads Manager. Learn how to structure campaigns in Ads Manager by selecting ad objectives, target audience, budget, and placement that fit your unique goals. Learn to create and manage ads across Facebook and Instagram and evaluate and optimize the results of your Ads Manager campaigns.  You will end the course by creating an actual ad campaign in Ads Manager to expand not only your knowledge, but your social media marketing portfolio. 

By the end of this course, you will be able to:
• Structure campaigns in Meta Ads Manager
• Identify the major components and elements of an ad in Meta Ads Manager
• Build an ad that aligns with your marketing objectives and target it to your intended audience
• Set a budget, placement, and schedule for your ads in Meta Ads Manager
• Edit and troubleshoot your ads in Meta Ads Manager
 
This course is intended for people who want to learn how to use Meta Ads Manager to create, manage and optimize campaigns on Facebook and Instagram. Learners don't need marketing experience, but they have basic internet navigation skills and are eager to participate and connect in social media.  

Learners must have a Facebook account and an Instagram account helps. Ideally, learners have already completed the four previous courses in this program.",47422.0,178938.0,4.8,1694.0
Alcanza tu audiencia en Instagram con influenciadores,https://www.coursera.org/learn/alcanza-audiencia-instagram-influenciadores,Business,Marketing,Michelle Flores,"Al final de este proyecto podrás optimizar tu marca o tu negocio en Instagram para alcanzar a tu grupo objetivo. En este proyecto guiado descubrirás el gran potencial que ofrece el marketing de influenciadores en la plataforma Instagram. La colaboración con influenciadores ofrece gran potencial para aumentar el alcance de tu marca en Instagram.

Primero optimizaremos tu cuenta de negocio en Instagram para establecer un perfil atractivo que atraiga tanto a tu grupo objetivo como a influenciadores para cooperaciones potenciales.",,,,
Analysis and Interpretation of Data,https://www.coursera.org/learn/analysis-and-interpretation-of-data,Business,Marketing,"Athanasia Lampraki, Evangelia Katsikea","This course focuses on the analysis and interpretation of data.  The focus will be placed on data preparation and description and quantitative and qualitative data analysis. The course commences with a discussion of data preparation, scale internal consistency, appropriate data analysis and the Pearson correlation. We will look at statistics that can be used to investigate relationships and discuss statistics for investigating relationships with a focus on multiple regression. The course continues with a focus on logistic regression, exploratory factor analysis and the outcome of factor analysis. We are going to explore how to conduct an experiment and an observational study, as well as content analysis and the use of digital analytics in market research. The course ends with a consideration of digital analytics, with an emphasis on digital brand analysis, audience analysis, digital ecosystem analysis, Return on Investment (ROI), and the role of digital analytics in market research.",,3462.0,,
Analysis of Business Problems,https://www.coursera.org/learn/analysis-business-problem-iese,Business,Marketing,Carlos García Pont,"When does an opportunity to increase the bottom line become a liability for long-term brand sustainability and profitability? That is the question that GAS GAS, an off-road motorcycle manufacturer, is confronting. 

In this culminating course, it’s time to use the business tools you have learned throughout the specialization to solve this real business problem. To help you as you develop a solution to the GAS GAS dilemma, in the Capstone you will also learn a six-step analysis of business problems methodology. By the end of the course, you will understand how to weave together considerations from accounting, finance, marketing and organizational behavior in order to arrive at a sound decision that will positively impact the firm’s future.",13924.0,7879.0,4.7,134.0
Analyze Digital Marketing Spend in Tableau,https://www.coursera.org/learn/analyze-digital-marketing-spend-tableau,Business,Marketing,Carmen Rojas,"Tableau is widely recognized as one of the premier data visualization software programs. For many years access to the program was limited to those who purchased licenses. Recently, Tableau launched a public version that grants the ability to create amazing data visualizations for free. Account members can also share and join projects to collaborate on projects that can change the world. 

In this project, we will learn how to create an account, how to upload and work with diverse data sets, and how to analyze marketing spend within Tableau. 

Learning to use this in-demand tool has applications in Marketing, Finance, Operations, Sales, and many other business functions.

Note: This course works best for learners who are based in the North America region. We’re currently working on providing the same experience in other regions.",,,,
Analíticas en Páginas Web,https://www.coursera.org/learn/analiticas-paginas-web,Business,Marketing,"Delia Pérez Lozano, Jorge Ramon Pedroza Villarreal","En este segundo curso se provee al participante de los fundamentos básicos del análisis de sitios y páginas web en sus diferentes modalidades, incluyendo los de comercio digital.  Además, brinda al estudiante las herramientas para evaluar la efectividad de las campañas utilizadas para generar tráfico a estos sitios a través de los anuncios en buscadores y sitios en general.  Incluye también la medición de la eficiencia de las campañas de correo electrónico.  Parte fundamental del curso es el desarrollo de habilidades analíticas aplicadas en el contexto de mercadotecnia.

Los objetivos del curso 2 son los siguientes:
•	Desarrollar en el participante el pensamiento analítico aplicado a la mercadotecnia digital.
•	Aprender a utilizar las plataformas analíticas disponibles en el mercado para estudiar sitios web, tiendas online y campañas digitales.
•	Generar estrategias a partir del análisis de datos generados por la mercadotecnia digital.",,,,
Analíticas y Métricas de Marketing,https://www.coursera.org/learn/analticas-y-mtricas-de-marketing,Business,Marketing,Rafael José Arria Ramos,"En este primer curso se comprenderá el comportamiento de los usuarios y el impacto en la medición de interacciones que se dan en las Páginas web, Landing page o búsquedas de información de navegadores tradicionales. También podremos distinguir las principales herramientas de la analítica que se utilizan en el mercado y la importancia en el uso de Google Analytics. También será relevante identificar los principales objetivos comerciales y de marca a través del uso de las herramientas y métricas de analítica web.

Los objetivos del curso son los siguientes:
1. Comprender el comportamiento de los usuarios y el impacto en la medición de interacciones que se dan en las Páginas web, Landing page o búsquedas de información de navegadores tradicionales.
2. Distinguir las principales herramientas de analítica que se utilizan en el mercado y la importancia en el uso de Google Analytics.
3. Identificar los principales objetivos comerciales y de marca a través del uso de las herramientas y métricas de analítica web.

Es importante aclarar que junto con los alcances de los cursos 1 y 2 podremos entender la importancia que tienen las métricas en Marketing, haciendo un enlace entre lo tradicional y lo digital, con la intención de proporcionar las habilidades para desarrollar y editar sitios web para hacerlos más atractivos, así como enlazarlos con el uso de las redes sociales adecuadas para lograr un match con la estrategia organizacional y alcanzar los objetivos que tenga la organización.",6551.0,5108.0,4.5,73.0
Anuncie su evento para recaudar fondos con Canva,https://www.coursera.org/learn/anuncie-evento-recaudar-fondos-canva,Business,Marketing,Michelle Flores,"Al final de este proyecto, usted habrá aprendido a  comercializar y anunciar su su evento para recaudar fondos usando Canva tanto de manera digital, como local. Usted creará un post para Facebook, un poster y un flyer usando Canva. Crearemos diseños desde cero y modificaremos plantillas para crear nuestros proyectos.
Usted podrá incorporar un esquema de color , imágenes, y otros elementos de diseño grafico. Crear anuncios de alta calidad es ideal para conectar con su público objetivo tanto de manera digital, como local.

En este proyecto usaremos la versión gratis de Canva.

Nota: Este curso es de mayor utilidad para estudiantes que residen en la región de América del Norte. Actualmente, estamos trabajando para proporcionar la misma experiencia en otras regiones.",,,,
Anuncie y crezca su negocio en Facebook con Canva,https://www.coursera.org/learn/anuncie-crezca-negocio-facebook-canva,Business,Marketing,Michelle Flores,"Al final de este proyecto, usted podrá usar Canva para anunciar y crecer su negocio en Facebook con Canva. Usted habrá aprendido a crear un anuncio para Facebook, un post para Facebook y una portada para Facebook. Usted podrá incorporar un esquema de color , imágenes, y otros elementos de diseño estético. Crear anuncios de alta calidad es ideal tanto para activamente interactuar con su grupo objetivo.
En este proyecto usaremos la versión gratis de Canva.

Nota: Este curso es de mayor utilidad para estudiantes que residen en la región de América del Norte. Actualmente, estamos trabajando para proporcionar la misma experiencia en otras regiones.",,,,
Análise de Dados Quantitativos,https://www.coursera.org/learn/analise-de-dados-quantitativos,Business,Marketing,Karin Senra,"Nossas boas-vindas ao Curso Análise de Dados Quantitativos.

Neste curso, serão discutidas as principais técnicas de análise de dados, para que você tenha uma visão geral das opções que estão disponíveis para o planejamento da pesquisa de mercado e a obtenção de análises que realmente respondam às questões de pesquisa de mercado colocadas no momento do planejamento e desenho da pesquisa.

Ao final deste curso, você será capaz de atuar na análise de cenários complexos de mercado, ao identificar técnicas de análise quantitativa adequadas e aplicá-las para o resumo e interpretação dos dados, auxiliando a construção e validação de modelos envolvendo consumidores, concorrentes, setor, produtos e serviços, entre outras variáveis de mercado, para a tomada de decisão estratégica de marketing.

Este curso é composto por quatro módulos, disponibilizados em semanas de aprendizagem. Cada módulo é composto por vídeos, leituras e testes de verificação de aprendizagem. Ao final de cada módulo, temos uma avaliação de verificação dos conhecimentos.

Estamos muito felizes com sua presença neste curso e esperamos que você tire o máximo de proveito dos conceitos aqui apresentados.

Bons estudos!",,11374.0,4.7,10.0
Applying Data Analytics in Marketing,https://www.coursera.org/learn/applying-data-analytics-business-in-marketing,Business,Marketing,"Unnati Narang, Joseph T. Yun","This course introduces students to marketing analytics through a wide range of analytical tools and approaches. We will discuss causal analysis, survey analysis using regression, textual analysis (sentiment analysis), and network analysis. This course aims to provide the foundation required to make better marketing decisions by analyzing multiple types of data related to customer satisfaction.",17431.0,11296.0,4.5,130.0
Apprendre à tirer parti des idées de tweet sur Twitter,https://www.coursera.org/learn/apprendre-a-tirer-parti-des-idees-de-tweet-sur-twitter,Business,Marketing,Nour Kheireddine,"Dans ce projet guidé d'une heure, vous apprendrez c’est quoi un tweet  comment interagir avec vos environnement , Planifier pour l'avenir , suivre les actualités  et commercialiser vos produits
À la fin de ce projet, vous apprenez  à tirer parti des idées de tweet sur Twitter",,,,
Approve Social Media Posts with Zapier and Trello,https://www.coursera.org/learn/approve-social-media-zapier-trello,Business,Marketing,Carmen Rojas,"The process that marketing and communications teams undertake to post on social media is a common tripping point for many companies. Most companies want to include creatives and managers in the process to ensure the best possible outcome. Staying aware of what is done and not done, what is ready for review and or posting, when and if revisions are requested and other steps are important to ensure timely, accurate, and impactful posts. Getting there is the tricky part. 

In this project, the learner will learn how to create an approval process that not only informs the stakeholders of project progress but also sends reminders and updates when deadlines are missed. 


Note: This course works best for learners who are based in the North American region. We’re currently working on providing the same experience in other regions.",,,,
Artificial Intelligence in Marketing,https://www.coursera.org/learn/uva-darden-artificial-intelligence-marketing,Business,Marketing,Rajkumar Venkatesan,"AI is everywhere! By harnessing the power of Artificial Intelligence, businesses and marketers have amazing growth potential, and the opportunities to enhance marketing with AI are always expanding. But how can businesses use AI tools to drive their success and gain sustainable competitive advantages? What are the challenges faced by businesses as they implement AI into their marketing strategies?

In this course, developed at the Darden School of Business at the University of Virginia, and delivered by Professor of Business Administration Raj Venkatesan, you will explore an important frontier of digital transformation in marketing. You will examine three key forces that enable AI in marketing strategies - Algorithms, Networks, and Data - and gain a deeper understanding of how businesses in a wide variety of industries can get the most out of this exciting technology. You will see real world examples of successful companies like Ford, Netflix, and the Washington Post using AI to take on the competition in new and creative ways, and hear from experts about how AI is shaping the present and the future in their respective industries. 

You can learn more about Raj by following his posts on Twitter (@rajkumarvenk) and on LinkedIn: https://www.linkedin.com/in/education-marketing.",11012.0,12739.0,4.5,93.0
Arts and Heritage Management,https://www.coursera.org/learn/arts-heritage,Business,Marketing,Andrea Rurale,"Today cultural institutions are facing important dilemmas in many aspects of their management. Over the past decades, a new figure has emerged that of the art manager. 

Imagine you went to work every day to connect artists with audiences, vision with reality, and money with a mission. That is what managers in the arts do, they play an essential role in transforming the minds, lives, and communities through creative expression.
	
This course has been conceptualized to address the need of skills and techniques to help professionals and managers in running art and cultural institutions. 

Learning Objectives
There are three objectives to this course. First, we will approach the biggest issue cultural institutions face, the coexistence of managers and curators and giving evidence as to when, how, and why they can get along. Second, we will focus on some contemporary facets on what is means to manage a cultural institution and what cultural managers should expect and be able to face. And lastly, we will provide models and tools to design and implement appropriate courses of action to satisfy customers (visitors and audiences) and build an advantage over the competition.

Course Structure
The course is divided into six sections. Five sections are dedicated to specific aspects and themes of managing cultural institutions, while the sixth section is dedicated to individual interviews of prominent cultural institution managers on specific topics. The involvement of professionals and managers gives an incredible value to the learning experience of this course. 

Each module is paired with a quiz and discussion forums to reflect on the variety of the heritage management, its complexity, and the power of the network that we will build together during the course.
Successful completion of the quizzes is required for a course certificate as explained in the Grading Policy page.

If you love art and want to make an impact in this unique and fantastic sector, this course will support you in understanding the peculiarities of this sector and how to leverage on its tools to make a bigger impact.

Look forward to meeting you online!

Acknowledgements:

Vatican Museums: www.museivaticani.va
Cenacolo Vinciano: 
www.beniculturali.it/mibac/export/MiBAC/sito-MiBAC/Contenuti/MibacUnif/Eventi/visualizza_asset.html_1283837989.html (ITA)
FAI (Fondo Ambiente Italiano): eng.fondoambiente.it
MUVE (Fondazione Musei Civici Venezia): www.visitmuve.it
The National Trust: www.nationaltrust.org.uk
The Archeological Site of Paestum: www.museopaestum.beniculturali.it   whc.unesco.org/en/list/842
Museo dell'Opera del Duomo (Florence): www.museumflorence.com
Museo del Violino: www.museodelviolino.org
_________________________________
Disclaimer - Since some of the videos are conducted with those whose native language is not English, we have decided to sometimes preserve their more emphatic speech to keep a tighter match between the audio and subtitles.",31110.0,19430.0,4.8,1215.0
As Competências do Especialista no Sucesso do Cliente,https://www.coursera.org/learn/as-competencias-do-especialista-no-sucesso-do-cliente,Business,Marketing,Carlos Alves,"Nossas boas-vindas ao Curso As Competências do Especialista no Sucesso do Cliente.

Neste curso, você aprenderá que o papel de Especialista no Sucesso do Cliente (Customer Success – CS) é multidisciplinar. É preciso entender a fundo o relacionamento com clientes, entender e gerenciar objetivos de negócio, estabelecer o relacionamento entre soluções de tecnologia e negócios, executar análises de mercado e de dados para gerar oportunidades de negócio, além de participar da criação e manutenção de soluções de tecnologia que viabilizem os modelos de negócio com receita recorrente.

Ao final deste curso, você será capaz de:

- Identificar as principais competências do especialista no sucesso do cliente.
- Estabelecer critérios de busca de talentos para a função ou criar um plano para seu próprio desenvolvimento.

Este curso é composto por quatro módulos, disponibilizados em semanas de aprendizagem. Cada módulo é composto por vídeos, leituras e testes de verificação de aprendizagem. Ao final de cada módulo, temos uma avaliação de verificação dos conhecimentos.

Estamos muito felizes com sua presença neste curso e esperamos que você tire o máximo de proveito dos conceitos aqui apresentados.

Bons estudos!",,1709.0,,
