name,url,category,subcategory,instructors,description,enrollment,views,rating,raters
Public Health in Humanitarian Crises 2,https://www.coursera.org/learn/humanitarian-public-health-2,Health,Public Health,"Gilbert Burnham, MD, Mija Ververs","This course, Public Health in Humanitarian Crises 2, addresses public health issues of people affected by disasters, both natural  or conflict-related. It discusses the many changes that occur in people’s lives when they are uprooted by a disaster, including many important topics related to humanitarian crises, such as when there is an epidemic a public health emergency; what do we mean with the humanitarian development nexus; what are the basics of disaster epidemiology and surveillance; humanitarian principles; and other very relevant topics. We will explore what humanitarian interventions could look like if we want to mitigate the effects of disasters. 

This course is a follow-up to Public Health in Humanitarian Crises 1, which dealt with changes in disease patterns, access to health care, livelihoods, shelter, sanitary conditions, nutritional status, and other issues. 

The course content is a mix of theoretical knowledge and many practical examples from recent disasters. We think this course is unique because it contains so many practical ‘real-life’ examples and is taught be instructors and guest lecturers who together have over 200 years of experience in this field. The course consists of 10 modules totaling approximately 14-16 hours of delivered content with an additional 2-3 hours of self-work (quizzes and writing and evaluating a short peer-review assignment) as well as lively discussions forums. The first course, Public Health in Humanitarian Crises 1 (PHHC1), has been designed in a way that each module builds on the lessons of previous modules. However, the modules from this second course, Public Health in Humanitarian Crises 2 (PHHC2) can be accessed in any order and some can stand alone. You do not necessarily need to do PHHC1 before PHHC2, but it might be helpful to take some or all of PHHC1, as some of the basic or fundamental issues are covered in this course. PHHC2 contains a somewhat more diverse set of topics than the previous course as it deals with more complicated issues.

You do not have to pay for this course if you choose to enroll without a certificate. Sometimes referred to as auditing, enrolling without a certificate means that you will have access to all of the videos and discussions. The only difference is that you will not be able to take the quizzes to earn a certificate upon completion. Click the Audit or Enroll Without A Certificate link to sign up and begin the course. Visit the Learner Help Center for more details about your enrollment options.",5571.0,18207.0,4.8,77.0
Public Involvement in Research,https://www.coursera.org/learn/public-involvement-in-research,Health,Public Health,"Maria Piggin, Helen Ward ","This course focuses on participatory approaches in research, known as 'public involvement' in the UK. You'll specifically, consider why citizens and patients would be involved in research and explore participatory approaches across and within the research cycle in more detail, diving into questions such as:

- what kinds of participation can be undertaken at each of the 7 stages of the cycle? 
- how can you utilise participation in research? 
- what examples of using participatory approaches exist in research?

While this course, as with the rest of the specialisation, focuses on public health and ways of involving citizens and patients across and within the research cycle, these concepts apply to other disciplines and kinds of research too. So, you don't have to be a public health specialist or work in healthcare to gain insight from this course. 

If you would like to learn more about the theories and core principles of participation within a public health context, we suggest taking Introduction to Participatory Approaches in Public Health. If you're planning a research project and want to include participatory approaches, explore our course Applying Participatory Approaches in Public Health Settings.",,1975.0,,
Quality Improvement for Population Health,https://www.coursera.org/learn/quality-improvement-for-population-health,Health,Public Health,Dr Thomas Woodcock,"Quality improvement methods were first deployed in healthcare in e hospital settings. However, over the past decade particularly, there has been increasing focus on the application of these methods in improving population and public health. In this course, you will apply a combination of both approaches to population health improvement. You will also learn how to study and evaluate large improvement initiatives to capture learning effectively.

Learning Objectives: 

Apply quality improvement methods in combination with population health frameworks to design a population health improvement initiative 

Understand how the use of geographic information systems contributes to quality improvement 

Critique different study designs for studying quality improvement initiatives",,3704.0,,
Rastreamento de contato da COVID-19,https://www.coursera.org/learn/rastreamento-contatos-covid-19,Health,Public Health,"Emily Gurley, PhD, MPH","A crise da COVID-19 criou uma necessidade sem precedentes de rastreamento de contato em todo o país, exigindo que milhares de pessoas aprendessem rapidamente as principais habilidades. As qualificações para os cargos de rastreamento de contato diferem em todo o país e no mundo, com alguns novos cargos abertos a indivíduos com diploma de ensino médio ou equivalente.

Neste curso introdutório, os alunos aprenderão a ciência do SARS-CoV-2, incluindo o período infeccioso, a apresentação clínica da COVID-19, as evidências de como o SARS-CoV-2 é transmitido entre as pessoas e por que o rastreamento de contatos pode ser uma intervenção de saúde pública tão efetiva. Os alunos aprenderão como é feito o rastreamento de contatos, incluindo como criar afinidade com os casos, identificar seus contatos e apoiar tanto os casos quanto seus contatos para interromper a transmissão nas respectivas comunidades. O curso também abordará várias considerações éticas importantes sobre rastreamento de contatos, isolamento e quarentena. Por fim, o curso identificará algumas das barreiras mais comuns aos esforços de rastreamento de contato, assim como estratégias para superá-las.",1846.0,,4.8,137.0
Rastreo de los contactos de la COVID-19,https://www.coursera.org/learn/rastreo-contactos-covid-19,Health,Public Health,"Emily Gurley, PhD, MPH","La crisis de la COVID-19 ha creado una necesidad sin precedentes de rastreo de los contactos en todo el país, y exige que miles de personas aprendan habilidades nuevas con rapidez. La certificación laboral para puestos de rastreo de contactos es distinta en todo el país y el mundo, y algunos puestos nuevos se abren para personas que tienen diploma de escuela secundaria o un equivalente.

En este curso introductorio, los estudiantes aprenderán acerca de la ciencia del SARS-CoV-2, que incluye el período de contagio, el cuadro clínico inicial de la COVID-19, y las pruebas de cómo el SARS-CoV-2 se contagia de una persona a otra y por qué el rastreo de contactos puede ser una intervención tan efectiva de salud pública. Los estudiantes aprenderán cómo se realiza el rastreo de los contactos, incluso cómo establecer una buena relación con los casos, identificar sus contactos y brindar apoyo a los casos y a los contactos para detener el contagio en sus comunidades. El curso también abarcará varias consideraciones importantes de ética acerca del rastreo de contactos, del aislamiento y de la cuarentena. Por último, en el curso se identificarán algunos de los obstáculos que se encuentran con más frecuencia para los esfuerzos de rastreo de los contactos, junto con estrategias para superar esos obstáculos.",10717.0,4774.0,4.8,1168.0
Reducing Gun Violence in America: Evidence for Change,https://www.coursera.org/learn/gun-violence,Health,Public Health,"Daniel W. Webster, ScD, MPH, Cassandra Crifasi, PhD, MPH, Alex McCourt, JD, PhD, MPH, Jon S. Vernick, JD, MPH","Reducing Gun Violence in America: Evidence for Change is designed to provide learners with the best available science and insights from top scholars across the country as well as the skills to understand which interventions are the most effective to offer a path forward for reducing gun violence in our homes, schools, and communities.

Through this course, you will learn how to:
1.	Appreciate the scope of gun violence and the importance of considering the issue across a variety of contexts.
2.	Describe the role of law and policy in addressing gun violence at the federal, state, and local levels.
3.	Compare the effectiveness of gun violence policies and highlight the importance of changing the way we talk about gun                      
        violence.
4.	Describe state standards for civilian gun carrying and use and how those standards affect crime and violence.
5.	Describe how firearm design is regulated, the effective and just enforcement of firearm laws, and strategies for reducing 
        police-involved shootings.
6.	Identify and explain evidence-based programs to reduce gun violence and understand public opinion on gun policy.

As a student of this course, it’s important to recognize that you are part of an international learning community. We understand that gun violence can be a difficult issue to discuss and we all have our own set of opinions and beliefs. However, we ask you to please remember that gun violence is something that affects every person differently. It’s important to understand that this course is intended to generate productive and meaningful conversation. 

We ask students of this course to abide by the rules outlined and expected of you by Coursera’s Code of Conduct Policy. Please help us promote a healthy, productive, and sustainable learning environment for all and practice the following principles:

Be polite.
	Treat your fellow learners with respect.
	Insulting, condescending, or abusive words will not be tolerated.
	Do not harass other learners.
	Polite debate is welcome as long as you are discussing the ideas or the evidence, not attacking the person.

Be sensitive.
	Remember that Coursera is a global forum with learners from many different cultures and backgrounds.
	Be kind, thoughtful, and open-minded when discussing race, religion, gender, sexual orientation, or controversial topics 
        since others likely have differing perspectives.

Post appropriate content.
	Content that violates the Honor Code or Terms of Service is not permitted.
	You may not post inappropriate (e.g., pornographic or obscene) content.
	Do not post copyrighted content.
	Do not advertise or promote outside products or organizations.
	Do not spam the forums with repetitive content.

Please note that violations of Coursera’s Code of Conduct, Honor Code, or Terms of service are not permitted and may result in:
	Deletion of posted content.
	Removal from the course.
	Losing access to the Coursera site.

*It is important to also note that certain policies and laws mentioned in this course are likely to change and develop over time. As a result, we understand that course content may need to be updated to reflect such changes. While we will strive to do this as quickly as possible, we appreciate your patience. All information included in the course is reported accurately at the time of recording and we intend to update lectures as soon as possible and to the best of our ability.

The development of this course was made possible through generous financial support provided by the David and Lucile Packard Foundation, an organization committed to improving the lives of children, enabling the creative pursuit of science, advancing reproductive health, and conserving and restoring the earth’s natural systems.",9066.0,21987.0,4.7,234.0
Responsible Reporting on Suicide for Journalists,https://www.coursera.org/learn/responsible-reporting-on-suicide-for-journalists,Health,Public Health,"Aneri Pattani, William Eaton, PhD, Holly C. Wilcox, PhD, MA","Responsible Reporting on Suicide for Journalists is designed to give working journalists and students who are interested in the field an understanding of how news media can impact suicide trends and how that power can be used to improve public health. An extensive body of research shows that certain methods of reporting on suicide deaths can increase the number of subsequent suicides among the public. Conversely, responsible methods of reporting on suicide can increase the likelihood of people seeking help. The World Health Organization and the Centers for Disease Control and Prevention have both identified responsible suicide reporting among the media as a key mechanism for suicide prevention. This course aims to give journalists the concrete tools they need to fulfill that goal and make a positive public health impact with their reporting.",,2617.0,,
Science Matters: Let's Talk About COVID-19,https://www.coursera.org/learn/covid-19,Health,Public Health,"Helen Ward , Katharina Hauck, Oliver Geffen Obregon","Welcome to ‘Science Matters: Let's Talk about COVID-19’, from the Jameel Institute at Imperial College London.

The outbreak of the Novel Coronavirus Disease (COVID-19) is the most significant public health emergency of the 21st century so far. As the epidemic spreads, people around the world want to understand the science behind the most pressing questions: how many people have been infected? How dangerous is the virus? When will a vaccine be available? How can the epidemic be contained, and the damages mitigated? What is the economic impact? What’s the role of social media and local communities in the epidemic response? 

Researchers at the Jameel Institute and other research institutes at Imperial College London have been at the forefront of the response to the COVID-19 emergency, with clinical, epidemiological and social science analyses informing the outbreak response. They are generating robust empirical evidence that governments and international agencies are using around the world to plan their responses. 

On this course, you will hear directly from our world-class experts about the theory behind the analyses of COVID-19 and its spread, while learning how to interpret new information using core principles of public health, epidemiology, medicine, health economics, and social science. You will be able to watch regular situation reports about the state of the epidemic, provided by the researchers of J-IDEA and its director Professor Neil Ferguson. 

If you want to learn even more about these topics, a number of free MOOCs are available from Imperial College London. We also offer a fully online Global Master of Public Health for those of you who want to delve even deeper and join our professional community. 

Please note:

This course was launched in February 2020 and we have continued to develop content as the COVID-19 situation progresses and new insights emerge. While we endeavour to include the most recent information, this is a fast-moving situation and information is constantly changing. 

This course is to be used for educational purposes only and is open to all and free of charge. 

The information in this course does not constitute clinical or other advice and must not be used for the purposes of providing any clinical or other advice. If you have any health concerns, please refer to your regional health authorities’ guidelines and consult a medical professional.

Please note the views expressed by individuals in the course content do not necessarily reflect those of Imperial College London, the Jameel Institute and any other funding partners. 

Imperial College London, the Jameel Institute and any other funding partners shall not be liable, to the maximum extent permitted by law, for any loss suffered or for any other adverse or negative consequence arising directly or indirectly from your reliance on the information contained in this course.",146104.0,7826.0,4.2,207.0
Science of Firearm Injury Prevention Among Children & Teens,https://www.coursera.org/learn/science-of-firearm-injury-prevention-children-teens,Health,Public Health,"Marc A Zimmerman, PhD, Patrick Carter, MD","Firearm injuries are a leading cause of death among children and teens. However, there are many ways that these injuries and deaths can be prevented using evidence-based practices and policies.  

Presented by the University of Michigan Institute for Firearm Injury Prevention and the Firearm Safety among Children and Teens (FACTS) Consortium, this course lays a broad foundation for understanding the science of pediatric firearm injury prevention and the latest research and evidence-based solution. This course covers a range of firearm injury topics including firearm-related suicide, unintentional firearm injury, firearm-related community and youth violence, firearm-related intimate partner violence, school and mass shootings, and officer-involved shootings. Through lectures and interviews from leading firearm injury researchers, and activities, readings, discussion boards, and quizzes, learners can become familiar with the epidemiology, prevention strategies, and policy efforts related to pediatric firearm injury prevention. The course also covers important gaps in existing research and future directions for expanding the knowledge base of the field. 

This course is designed for multiple fields and levels of training, including students and researchers from public health, medicine, public policy, social work, nursing, criminology, sociology and psychology fields. The course is also appropriate for practitioners, educators and parents. As a learner, you will have the ability to select all modules or individual topics that interest you most. Composed of 7 modules, this course may be taken from the comfort of your home or office, and you can learn at your own pace.

Supported by a grant to the University of Michigan by the National Institutes of Health - Eunice Kennedy Shriver National Institute of Child Health and Human Development (NIH/NICHD) (Award Number: R24HD087149) and the University of Michigan Institute for Firearm Injury Prevention. The content is solely the responsibility of the contributors and does not necessarily represent the official views of the National Institutes of Health - Eunice Kennedy Shriver National Institute of Child Health and Human Development (NIH/NICHD) or the Department of Health and Human Services.",,2979.0,,
Seguimiento de casos y contactos COVID-19,https://www.coursera.org/learn/seguimiento-de-casos-y-contactos-covid-19,Health,Public Health,María Soledad Martínez Gutiérrez,"La pandemia COVID19 ha desafiado a los sistemas políticos y sanitarios en el mundo. Dentro de la estrategia sanitaria, un pilar fundamental para controlar la infección es generar la trazabilidad y el seguimiento de casos y contactos.

Lamentablemente, hasta la fecha nuestro sistema sanitario se va visto superado en estas acciones, lo que ha contribuido al aumento de casos nuevos. Este curso, pretende contribuir a esta problemática, entregando herramientas para generar trazabilidad y el seguimiento de casos y contactos.",9212.0,1953.0,4.9,699.0
Simple Regression Analysis in Public Health,https://www.coursera.org/learn/simple-regression-analysis-public-health,Health,Public Health,"John McGready, PhD, MS","Biostatistics is the application of statistical reasoning to the life sciences, and it's the key to unlocking the data gathered by researchers and the evidence presented in the scientific public health literature. In this course, we'll focus on the use of simple regression methods to determine the relationship between an outcome of interest and a single predictor via a linear equation. Along the way, you'll be introduced to a variety of methods, and you'll practice interpreting data and performing calculations on real data from published studies.  Topics include logistic regression, confidence intervals, p-values, Cox regression, confounding, adjustment, and effect modification.",10639.0,13729.0,4.7,330.0
Social Determinants of Health,https://www.coursera.org/learn/social-determinants-of-health,Health,Public Health,Cleopatra Caldwell,"This is an introductory course on social determinants of population health with a focus on the United States. The course will introduce you to, or reinforce your knowledge of, issues related to health that consider behavioral, psychological and structural factors in population health beyond the healthcare system. We will examine social, economic, and political factors that contribute to health inequalities and suggest innovative ways to reduce disparities in health when the goal is to achieve health equity.

This course will increase your awareness, knowledge, and understanding of issues related to behavioral, psychological, and structural factors that contribute to understanding population health and health inequities. We will discuss conceptual and methodological issues key to health professionals working towards achieving health equity to reduce health disparities at multiple levels of influence. There will be opportunities to practice skills involving cultural humility, deliberative dialogues and professional self-assessments.

By the end of this course, you will be able to:
Discuss the means by which structural bias, social inequalities and racism undermine health and create challenges to achieving health equity at organizational, community and societal levels",2879.0,7567.0,4.5,15.0
Stories of Infection,https://www.coursera.org/learn/stories-of-infection,Health,Public Health,"Maya Adam, MD","This course introduces learners to a variety of infectious diseases using a patient-centered, story-based approach. Through illustrated, short videos, learners will follow the course of each patient’s illness, from initial presentation to resolution. Integrating the relevant microbiology, pathophysiology and immunology, this course aims to engage and entice the learner towards future studies in microbiology, immunology and infectious diseases. 

The patient-centered videos included in this course were created as part of the Re-imagining Medical Education initiative, led by Charles Prober MD, Senior Associate Dean of Medical Education at the Stanford School of Medicine. This initiative was the first of its kind to explore the collaborative creation of foundational medical education online content by inter-institutional teams of faculty. The content presented in this course was created by faculty from Stanford University School of Medicine, in collaboration with The University of Washington School of Medicine, Duke University School of Medicine, UCSF School of Medicine, and The University of Michigan Medical School. Support for this initiative was provided by the Robert Wood Johnson Foundation and the Burke Family Foundation.

PLEASE NOTE: Information provided in this course is for educational purposes only and is not intended to be used for diagnostic and/or treatment purposes.",43485.0,49421.0,4.9,1608.0
Strategies for Senior Housing Communities during COVID-19,https://www.coursera.org/learn/strategies-senior-housing-covid19,Health,Public Health,"Juliana Bilowich, Alice Bonner, Molly Nace, Morgan Katz","SARS-CoV-2, the virus that causes COVID-19, poses a high risk for senior housing communities and the people who live and work there. The COVID-19 response has largely focused on nursing homes, leaving independent living communities serving older adults in the United States with fragmented guidance on how to respond to COVID-19 challenges. This course provides comprehensive instruction and resources for property owners and managers, senior housing staff, service coordinators and providers, community housing leaders, and other senior housing stakeholders to build upon their emergency preparedness and response strategies related to COVID-19. The course lectures, interviews, and assignments are largely geared toward federally-subsidized, multifamily senior housing providers, but the material is relevant for all senior housing providers. 

Learners will hear from experts about best practices to prevent COVID-19 outbreaks and promote well-being. Topics discussed include unique challenges for senior housing communities, development of emergency preparedness plans, outbreak prevention, and coronavirus-adapted housing operations. The course also covers strategies for communicating with stakeholders, promoting pandemic-safe behavior on site, and leveraging health departments and other agency resources, including a collection of resources for COVID-19 vaccination guidance. Learners are encouraged to concurrently develop and enhance their own community’s policies, procedures, and practices.

This course was developed in partnership with the Baltimore City Health Department.",4872.0,5311.0,4.8,147.0
