name,url,category,subcategory,instructors,description,enrollment,views,rating,raters
2021 Cancer Prevention Web-Based Activity (CE eligible),https://www.coursera.org/learn/2021-prevent-cancer,Health,Public Health,"Andrea Zimmerman, Jann T. Balmer","This web-based video course focuses on the importance of prevention and risk reduction in decreasing cancer occurrences. All learners will need to watch the video modules, read associated articles, and achieve a passing score of 80% on quizzes in order to complete the course. After completing the course, learners will receive a link to claim continuing medical and nursing education credit. 

DESCRIPTION
Next Generation Choices Foundation (NGCF or Less Cancer), lesscancer.org, in conjunction with the University of Virginia and American University, promotes a prevention paradigm for addressing the alarming trend of increasing cancer incidences and raises awareness of cancer prevention to make risk reduction and prevention a vital part of the cancer paradigm for all people. This is a departure from previous treatment-focused approaches that talked about beating, conquering, or curing cancer. Many cancers are preventable by reducing risk factors, such as PFAS and lead corrosion in water supply and infrastructure, use of tobacco products, ultraviolet light exposure, asbestos exposure, specific contaminants and pollution sources, disparities and inequities, and promoting healthy lifestyle choices, such as diet, exercise, and nutrition.

Visit the FAQs below for important information regarding 1) Activity faculty and their credentials; 2) Accreditation and Credit Designation statements; 3) Commercial support disclosure statement; 4) Disclosure of financial relationships for every person in control of activity content and their role in the activity; 5) Date of original release and Termination or expiration date.",,,,
2022 Cancer Prevention Web-Based Activity (CE eligible),https://www.coursera.org/learn/2022-prevent-cancer,Health,Public Health,Jann T. Balmer,"This web-based video course focuses on the importance of prevention and risk reduction in decreasing cancer occurrences. All learners will need to watch the video modules, read associated articles, and achieve a passing score of 80% on quizzes in order to complete the course. After completing the course, learners will receive a link to claim continuing medical and nursing education credit. 

DESCRIPTION
Next Generation Choices Foundation (NGCF or Less Cancer), lesscancer.org, in conjunction with the University of Virginia and American University, promotes a prevention paradigm for addressing the alarming trend of increasing cancer incidences and raises awareness of cancer prevention to make risk reduction and prevention a vital part of the cancer paradigm for all people. This is a departure from previous treatment-focused approaches that talked about beating, conquering, or curing cancer. Many cancers are preventable by reducing risk factors, such as PFAS and lead corrosion in water supply and infrastructure, use of tobacco products, ultraviolet light exposure, asbestos exposure, specific contaminants and pollution sources, disparities and inequities, and promoting healthy lifestyle choices, such as diet, exercise, and nutrition.

Visit the FAQs below for important information regarding 1) Activity faculty and their credentials; 2) Accreditation and Credit Designation statements; 3) Commercial support disclosure statement; 4) Disclosure of financial relationships for every person in control of activity content and their role in the activity; 5) Date of original release and Termination or expiration date.",,2189.0,,
A Guide to Healthcare Innovation: Principles and Practice,https://www.coursera.org/learn/guide-to-healthcare-innovation-principles-and-practice,Health,Public Health,Dr Matthew Harris,"This course reflects on global health challenges and the role of innovative solutions in addressing them. By engaging in this course, you will be able to describe the principles and key types of innovation in order to characterise the fundamental features of new models of care and technologies. 

This course will review the basic features and principles of healthcare innovation. You'll be examining innovations developed to address global health challenges, ranging from simple low-cost technologies readily deployed in resource constrained settings to more complex combinations of organizational, business model and technology innovations. Throughout this course, you'll also consider how adoption and diffusion is influenced by social, economic and political factors and explore what is required to get an innovation in to practice, effectively, at scale.",6086.0,6904.0,4.7,157.0
A Public Health Approach to Hearing Loss and Aging,https://www.coursera.org/learn/a-public-health-approach-to-hearing-loss-and-aging,Health,Public Health,"Jennifer A. Deal, PhD, Nicholas S. Reed, AuD, Frank R. Lin, MD, PhD","At the Johns Hopkins Cochlear Center for Hearing and Public Health, we are dedicated to training up the next generation of clinicians and researchers to study the impact that hearing loss in older adults has on public health and to develop and implement public health strategies and solutions for hearing loss.  The Center is proud to present this course which introduces a public health approach to aging and hearing population-based research, reviews the state of public health policy and ongoing interventions, and discusses the current epidemiologic research linking hearing loss to cognitive and healthcare outcomes in older adults, including dementia.  Learners will be hearing from Johns Hopkins faculty and researchers who will speak on their expertise in areas of otolaryngology, audiology, epidemiology, gerontology, and public health policy/economics.",,1972.0,,
Achieving Health Equity in Healthcare,https://www.coursera.org/learn/achieving-health-equity-in-healthcare,Health,Public Health,Minal R. Patel,"The third and the last course of the Addressing Racial Health Inequity in Healthcare specialization will go through various approaches that are used to addressing racial inequity in healthcare., and the strengths and challenges of those approaches. You will explore legal, policy, and regulatory approaches to interventions such as Title IX in the United States. You will explore what is being done to intervene on providers to reduce differential care. You will unpack quality improvement and multiple approaches to leveraging healthcare systems and community partnerships to address access to care. You will also come to understand the history and role of community health centers in being critical infrastructure in addressing the health needs of diverse populations. Finally, you will be introduced to the workforce initiatives and the reparations that aim to close the racial and ethnic healthcare disparities gaps.",,1744.0,,
Air Pollution – a Global Threat to our Health,https://www.coursera.org/learn/air-pollution-health-threat,Health,Public Health,"Steffen Loft, Peter Møller, Zorana Jovanovic Andersen","We all have to breathe to live. But the air we breathe is polluted both outdoors and indoors. Each year, this pollution costs 7 million lives across the globe – and a lot of suffering. 1 in 8 deaths is due to air pollution. This course will provide you with an introduction to the most recent research in the field of health effects of air pollution as well as a broader understanding of sources and spread of air pollution and what we should do about it.

What is air pollution? What are the sources? How and where are we exposed outdoors and indoors? What happens in the body? Which diseases are the result? Who are the most vulnerable? How can we assess the effects of air pollution? And what should we do to reach the Sustainable Development Goal to “substantially reduce the number of deaths and illnesses from hazardous chemicals and air, water and soil pollution”? These are some of the important questions we will address in the course.

During the course you will meet researchers and experts from the University of Copenhagen and the Technical University of Denmark. They work with different aspects of air pollution and health: toxicology, exposure assessment, epidemiology, engineering and health impact assessment. It is a global responsibility to combat the health impacts of air pollution, and this fight can only be won through new knowledge and global collaboration. 

We hope you will join us in the course and equip yourself to take part in this global and individual health challenge.",20191.0,7251.0,4.8,1370.0
An Introduction to Global Health,https://www.coursera.org/learn/global-health-introduction,Health,Public Health,Flemming Konradsen,"This course will provide you with an overview of the most important health challenges facing the world today. You will gain insight into how challenges have changed over time, we will discuss the likely determinants of such changes and examine future projections. Successful international strategies and programs promoting human health will be highlighted and global health governance structures will be mapped and the role of the key actors explored.",27595.0,13554.0,4.8,783.0
An Introduction to the U.S. Food System: Perspectives from Public Health,https://www.coursera.org/learn/food-system,Health,Public Health,"Keeve Nachman, PhD, MHS, Robert S. Lawrence, MD, Pamela Rhubart Berg","A food system encompasses the activities, people and resources involved in getting food from field to plate. Along the way, it intersects with aspects of public health, equity and the environment. In this course, we will provide a brief introduction to the U.S. food system and how food production practices and what we choose to eat impacts the world in which we live. We will discuss some key historical and political factors that have helped shape the current food system and consider alternative approaches from farm to fork. The course will be led by a team of faculty and staff from the Johns Hopkins Center for a Livable Future. Guest lecturers will include experts from a variety of disciplines, including public health, policy and agriculture.",12935.0,4570.0,4.7,152.0
Antibiotic Stewardship,https://www.coursera.org/learn/antibiotic-stewardship,Health,Public Health,"Stan Deresinski, MD, Elizabeth Robilotti, Marisa Holubar, Lina Meng, PharmD, BCPS, BCCCP, Emily Mui","Antimicrobial Stewardship: Improving Clinical Outcomes by Optimization of Antibiotic Practices

Internet Enduring Material Sponsored by: Stanford University School of Medicine

Presented by: The Division of Infectious Diseases and Geographic Medicine at Stanford University School of Medicine

NOTE: These videos were produced as part of a free online course offered by the Stanford Center for Continuing Medical Education (SCCME).  If you wish to receive credit for your participation in the course, you will need to complete the full course on the SCCME website at: http://cme.stanford.edu/online. The course version on Coursera does not offer CME credit.

Course Description
Antibiotics are among the most frequently prescribed classes of drugs and it is estimated that approximately 50% of antibiotic use, in both the outpatient and inpatient settings, is inappropriate. At the same time, in contrast to any other class of drugs, every antibiotic use has a potential public health consequence – inappropriate use may not harm only the individual patient, but contributes to societal harm by exerting an unnecessary selective pressure that may lead to antibiotic resistance among bacteria. This video based course will introduce learners to the basic principles of appropriate antibiotic use, demonstrate how to apply these principles to the management of common infections, and outline how to develop and maintain an antimicrobial stewardship program. We will offer a number of illustrative cases, recognizable to the practicing physician in his or her practice to engage learners in the thought processes that lead to optimal decision making, improved outcomes of individual patients, and harm reduction vis-a-vis the bacterial ecology. The course will also explore strategies to implement principles of antimicrobial stewardship both in your practice and also at a program level.",36486.0,28896.0,4.4,280.0
"Antibióticos ¿cuándo, cómo y para qué?",https://www.coursera.org/learn/antibioticos,Health,Public Health,"Patricia Aguilera Jiménez, María Yazmín Hernández Arellano, Anahí Cristina Dreser Mansilla, María Guadalupe Miranda Novales, Samuel Ponce de León R.","¿Qué es lo primero que haces cuando te sientes enfermo? ¿Vas a la farmacia y le pides al boticario que te brinde un antibiótico que te “cure” rápidamente? ¿Tus familiares, amigos, conocidos, lo hacen? En este curso, aprenderás las razones por las cuales el uso inadecuado de antibióticos es perjudicial para tu salud y por qué este comportamiento ha dado lugar al fenómeno de salud pública denominado “resistencia bacteriana”.

De la mano de expertos en el área de la salud y con la más actualizada evidencia científica, comprenderás cómo funcionan los antibióticos, por qué es necesario que un profesional de la salud prescriba su uso y cómo prevenir enfermedades que requerirían el uso de antibióticos.",1742.0,5381.0,4.2,10.0
Application of Health Equity Research Methods for Practice and Policy,https://www.coursera.org/learn/health-equity-research-methods,Health,Public Health,"Lisa A. Cooper, M.D., Tanjala S. Purnell, PhD MPH","Intended for students who have completed the introduction to health equity research course and/or have previous experience working in this area. This course will cover innovative methods, practical tools, and skills required to conduct rigorous health equity research and translate evidence-based strategies into practice and policy. Covers topics ranging from conceptual frameworks for stakeholder engagement and behavioral intervention development, to adapting interventions for socially-at-risk populations, and research methods in healthcare services and social epidemiology.",2135.0,4252.0,4.8,39.0
Applying Participatory Approaches in Public Health Settings,https://www.coursera.org/learn/applying-participatory-approaches-in-public-health-settings,Health,Public Health,Helen Ward ,"This course specifically explores approaches and tools  and how to apply them in public health settings. Students will learn how to critically analyse the power dynamics present between multidisciplinary stakeholders and appreciate the need for reciprocity between those delivering and those receiving health care; between both those conducting and those participating in research. They will also learn how to select and evaluate different participatory approaches to apply these to public health programmes and/or research. Tools with which to do this include undertaking a stakeholder-mapping exercise and needs assessment, including a critical and reasoned narrative to justify the approach.  

While this course, as with the rest of the specialisation, focuses on public health and ways of involving citizens and patients in programmes and research, these concepts apply to other disciplines too. So, you don't have to be a public health specialist or work in healthcare to gain insight from this course. 

If you would like to learn more about the theories and core principles of participation within a public health context, we suggest taking Introduction to Participatory Approaches in Public Health. If you're planning a research project and want to learn more about participation in resaerchs, explore our course Public Involvement in Research.",,7265.0,,
Assessing and Improving Community Health,https://www.coursera.org/learn/assessing-and-improving-community-health,Health,Public Health,Sharon Kardia,"This course is intended to serve as an introduction to population health from both the vantage point of both public health and healthcare. We will examine the key components of community health needs assessments, how they are used, and how to compare population health assessments across subpopulations and time. We will also explore the epidemiological sources and criteria by which to select high quality data sources to estimate population health indicators and to select evidence-based interventions to improve population health. Finally, we will design multi sector collaborations that support the phases of population health improvement.

As a survey of the population health, the course provides an overview for students wishing no more than an introduction to the field, as well as good grounding for students who wish to pursue additional coursework in population health.

After taking this course, you will be able to:
- Explain differences between population health assessments for public health and healthcare.
- Outline the key components of community health needs assessments (CHNA).
- Compare how public health and healthcare will use a CHNA to improve population health.
- Identify key population health indicators for social determinants of health.
- Identify key population health indicators for mental health and opioid abuse.
- Categorize data sources by epidemiologic criteria.
- Analyze differences between subpopulations and across time trends.
- Formulate multi sector collaborations that support population health improvement.
- Outline a plan for population health improvement.
- Evaluate evidence-based interventions based on epidemiologic criteria and community suitability.",,4990.0,4.3,10.0
"Bats, Ducks, and Pandemics: An Introduction to One Health Policy",https://www.coursera.org/learn/onehealth,Health,Public Health,Laura Kahn,"Welcome to ""Bats, Ducks, and Pandemics: An Introduction to One Health Policy"". 

One Health is the concept that human, animal, and environmental/ecosystem health are linked.  The concept provides a useful framework for examining complex health issues such as food safety and security, emerging and vector-borne diseases, and antimicrobial resistance. It can be used to analyze government policies to determine if they are effective in improving health and well-being.  

Agriculture is the foundation of civilization. Surplus food enabled the growth of cities; cities led to nations, and nations discovered the science and technology that allowed populations to grow. But agriculture comes with costs including environmental and ecosystem destruction and the emergence of zoonotic diseases. Antibiotics are the foundation of modern medicine. But antibiotics have come with costs too, including antimicrobial resistance and potentially harmful changes to human and animal microbiomes. 

This interdisciplinary course will cover diverse subjects such as basic epidemiology, public health, public policy, basic microbiology, food safety, and security, zoonotic diseases, sanitation and hygiene, antimicrobial resistance, environmental and ecosystem health, and the national and international organizations that oversee health, agriculture, and the environment. Disease outbreaks including Influenza, Q fever, and Ebola will be discussed. While the course was developed and recorded before the COVID-19 pandemic, the concepts learned very much apply to it. This course emphasizes holistic, not siloed, approaches to health, and disease.",7548.0,6608.0,4.8,351.0
Black Agricultural Solutions to Food Apartheid: A Teach-Out,https://www.coursera.org/learn/black-agricultural-solutions,Health,Public Health,"Ashley B. Gripper, PhD, MPH, Shannon Frattaroli, PhD, MPH","Black Agricultural Solutions to Food Apartheid is a series where we dive deep into the historical, ancestral, and spiritual connections that Black people have to land and agriculture. Throughout this course, we encourage participants to learn about their ancestral foodways, agrarian practices, and spiritual connections.  These sessions share wisdom and highlight the importance of food sovereignty, rebuilding community, and land based living. 

Participants will gain a deeper understanding of the spiritual and ancestral relationships that many Black people have to a higher power, land, plants, and each other.

Participants will walk away from this series with an understanding of the many benefits of gardening and farming, including but not limited to social capital, collective agency, physical wellbeing, deepened spiritual connections, community resilience, economic autonomy, organizing, mobilizing, and improved mental and emotional health.

Participants will leave this session with the desire to learn more about their own familial relationships to food and land, as well as a greater understanding of Black agriculture.",,2016.0,,
Breastfeeding: Public Health Perspectives,https://www.coursera.org/learn/breastfeeding-public-health-perspectives,Health,Public Health,Olivia S. Anderson,"Engaging in this course will provide you with the opportunity to think about breastfeeding and its public health implications. The Socio-Ecological Model will be the framework of the course as we think about how each level of the Model (individual, interpersonal, community, organizational, and public policy) impacts breastfeeding practices in the United States, and globally.

Through short video lectures you will be introduced to relevant topics related to the public health perspectives of breastfeeding such as the maternal and child short- and long-term health benefits, economic and environmental impacts, the state of health profession curricula surrounding breastfeeding education, and breastfeeding practices of the LGBTQ+ community. 

You will apply this knowledge to critique breastfeeding literature, create a breastfeeding budget for a particular breastfeeding parent persona, and design an education material to promote breastfeeding. As you complete this course, you should feel confident in identifying the barriers to successful breastfeeding practices and understand how adequate breastfeeding will impact population health.",1794.0,4641.0,4.7,10.0
Building on the SIR Model,https://www.coursera.org/learn/building-on-the-sir-model,Health,Public Health,Nimalan Arinaminpathy,"The other two courses in this specialisation require you to perform deterministic modelling - in other words, the epidemic outcome is predictable as all parameters are fully known. However, this course delves into the many cases – especially in the early stages of an epidemic – where chance events can be influential in the future of an epidemic. So, you'll be introduced to some examples of such ‘stochasticity’, as well as simple approaches to modelling these epidemics using R. You will examine how to model infections for which such ‘population structure’ plays an important role in the transmission dynamics, and will learn some of the basic approaches to modelling vector-borne diseases, including the Ross-McDonald Model. 

Even if you are not designing and simulating mathematical models in future, it is important to be able to critically assess a model so as to appreciate its strengths and weaknesses, and identify how it could be improved. One way of gaining this skill is to conduct a critical peer review of a modelling study as a reviewer, which is an opportunity you'll get by taking this course.",2414.0,2767.0,4.8,16.0
COVID Vaccine Ambassador Training: How to Talk to Parents,https://www.coursera.org/learn/covid-vaccine-ambassador,Health,Public Health,"Rupali J. Limaye, PhD, MPH, MA","Vaccination is a key strategy for preventing serious illness and death from COVID-19. COVID-19 vaccines are available for children 5 and older, but many parents have questions about vaccinations. This training course prepares parents of school-age children, PTAs, community members, and school staff to be Vaccine Ambassadors and promote vaccine acceptance in their communities. After completing the course, Vaccine Ambassadors will be able to share knowledge about COVID-19 and the COVID-19 vaccine, engage in conversations about vaccine hesitancy in a respectful and empathetic way, and direct people to credible sources for further information about COVID-19 vaccines.",28852.0,35929.0,4.9,1165.0
