name,url,category,subcategory,instructors,description,enrollment,views,rating,raters
Global Health: An Interdisciplinary Overview,https://www.coursera.org/learn/global-health-overview,Health,Public Health,"Rafael Ruiz De Castañeda, Antoine Flahault","This course proposes an overview of current global health challenges drawing on the insights of several academic disciplines including medicine, public health, law, economics, social sciences and humanities. This interdisciplinary approach will guide the student into seven critical topics in global health.",26704.0,11792.0,4.5,450.0
Global Quality Maternal and Newborn Care,https://www.coursera.org/learn/global-quality-maternal-and-newborn-care,Health,Public Health,"Michelle Telfer, Joan Combellick","This course is designed for administrators, advocates, policy makers, clinicians, and service users. It will give you the background, recommendations, and tools you need to address issues related to high quality maternal and newborn care in your own setting.  In particular, you will learn about the evidence behind implementing the midwifery model of care as a means to advancing the health and wellbeing of mothers and babies globally. The modules in this course are structured around the Quality Maternal and Newborn Care Framework, first published in the landmark 2014 Lancet Series on Midwifery. You will learn from nearly 20 expert contributors as they discuss their research and personal experiences in low, middle, and high resource settings.",8868.0,11240.0,4.8,167.0
Global Sodium Reduction Strategies,https://www.coursera.org/learn/sodium,Health,Public Health,"Megan E. Henry, PhD","This course will help guide policy makers, advocates, and program managers as they design, plan, and implement sodium reduction interventions to protect public health. We invite you to see what interventions have been proven at scale, what shows promise, and what lessons have been learned along the way from the implementation of sodium reduction strategies all around the globe. Our emphasis is implementation in settings with resource constraints. There are nine modules in this course. The first two modules set the stage with information on the science of sodium and context for lowering intake at a population level; the next five modules describe specific interventions; and the final two modules discuss comprehensive strategies in the wider context of public health, as well as tools for monitoring and evaluating interventions. 

Global Sodium Reduction Strategies was created by a team at the Johns Hopkins Bloomberg School of Public Health and is supported by the Resolve to Save Lives Initiative.",,,,
Guidance to Keep Newborn Babies Safe and Healthy,https://www.coursera.org/learn/keeping-newborn-baby-safe-healthy,Health,Public Health,"Christine Gold, Mary Kohn, MD, Daniel Nicklas","In your previous 2 courses, you learned some medical interventions and skills to keep newborns healthy in the days and weeks after they have been born.  In this course, you will learn some key things that parents will need to do to keep their babies safe and healthy.  The Guidance to Keep Newborn Babies Safe and Healthy Course will teach you best practices for how your baby will spend most of their day: eating, sleeping, and sometimes crying.  Parents need to understand how to optimize nutrition, how to create a safe and happy sleep environment, how to safely transport their baby in their car, and how to respond to their baby’s crying. 

A newborn baby is an amazing beautiful life filled with hope.  There is so much that goes into making sure that babies are born healthy, and so much more to think about after they are born.  Whether you are in the health care field, or even a parent, this course is the perfect educational opportunity for you to keep newborn babies healthy in the days and weeks after they are born!",7443.0,6620.0,4.8,194.0
Health Across the Gender Spectrum,https://www.coursera.org/learn/health-gender-spectrum,Health,Public Health,"Maya Adam, MD","This course offers an intimate, story-based introduction to the experiences of six transgender children and their families. Through illustrated stories and short teaching videos, learners will gain a better understanding of gender identity and the gender spectrum. Stanford physicians, K-12 educators, and transgender faculty members offer practical tips for parents, teachers, healthcare providers and anyone who wants to help create a more gender-expansive environment - one in which all people can live authentically. As a global community of unique individuals, we can begin to build a world that is ready to nurture and love each and every child. 

Due to the sensitive nature of the story-based course content, we have chosen not to offer course certificates for this course. Simply put, we feel that the thoughts, ideas and sentiments of these remarkable children and their families... are priceless. We are confident that, like us, you will end up learning more from them than you could ever imagine. Together, we can lay a stronger foundation for all children. Join us as we explore health, across the gender spectrum.

Additional note: When submitting answers to quizzes, you may be asked to enter your ""full legal name"". This feature is primarily for verification purposes for courses that offer a certificate on Coursera, so it does not really apply to this course. We recognize that, for some individuals the name they use does not match the one on their legal documents. Please feel free to enter the name you normally use in these boxes.",31823.0,10710.0,4.8,1830.0
Health Behavior Change: From Evidence to Action,https://www.coursera.org/learn/health-behavior-change,Health,Public Health,Marney White,"Humans often fail to make rational decisions that affect their health. This course seeks to heighten understanding of the social and behavioral factors that contribute to health decisions and behaviors, with an ultimate goal of learning how to utilize these factors in improving public health efforts. Through a set of experiential learning exercises, students will learn to apply the science of health behavior change in their own lives. The course is appropriate for students interested in health care and public health, as well as individuals who are interested in learning to apply the science of behavior change to improve their personal wellbeing.",22425.0,23637.0,4.8,261.0
Health Systems Development: A Focus on Health Service Delivery and Human Resources for Health,https://www.coursera.org/learn/health-service-delivery-and-human-resources,Health,Public Health,Dr Sondus Hassounah,"This specialization is intended for people interested in health systems and how they function. Participants will learn about the global health systems landscape and the challenges and opportunities to achieve better health outcomes. 

This specialisation is divided into three courses which are offered as massive online open access courses (Courses 1-3), and a fourth course which is offered as part of the Online MPH degree (capstone). The Health Systems Development specialisation is geared toward learners who have no prior knowledge of health systems or those who are starting to explore this area of study. Overall, sessions in this specialisation span 16 week with approximately 96 hours of viewing learning materials per week. Formative assessments in the form of quizzes and activities are incorporated throughout the weeks to help learners gauge their level of depth of understanding and to prepare them for their summative assessments. 

Participants will have the opportunity to explore a range of areas within health systems. 
The first course will introduce the main building blocks of health systems and shed some light on key components of well-functioning health systems including how health system performance is assessed.
In course two, students will learn how to conduct a health impact assessment and how to assess the impacts of policies, plans and projects, as well as how that support decision-makers make choices regarding alternatives and improvements to prevent disease or injury and to actively promote health. 
The third course explores human resources for health and service delivery. In  this course, students will learn about and analyse country experiences in transforming health services delivery, and interventions and to address human resources for health challenges at a global level. 

By the end of this specialisation, learners should be able to identify key components of, and critically compare, different health systems; analyse country experiences in transforming   services; and apply theoretical framework for assessing the health impacts of policies, plans and projects.",3061.0,5029.0,4.7,48.0
"Health Systems Development: Health systems, Policy and Research",https://www.coursera.org/learn/healthsystems-policy-research,Health,Public Health,Dr Sondus Hassounah,"This specialization is intended for people interested in health systems and how they function. Participants will learn about the global health systems landscape and the challenges and opportunities to achieve better health outcomes. 

This specialisation is divided into three courses which are offered as massive online open access courses (Courses 1-3), and a fourth course which is offered as part of the Online MPH degree (capstone). The Health Systems Development specialisation is geared toward learners who have no prior knowledge of health systems or those who are starting to explore this area of study. Overall, sessions in this specialisation span 16 week with approximately 96 hours of viewing learning materials per week. Formative assessments in the form of quizzes and activities are incorporated throughout the weeks to help learners gauge their level of depth of understanding and to prepare them for their summative assessments. 

Participants will have the opportunity to explore a range of areas within health systems. The first course will introduce the main building blocks of health systems and shed some light on key components of well-functioning health systems including how health system performance is assessed. In course two, students will learn how to conduct a health impact assessment and how to assess the impacts of policies, plans and projects, as well as how that support decision-makers make choices regarding alternatives and improvements to prevent disease or injury and to actively promote health. The third course explores   human   resources   for   health   and   service   delivery.  In this course, students will learn about and analyse country experiences in transforming health services delivery, and interventions and to address human resources for health challenges at a global level. 

By the end of this specialisation, learners should be able to identify key components of, and critically compare, different health systems; analyse country experiences in transforming   services; and apply theoretical framework for assessing the health impacts of policies, plans and projects.",3064.0,7900.0,4.9,44.0
Health Systems Development: Introduction to Health Systems,https://www.coursera.org/learn/introduction-to-health-systems,Health,Public Health,Dr Sondus Hassounah,"This specialization is intended for people interested in health systems and how they function. Participants will learn about the global health systems landscape and the challenges and opportunities to achieve better health outcomes. 

This specialisation is divided into three courses which are offered as massive online open access courses (Courses 1-3), and a fourth course which is offered as part of the Online MPH degree (capstone). The Health Systems Development specialisation is geared toward learners who have no prior knowledge of health systems or those who are starting to explore this area of study. Overall, sessions in this specialisation span 16 week with approximately 96 hours of viewing learning materials per week. Formative assessments in the form of quizzes and activities are incorporated throughout the weeks to help learners gauge their level of depth of understanding and to prepare them for their summative assessments. 

Participants will have the opportunity to explore a range of areas within health systems. The first course will introduce the main building blocks of health systems and shed some light on key components of well-functioning health systems including how health system performance is assessed. In course two, students will learn how to conduct a health impact assessment and how to assess the impacts of policies, plans and projects, as well as how that support decision-makers make choices regarding alternatives and improvements to prevent disease or injury and to actively promote health. The third course explores   human   resources   for   health   and   service   delivery.   In   this   course, students will learn about and analyse country experiences in transforming health services delivery, and interventions and to address human resources for health challenges at a global level. 

By the end of this specialisation, learners should be able to identify key components of, and critically compare, different health systems; analyse country experiences in transforming   services; and apply theoretical framework for assessing the health impacts of policies, plans and projects.",6148.0,59335.0,4.8,84.0
Health in Complex Humanitarian Emergencies,https://www.coursera.org/learn/health-che,Health,Public Health,"Dabney P. Evans, PhD, MPH, Cyrus Shahpar","The Center for Humanitarian Emergencies is a partnership between CDC's Emergency Response and Recovery Branch and the Rollins School of Public Health that drives global collaboration, research and evidence based training to improve the lives and well-being of populations impacted by humanitarian emergencies.

- Center for Humanitarian Emergencies: http://www.che.emory.edu/
- CDC's Emergency Response and Recovery Branch: http://www.cdc.gov/globalhealth/healthprotection/errb/index.html

This course covers the technical and management principles that are the basis of planning, implementing, and evaluating health programs for acutely displaced populations in developing countries. The emphasis is on refugees in camp situations. The course includes modules on assessment, nutrition, epidemiology of major health problems, surveillance, and program management in the context of an international relief operation.

Course Objectives
Upon completion of this course, learners will be able to:
1. Describe a complex humanitarian crisis in terms of magnitude, person, time and place.
2. Calculate basic epidemiology measures.
3. Evaluate the strengths and limitations of epidemiological data within the context of CHE.
4. Develop public health programs and strategies responsive to the diverse cultural values and traditions of the community being served.
5. Identify internal and external problems that may affect the delivery of essential public health services in a CHE.
6. Identify the different technical areas in a public health response in CHEs.",12505.0,9487.0,4.7,304.0
Healthcare Entrepreneurship: Taking Ideas to Market,https://www.coursera.org/learn/ghi-healthcare-entrepreneurship-taking-ideas-to-market,Health,Public Health,Dr Matthew Harris,"This course delves into intellectual property (IP) with an introduction into the innovation landscape within the UK and how that compares with other settings. You'll focus on how intellectual property applies to frugal innovations, compulsory licensing, and when and how to apply for intellectual property. This course teaches you about how innovators can secure funding by exploring the types of funding available, the types of organisations involved, as well as the challenges that surround funding. A key part of this course is a focus on 'pitching' skills - what's involved in pitching well, what content should you include, how can you best deliver a pitch. 

You'll come away from this course with strong insight into the importance of protecting an innovation's intellectual property,  able to identify IP processes and challenges, and able to confidently pitch an innovation.",4242.0,11358.0,4.7,47.0
Healthcare Innovation: What Does Success Look Like and How to Achieve It?,https://www.coursera.org/learn/ghi-healthcare-innovation-what-success-look-like-how-to-achieve,Health,Public Health,Dr Matthew Harris,"This course focuses on the factors involved in the adoption of innovation - features, organizations, country of origin, cognitive, normative and affective aspects, change agents. Using real-world health innovations, you'll assess what impacts their scaleability to new contexts, how organizational and human characteristics affect adoption, to what extent diffusion of an innovation is influenced by unconscious bias. You'll also delve into the process of adopting an innovation within a clinical setting and why it's so important to know who your 'change agents' are. As started in the second course of this specialisation, Healthcare Entrepreneurship: Taking Ideas to Market, you'll revisit the skill of pitching, exploring why and how to adapt pitches depending on your audience.  

By the end of this course, you'll feel able to judge the success of innovation projects; analyse how organizational structure, culture and resources are key in adoption; make recommendations for adoption in relation to organizational contexts; demonstrate how cognitive, normative and affective aspects can influence perception regarding an innovation's attractiveness and scaleability; and apply persuasive techniques to connect to audiences involved in the process of innovation scaling and adoption.",3040.0,4748.0,4.7,56.0
Healthy Aging and the Future of Cannabis Research,https://www.coursera.org/learn/aging-research-cannabis-cbd-thc,Health,Public Health,Kent Hutchison ,"This Healthy Aging and Future of Cannabis Research course is designed to have you think critically about the health effects of cannabis (i.e., marijuana) in the context of inflammation, exercise, and aging. You'll learn how inflammation and the microbiome may be related to the disorders discussed in class, and how cannabis may influence these disorders through modulating inflammation. We'll describe the relationship between the endocannabinoid system and exercise, and how cannabinoids may affect exercise performance and recovery. You'll learn how to identify key features of aging and how cannabinoids may influence the aging process. Obtaining this knowledge will be helpful in terms of informing public policy, public health, and personal decisions regarding the use of cannabis products.",3533.0,3564.0,4.8,75.0
High Level Biocontainment for Healthcare Facilities,https://www.coursera.org/learn/biocontainment,Health,Public Health,"Sharon Medcalf, PhD, Analisa McMillan, PhD, MSEd, Marty Magee MSA, MLS, Peggy Moore, MSEd","The goal of this 4-week course is to equip learners to safely care for a patient infected with a pathogen requiring high-level biocontainment.  This can be accomplished in any healthcare facility given the correct approach and protocols.

Please copy and paste the following link into a new tab/browser to view the video overview of our course.  http://bit.ly/2bPZ6Cz 

In this course, we will:
  1.  Discuss the essentials of intake screening.
  2.  Investigate pathogen transmission characteristics and the chain of infection.
  3.  Examine patient placement in a facility, as well as the engineering/ administrative controls. 
  4.  Review personal protective equipment worn by the care providers.
  5.  Evaluate waste management and decontamination protocols.


We look forward to exploring and learning with you!
Dr. Medcalf and University of Nebraska Medical Center Team


This project was funded by the Nebraska Department of Health and Human Services, Division of Public Health",3350.0,2256.0,4.7,89.0
History of Medical Cannabis,https://www.coursera.org/learn/history-medical-cannabis-cbd-thc,Health,Public Health,Kent Hutchison ,"This History of Medical Cannabis course is designed to have you think critically about past, present, and future research on the health effects of cannabis by developing a more nuanced understanding of the barriers to research as well as different approaches to research. You will learn about the history of cannabis cultivation, the legal history of cannabis or ""marijuana"",  and the obstacles that led to the lack of science on its medicinal use. You will also learn how to critically evaluate research on the effects of cannabis and discuss the associated risks of using cannabis in the context of public health and epidemiological research. Finally, you will learn about how to administer cannabis products in ways that minimize risk and maximize any potential benefits.  Obtaining this knowledge will be helpful in terms of informing public policy, public health, and personal decisions regarding the use of cannabis products.",12048.0,10173.0,4.8,296.0
History of Racial Inequity in Healthcare,https://www.coursera.org/learn/history-of-racial-inequity-in-healthcare,Health,Public Health,Minal R. Patel,"The first course of the Addressing Racial Health Inequity in Healthcare specialization will first situate the role of public health in healthcare, and walk through important concepts and definitions that you will see throughout the course and subsequent courses. You will walk through the social and biological perspectives on the concepts of race and racism, and unpack the history of unequal treatment in the U.S. You will learn about the health insurance system in the U.S., differential access to care, and professional challenges to diversity in healthcare. And finally, you will explore examples of resilience in healthcare that were critical to preserving the health of marginalized populations.",,3796.0,,
Household Surveys for Program Evaluation in LMICs,https://www.coursera.org/learn/household-surveys-for-program-evaluation,Health,Public Health,"Abdoulaye Maïga, Melinda K. Munos, Ashley L. Sheffel, Talata Sawadogo-Lewis","This course provides an introduction to household surveys for program evaluation in low-and middle-income countries. The course will equip you with skills to:

1. Explain what coverage is, why it’s important in evaluations, and how it is measured
2. Describe what household surveys can and cannot measure
3. Plan, implement, and analyze household survey, including: 
4. Calculate an appropriate household survey sample size 
5. Explain the resources required for a household survey
6. Identify an appropriate sampling design
7. Design a questionnaire
8. Describe challenges for coverage survey planning and implementation
9. Present and describe how the RADAR tool can be used

The development of this course was supported by a grant from Government Affairs Canada (GAC) for the Real Accountability, Data Analysis for Results (RADAR) project.",,4083.0,,
Hypothesis Testing in Public Health,https://www.coursera.org/learn/hypothesis-testing-public-health,Health,Public Health,"John McGready, PhD, MS","Biostatistics is an essential skill for every public health researcher because it provides a set of precise methods for extracting meaningful conclusions from data. In this second course of the Biostatistics in Public Health Specialization, you'll learn to evaluate sample variability and apply statistical hypothesis testing methods. Along the way, you'll perform calculations and interpret real-world data from the published scientific literature. Topics include sample statistics, the central limit theorem, confidence intervals, hypothesis testing, and p values.",13226.0,20419.0,4.8,554.0
"Impacting the Opioid Crisis: Prevention, Education, and Practice for Non-Prescribing Providers",https://www.coursera.org/learn/opioid,Health,Public Health,"Karen Farris, PhD, MPA","This course will empower non-prescribing providers to directly impact the ongoing opioid crisis in the United States through increased knowledge and tools that will transform practice and policies. The course will inform you about the opioid epidemic and provide information and research about evidence-based strategies that are focused on prevention, intervention, education, or policy.

This open learning course is designed primarily for non-prescribing healthcare, behavioral health, dental and social services professionals, as well as graduate-level students in these fields. Other individuals may also benefit from this course such as educators and physicians. 

As a learner, you have the ability to select any or all of the modules and topics that interest you. You can complete the course in a linear or non-linear structure according to your preferred viewing order. This course is taught by experts in the field of opioid prevention, intervention, treatment, and policy. Through lectures, panels and interviews, knowledge checks and quizzes, and additional readings and activities, you can explore topics that are most relevant to your work or practice.

The course was developed by three University of Michigan programs, including the Institute for Healthcare Policy and Innovation (IHPI), Michigan-Opioid Prescribing Engagement Network (Michigan OPEN) and the CDC-funded University of Michigan Injury Prevention Center.

The course consists of 6 “lessons” or modules of varying length, for a total commitment of about 15 hours.",4083.0,4737.0,4.9,43.0
