name,url,category,subcategory,instructors,description,enrollment,views,rating,raters
Confronting Gender Based Violence: Global Lessons for Healthcare Workers,https://www.coursera.org/learn/gender-based-violence,Health,Public Health,"Michele Decker, ScD, MPH","This course introduces participants from the healthcare sector to gender based violence (GBV), including global epidemiology of GBV; health outcomes; seminal research; and clinical best practices for GBV prevention, support, and management. A core curriculum is supplemented by lectures that contextualize the content with specific examples and programs from around the world. The core curriculum introduces learners to a global perspective on gender based violence (GBV), and includes a review with Dr. Claudia Garcia-Moreno of the new WHO guidelines on responding to violence. Students who wish to receive Honors Recognition will complete the honors module, which expands on the core material and highlights special circumstances and programs. 

This is an in-depth course with 2 components: 
1) Core curriculum introduces GBV from a global perspective, with an emphasis on ensuring a strong health sector response to GBV and teaching key competencies for social workers, physicians, nurses, midwives, community health workers, counselors, and other healthcare workers. Completion of the core content is required for students to pass the course. 
2) Honors curriculum offered by experts from around the world helps students dive deeper into certain issues, and touches on unique populations and specialized topics. Completion of Honors curriculum is required for those students who wish to receive a Certificate of Accomplishment with Honors.

After taking the course, students will be able to:
●	Describe the global epidemiology of leading forms of GBV and the evidence linking GBV to poor health.
●	Articulate the challenges, strategies, and WHO guidelines for integrating GBV response within the health sector. 
●	Describe the components of a comprehensive clinical assessment, treatment, and management of a GBV survivor.
●	Describe the appropriate psychosocial support and management of a GBV survivor.

Module 1 – Introduction to GBV- Epidemiology and Health Impact
GBV comes in a variety of forms, each with health consequences for the survivor. An understanding of these issues helps inform a comprehensive and multi-sectorial response for preventing and responding to GBV. 

Module 2 – Health Care Response, Screening, and Psychosocial Support
Recognition of health impacts of GBV has led to calls to address GBV within the health sector. Support for GBV survivors extends beyond clinical exam and assessment. Safety planning, harm reduction, and access to psychosocial support must be ensured. 

Module 3 – Clinical Care for GBV Survivors
Caring for GBV survivors requires compassionate, confidential, and nondiscriminatory clinical assessment. Competent medical and forensic examination, along with appropriate documentation, is essential.

Honors Module – In-Depth Information and Special Topics
This module provides additional materials for those who wish to explore specialized topics and gain a more advanced grasp of the complexities of addressing gender-based violence. Core course topics are expanded upon, and special populations and programs are highlighted. Special topics include violence in humanitarian settings, against adolescents and sex workers, and human trafficking. Further information is provided on epidemiology, policy, and ethical guidelines, as well as the use of mHealth in GBV screening and care. We’ll cover the unique challenges of GBV research, and explore programs that encourage men and boys to be engaged in the prevention of violence against women. 

Acknowledgments
This course is a project of the Johns Hopkins Center for Clinical Global Health Education.  We would like to gratefully acknowledge the following collaborators:

●	Centre for Enquiry into Health and Allied Themes (CEHAT)
●	International Center for Research on Women's (ICRW) Asia Regional Office
●	Center on Gender Equity and Health at University of California, San Diego
●	Division of Global Public Health at University of California, San Diego
●	World Health Organization
●	RTI International
●	Swayam
●	Johns Hopkins Bloomberg School of Public Health, Center for Public Health and Human Rights
●	Johns Hopkins Bloomberg School of Public Health, Department of Population, Family & Reproductive Health
●	Johns Hopkins School of Nursing

This course is made possible through the generosity of the Ujala Foundation, the Vijay & Marie Goradia Charitable Foundation, and the Wyncote Foundation.",23946.0,14109.0,4.8,247.0
Cuidados y procedimientos generales en la atención del recién nacido,https://www.coursera.org/learn/cuidados-del-recien-nacido,Health,Public Health,Pablo Gálvez Ortega,"En este curso los alumnos podrán identificar conceptos esenciales de la atención del recién nacido sano y de alto riesgo, sus clasificaciones y los cuidados pertinentes para la atención de los mismos. Reconocerán insumos y elementos necesarios para permitir una atención de alta calidad y reducir los riesgos que conlleva la atención neonatal, además de estrategias y habilidades, que les permitan desempeñarse posteriormente con estos pacientes en las áreas de la reanimación neonatal, alimentación y cuidados de la piel.",39022.0,9454.0,4.8,1746.0
Curanderismo: Global & Cultural Influences of Traditional Healing,https://www.coursera.org/learn/curanderismo-global-traditional-healing,Health,Public Health,"Eliseo (Cheo) Torres, Mario del Angel Guevara","As the last of four courses on Curanderismo, the art of Hispanic/Latino traditional medicine, this course focuses specifically on traditional healing using different techniques of many countries around the world. As an educational and cultural platform, this course will share a number of traditional global perspectives.

Learners will not become certified traditional healers at the completion of this course but will be able apply basic principles or traditional medicine for health and illnesses. They will become familiar specifically with African traditional medicine from Uganda, African healing through music from Gabon, Afro-Cuban and Afro Puerto-Rican healing techniques, medicinal plants for women, Native American feather healing and other topics.

REQUIRED TEXTS
Curanderismo: The Art of Traditional Medicine without Borders by Eliseo Torres

Curandero: Traditional Healers of Mexico and the Southwest by Eliseo Torres with Imanol Miranda

Where to buy:
https://he.kendallhunt.com/product/curanderismo-art-traditional-medicine-without-borders

https://he.kendallhunt.com/product/curandero-traditional-healers-mexico-and-southwest

OPTIONAL TEXTS
Curandero: A life in Mexican Folk Healing by Eliseo Torres & Tim Sawyer

Healing with Herbs & Rituals: A Mexican Tradition, Eliseo Torres, edited by Tim Sawyer

Where to buy:
https://www.barnesandnoble.com/w/curandero-torres-eliseo-cheo/1120135382?ean=9780826336415&st=PLA&sid=BNB_1341481610&sourceId=PLAGoNA&dpid=tdtve346c&2sid=Google_c&gclid=EAIaIQobChMI3_6LmYev3gIViuNkCh3IPgUyEAQYASABEgLYXfD_BwE

https://www.barnesandnoble.com/w/healing-with-herbs-and-rituals-torres-eliseo-cheo/1120135381?ean=9780826339621&st=PLA&sid=BNB_825204424&sourceId=PLAGoNA&dpid=tdtve346c&2sid=Google_c&gclid=EAIaIQobChMIrrvswYev3gIVBsRkCh3BXQCHEAQYASABEgLnl_D_BwE

PODCAST:
Blubrry podcast - https://www.blubrry.com/normallol/41068835/normal-lol-63-depersonalization-mental-wellness-curanderismomexican-traditional-healing-with-eliseo-cheo-torres/

Itunes Episode 63 - https://itunes.apple.com/us/podcast/normal-lol-depersonalization-derealization-anxiety/id1065740418?mt=2",3920.0,1637.0,4.7,36.0
"Curanderismo: Traditional Healing of the Mind, Energy & Spirit",https://www.coursera.org/learn/curanderismo-traditional-healing,Health,Public Health,"Eliseo (Cheo) Torres, Mario del Angel Guevara","As the third of four courses on Curanderismo, the art of Hispanic/Latino traditional medicine, this course focuses specifically on traditional healing of mind, energy and spirit. As an educational and cultural platform, this course will share a number of traditional body therapies. Trained traditional healers will share their knowledge of cleansings from different cultures such as spiritual, energetic and Tonalli Cleansing.

Learners will not become certified traditional healers at the completion of this course but will be able apply basic principles or traditional medicine for health and illnesses. They will become familiar specifically with the traditional therapy of the sweat lodge temazcal, laugh therapy risaterapia and they will learn about the creation of sacred spaces and healing grief through Día de los Muertos. 

The Final Curanderismo course will be:

•	Global and Cultural Influences of Traditional Healing: African traditional medicine from Uganda and Gabon; Afro-Latino from Cuba and Puerto Rico, Native American spiritual cleansings and Mayan acupuncture and other topics.

REQUIRED TEXTS
- Curanderismo: The Art of Traditional Medicine without Borders by Eliseo Torres
- Curandero: Traditional Healers of Mexico and the Southwest by Eliseo Torres with Imanol Miranda

Where to buy:
https://he.kendallhunt.com/product/curanderismo-art-traditional-medicine-without-borders
https://he.kendallhunt.com/product/curandero-traditional-healers-mexico-and-southwest

OPTIONAL TEXTS
Curandero: A life in Mexican Folk Healing by Eliseo Torres & Tim Sawyer
Healing with Herbs & Rituals: A Mexican Tradition, Eliseo Torres, edited by Tim Sawyer

Where to buy:
https://www.barnesandnoble.com/w/curandero-torres-eliseo-cheo/1120135382?ean=9780826336415&st=PLA&sid=BNB_1341481610&sourceId=PLAGoNA&dpid=tdtve346c&2sid=Google_c&gclid=EAIaIQobChMI3_6LmYev3gIViuNkCh3IPgUyEAQYASABEgLYXfD_BwE

https://www.barnesandnoble.com/w/healing-with-herbs-and-rituals-torres-eliseo-cheo/1120135381?ean=9780826339621&st=PLA&sid=BNB_825204424&sourceId=PLAGoNA&dpid=tdtve346c&2sid=Google_c&gclid=EAIaIQobChMIrrvswYev3gIVBsRkCh3BXQCHEAQYASABEgLnl_D_BwE

PODCAST:
- Blubrry podcast - https://www.blubrry.com/normallol/41068835/normal-lol-63-depersonalization-mental-wellness-curanderismomexican-traditional-healing-with-eliseo-cheo-torres/
- Itunes Episode 63 - https://itunes.apple.com/us/podcast/normal-lol-depersonalization-derealization-anxiety/id1065740418?mt=2",10855.0,4750.0,4.8,106.0
Curanderismo:Influencias Globales de la Medicina Tradicional,https://www.coursera.org/learn/curanderismo-influencias-globales,Health,Public Health,"Mario del Angel Guevara, Eliseo (Cheo) Torres","Bienvenido a Curanderismo: ¡Influencias globales y culturales de la medicina tradicional! Hoy te unes a miles de estudiantes que actualmente están inscritos en el curso. Estoy emocionado de tenerte en la clase y espero tus contribuciones a la comunidad de aprendizaje.

Para comenzar, recomiendo tomarse unos minutos para explorar el curso. Revisa el material que cubriremos cada semana y observa la vista previa de las tareas que deberás completar para aprobar el curso. Haz clic en Discusiones para ver foros donde puedes discutir el material del curso con otros estudiantes que toman la clase.

Si tiene preguntas sobre el contenido del curso, publícalas en los foros para obtener ayuda de otros miembros de la comunidad del curso. Para problemas técnicos con la plataforma Coursera, visita el Centro de ayuda para estudiantes.

¡Buena suerte al comenzar y espero que disfrutes del curso!
Mario del Angel Guevara

Es necesario conseguir 2 libros para la clase.

Link para obtener los libros de la clase. Puedes comprar el libro electrónico a un precio más accesible haciendo clic en ""Digital copy"":

https://he.kendallhunt.com/product/curanderismo-art-traditional-medicine-without-borders-spanish-edition

https://he.kendallhunt.com/product/curandero-traditional-healers-mexico-and-southwest-spanish",,1931.0,,
Data and Health Indicators in Public Health Practice,https://www.coursera.org/learn/data-public-health,Health,Public Health,"Keri Althoff, PhD, MPH","Epidemiology is often described as the cornerstone science in public health. Epidemiology in public health practice uses study design and analyses to identify causes in an outbreak situation, guides interventions to improve population health, and evaluates programs and policies.

In this course, we'll define the role of the professional epidemiologist as it relates to public health services, functions, and competencies. With that foundation in mind, we'll introduce you to the problem solving methodology and demonstrate how it can be used in a wide variety of settings to identify problems, propose solutions, and evaluate interventions. This methodology depends on the use of reliable data, so we'll take a deep dive into the routine and public health data systems that lie at the heart of epidemiology and then conclude with how you can use that data to calculate measures of disease burden in populations.",28347.0,12228.0,4.7,1121.0
Design and Conduct of Clinical Trials,https://www.coursera.org/learn/design-and-conduct-clinical-trials,Health,Public Health,"Janet Holbrook, PhD, MPH, Ann-Margret Ervin, PhD, MPH, Stephan Ehrhardt, MD, MPH, Elizabeth A. Sugar, PhD","In this course, you’ll learn how to design and carry out clinical trials. Each design choice has implications for the quality and validity of your results. This course provides you and your team with essential skills to evaluate options, make good design choices, and implement them within your trial. You’ll learn to control for bias, randomize participants, mask treatments and outcomes, identify errors, develop and test hypotheses, and define appropriate outcomes. Finally, a trial without participants is no trial at all, so you’ll learn the guiding principles and develop the essential skills to ethically and conscientiously recruit, obtain consent from, and retain trial participants.",,16019.0,,
Developing the SIR Model,https://www.coursera.org/learn/developing-the-sir-model,Health,Public Health,Nimalan Arinaminpathy,"Compartmental modelling is a cornerstone of mathematical modelling of infectious diseases and this course will introduce  some  of  the  basic  concepts  in  building  compartmental  models, including how to interpret and represent rates, durations and proportions. You'll learn to place the mathematics to one side and concentrate on gaining intuition into the behaviour of a simple epidemic, and be introduced to further basic concepts of infectious disease epidemiology, such as the  basic reproduction number (R0) and its implications for infectious disease dynamics. To express the mathematical  underpinnings of the  basic drivers that you study, you'll use the simple SIR model, which, in turn, will help you examine different scenarios for reproduction numbers. Susceptibility to infection is the fuel for an infectious  disease, so understanding  the dynamics of susceptibility can offer important insights into epidemic dynamics, as well as priorities for control.",8429.0,6065.0,4.8,238.0
Diabetes - a Global Challenge,https://www.coursera.org/learn/diabetes,Health,Public Health,"Jens Juul Holst, Signe Sørensen Torekov, Nicolai Jacob Wewer Albrechtsen","Diabetes and obesity are growing health problems in rich and poor countries alike. With this course you will get updated on cutting-edge diabetes and obesity research including biological, genetic and clinical aspects as well as prevention and epidemiology of diabetes and obesity. All lectures are provided by high-profile scientists from one the world's leading universities in diabetes research. 

This course is part of the EIT Health Campus programme.

We hope you will enjoy our course.

Best Wishes 

Jens Juul Holst, Signe Sørensen Torekov and Nicolai Wewer Albrechtsen 
Department of Biomedical Sciences Novo Nordisk Foundation Center for Basic Metabolic Research 
Faculty of Health and Medical Sciences University of Copenhagen",42899.0,17947.0,4.8,622.0
Diagnosing Health Behaviors for Global Health Programs,https://www.coursera.org/learn/health-behaviors-global,Health,Public Health,"William Brieger, DrPH","Health behavior lies at the core of any successful public health intervention. While we will examine the behavior of individual in depth in this course, we also recognize by way of the Ecological Model that individual behavior is encouraged or constrained by the behavior of families, social groups, communities, organizations and policy makers. We recognize that behavior change is not a simplistic process but requires an understanding of dimensions like frequency, complexity and cultural congruity. Such behavioral analysis is strengthened through the use of a toolkit of theoretical models and practical frameworks. While many of such models and frameworks exist, in this course we will review the Health Belief Model, Social Learning Theory, Theory of Reasoned Action, the Trans-Theoretical Model and the PRECEDE Framework. After building your behavioral analysis toolkit with these examples, you will see that actual behavior change program planning uses a combination of ideas and variables from different models, theories and frameworks. Ultimately we aim to encourage course participants to apply the idea that successful programs are theory based as they go about involving people in improving their health.",4405.0,4653.0,4.7,84.0
Disease Clusters,https://www.coursera.org/learn/disease-clusters,Health,Public Health,"Dr. Megan Weil Latshaw, PhD, Dr. Ellen Silbergeld","Do a lot of people in your neighborhood all seem to have the same sickness? Are people concerned about high rates of cancer? Your community may want to explore the possibility of a disease cluster, which happens when there is a higher number of cases of disease than expected.

When communities hear about cases of disease in their neighborhood, they are rightfully concerned. However, the results of investigations by the health department often find no evidence of a cluster.
 
This course will help you understand what a disease cluster is and how it is studied.  The goal is to empower community (or citizen) scientists, and to help build better relationships between communities and health officials.",14436.0,2101.0,4.7,308.0
Disease Screening in Public Health,https://www.coursera.org/learn/screening,Health,Public Health,"Antoine Flahault, Fred Paccaud (In Partnership with UNIGE), Gillian Bartlett-Esquilant","Current and future public health is characterized by the increase of chronic and degenerative diseases, corresponding to the worldwide ageing of the population. The increasing prevalence of these conditions together with the long incubation period of the chronic diseases and the continual technological innovations, offer new opportunities to develop strategies for early diagnosis.

Public Health has an important mandate to critically assess the promises and the pitfalls of disease screening strategies. This MOOC will help you understand important concepts for screening programs that will be explored through a series of examples that are the most relevant to public health today.  We will conclude with expert interviews that explore future topics that will be important for screening.

By the end of this MOOC, students should have the  competency needed to be involved in the scientific field of screening, and understand the public health perspective in screening programs.

This MOOC has been designed by the University of Geneva and the University of Lausanne. 
This MOOC has been prepared under the auspices of the Ecole romande de santé publique (www.ersp.ch) by Prof. Fred Paccaud, MD, MSc, Head of the Institute of Social and Preventive Medicine in Lausanne (www.iumsp.ch), in collaboration with Professor Antoine Flahault, MD, PhD, head of the Institute of Global Health, Geneva (https://www.unige.ch/medecine/isg/en/) and Prof. Gillian Bartlett-Esquilant (McGill University, Quebec/ Institute of Social and Preventive Medicine, Lausanne).",23748.0,10065.0,4.6,378.0
"Drugs, drug use, drug policy and health",https://www.coursera.org/learn/drugs,Health,Public Health,"Michel Kazatchkine, Barbara Broers, Jennifer Hasselgard-Rowe, Aymeric Reyre","This MOOC is the first of its kind, since it addresses critical issues related to drugs from a multidisciplinary, health and human rights-based approach. Throughout the course you will cover a range of questions including what are drugs and why they controlled? What are the benefits and harms of taking drugs? How public health policies can address drug use? 

You will also learn about the intricacies of the international drug control framework and the negative consequences of widespread prohibitionist drug policies around the world. Finally, you will examine ways of furthering drug policy reform.

The topics will be presented by over 40 speakers from scientific, academic and institutional backgrounds, spokespersons of civil society as well as people who use drugs presenting their views.

By the end of the course you will have:
-	a strong understanding of the major health issues related to drug use and drug policy; 
-	a clear vision of why drug policy is debated today; 
-	and, if you so wish, you will be equipped to engage in the drug policy reform movement at your local or regional level.",28819.0,17561.0,4.8,235.0
ERPO: A Civil Approach to Gun Violence Prevention Teach-Out,https://www.coursera.org/learn/erpo,Health,Public Health,"Josh Horwitz, JD, Katherine Hoops, MD, MPH, Shannon Frattaroli, PhD, MPH","Evidence shows that 1 life is saved for every 10-20 Extreme Risk Protection Orders (ERPOs) issued. ERPOs are legally issued civil orders that allow people on the front lines to ask a court to prevent a person at imminent risk of harm to themselves or others from purchasing or possessing firearms during a critical period of risk. As of October 2020, ERPO laws have been enacted by nineteen states and the District of Columbia and while some aspects differ by state, the general process for applying and issuing ERPOs are quite similar. 

In this Teach-Out, a team of public health, policy, and medical experts will each provide a unique perspective to:
 
1. Define what ERPO laws are and how they work;
2. Share scientific evidence supporting ERPO laws as a public health approach to preventing gun violence and suicide;
3. Describe specific considerations for those eligible to petition for (aka those who ask the court to issue) ERPOs on behalf of an individual—including law enforcement, health professionals, and personal family members;
4. Discuss the legal process for passing, implementing, and enforcing ERPO laws; 
5. Recommend specific call to action activities for learners designed to encourage policy makers to implement ERPO laws in states without them and strengthen existing ERPO laws in states that already have them; and 
6. Provide opportunities for learners to engage in civil discourse and collective action to increase awareness about ERPOs and empower learners to advocate for ERPO laws to reduce and prevent gun violence in our communities.",,1712.0,,
