name,url,category,subcategory,instructors,description,enrollment,views,rating,raters
Connecting to Devices and Networks,https://www.coursera.org/learn/codio-connecting-to-devices-and-networks,Information Technology,Networking,"Elise Deitrick, Chalece DeLaCoudray","Practice managing devices and networks without installing anything!

This course is designed for learners with no technical experience, providing a solid foundation of connecting to devices and networks. Learners will gain hands-on practice on an Ubuntu system that can be easily transferred to other Unix-based operating systems. The modules in this course cover managing devices and partitions, basic networking tools and name resolution, and securely transferring data over networks to create backups. 

To allow for a truly hands-on, self-paced learning experience, this course is video-free. Assignments contain short explanations with images and runnable examples with suggested edits to explore examples further, building a deeper understanding by doing. You'll benefit from instant feedback from a variety of assessment items along the way, gently progressing from quick understanding checks (multiple choice, fill in the blank, and un-scrambling code blocks) to small, approachable exercises that take minutes instead of hours.",,,,
Crea una Organización Autónoma Descentralizada en Ethereum,https://www.coursera.org/learn/dao-ethereum,Information Technology,Networking,Nestor Nicolas Campos Rojas,"En este proyecto, vamos a entender sobre las organizaciones autónomas descentralizadas (DAO) y cómo podemos crear una con la red blockchain Ethereum",,,,
Creando una aplicación con Stellar SDK,https://www.coursera.org/learn/creando-stellar-sdk,Information Technology,Networking,Nestor Nicolas Campos Rojas,"En este proyecto, vamos a crear una aplicación que se pueda conectar con Blockchain mediante el SDK en Javascript para la red Stellar.",,,,
Creando una aplicación descentralizada con Javascript,https://www.coursera.org/learn/dapp-javascript,Information Technology,Networking,Nestor Nicolas Campos Rojas,"En este proyecto, usaremos CaverJS y Covalent para crear una wallet para la blockchain Klaytn.",,,,
Create a fundraising page on Chuffed,https://www.coursera.org/learn/create-fundraising-page-chuffed,Information Technology,Networking,Delphine Sangotokun,"At the end of this project, you will learn how to create a fundraising page on Chuffed for a collaborative project for personal or professional purposes.
This Guided Project is an introduction to Chuffed and is designed for people who want to have their own fundraising page for a nonprofit, charity, social enterprise, community project, or someone in need.
Chuffed offers an online platform to create a fundraiser, large or small, with no set-up fees by the platform. Moreover, Chuffed offers possibilities to develop a fundraising page site with many functionalities and aesthetic characteristics.
After completing this project, you will be able to create a fundraising page, select and modify the main features offered on the platform, define your financial and participatory goals and the rewards potentially offered to your contributors. Chuffed is a simple and free platform that provides extraordinary online advertising for your collaborative project.

This course works best for learners who are based in the North America region. We’re currently working on providing the same experience in other regions",,,,
Creating an Instance with Multiple Network Interfaces,https://www.coursera.org/learn/googlecloud-creating-an-instance-with-multiple-network-interfaces-lswvh,Information Technology,Networking,Google Cloud Training ,"We help millions of organizations empower their employees, serve their customers, and build what’s next for their businesses with innovative technology created in—and for—the cloud. Our products are engineered for security, reliability, and scalability, running the full stack from infrastructure to applications to devices and hardware. Our teams are dedicated to helping customers apply our technologies to create success.",,,,
Créer une page de collecte de fonds sur Chuffed,https://www.coursera.org/learn/creer-page-collecte-fonds-chuffed,Information Technology,Networking,Delphine Sangotokun,"À la fin de ce projet, vous apprendrez à créer une page de collecte de fonds sur Chuffed pour un projet collaboratif à des fins personnelles ou professionnelles.
Ce projet guidé est une introduction à Chuffed et est conçu pour les personnes qui souhaitent avoir leur propre page de collecte de fonds pour un projet à but non lucratif, caritatif, pour supporter une entreprise sociale, un projet communautaire ou une personne dans le besoin.
Chuffed offre une plateforme en ligne pour créer une collecte de fonds, à petite ou grande échelle, sans frais de mise en place par la plateforme. De plus, Chuffed offre des possibilités de développer un site page de collecte de fonds avec de nombreuses fonctionnalités et caractéristiques esthétiques.  
Après avoir terminé ce projet, vous pourrez créer une page de collecte de fond, sélectionner et modifier les principales fonctionnalités offertes sur la plateforme, définir vos buts financiers et participatifs et les récompenses potentiellement offertes à vos contributeurs. Chuffed est une plateforme simple et gratuite qui fournit une publicité en ligne extraordinaire à votre projet collaboratif et participatif.

This course works best for learners who are based in the North America region. We’re currently working on providing the same experience in other regions",,,,
Custom Providers with Terraform,https://www.coursera.org/learn/googlecloud-custom-providers-with-terraform-adqwp,Information Technology,Networking,Google Cloud Training ,"We help millions of organizations empower their employees, serve their customers, and build what’s next for their businesses with innovative technology created in—and for—the cloud. Our products are engineered for security, reliability, and scalability, running the full stack from infrastructure to applications to devices and hardware. Our teams are dedicated to helping customers apply our technologies to create success.",,,,
Customize Network Topology with Subnetworks,https://www.coursera.org/learn/googlecloud-customize-network-topology-with-subnetworks-gwnhz,Information Technology,Networking,Google Cloud Training ,"We help millions of organizations empower their employees, serve their customers, and build what’s next for their businesses with innovative technology created in—and for—the cloud. Our products are engineered for security, reliability, and scalability, running the full stack from infrastructure to applications to devices and hardware. Our teams are dedicated to helping customers apply our technologies to create success.",,,,
Data Forwarding Across Computer Networks,https://www.coursera.org/learn/data-forwarding-computer-networks,Information Technology,Networking,Mohammed Al M.,"Welcome to the CCNA 1.3: Data Forwarding Across Computer Networks. This project is the third in the guided-projects series that is designed to help you acquire the hands-on skills required to pass the CCNA certification exam.

In this 2-hours guided project, you will  understand how data is forwarded across computer networks, configure default and static routes on Cisco routers, set up dynamic routing using OSPF routing protocol, and verify and trace network routes.",,,4.7,33.0
Deploy Microsoft SQL Server to Compute Engine,https://www.coursera.org/learn/googlecloud-deploy-microsoft-sql-server-to-compute-engine-4hjgs,Information Technology,Networking,Google Cloud Training ,"We help millions of organizations empower their employees, serve their customers, and build what’s next for their businesses with innovative technology created in—and for—the cloud. Our products are engineered for security, reliability, and scalability, running the full stack from infrastructure to applications to devices and hardware. Our teams are dedicated to helping customers apply our technologies to create success.",,,,
Design and Simulate Smart Home Networks in Packet Tracer,https://www.coursera.org/learn/design-simulate-smart-home-networks-packet-tracer,Information Technology,Networking,Mohammed Al M.,"In this 1-hour long project-based course, you will learn how to design computer networks in logical and physical views, connect IoT devices to create smart home networks, and simulate computer networks operation in real-world environments.",2675.0,,4.6,53.0
Develop a free website with WordPress,https://www.coursera.org/learn/develop-free-website-wordpress,Information Technology,Networking,Delphine Sangotokun,"By the end of this project, you will learn how to develop your free website created in WordPress for personal or commercial purposes. 
This guided project is designed for people who already created their website on WordPress and now want to add pages, creates articles and publish media.
WordPress offers a large variety of free website design and possibilities to develop a commercial website, a blog, a photo gallery, amongst others, allowing you to create an aesthetically pleasing online platform and/or add value to your business marketing.
After completing this project, you will be able to create all the contents that you please, such as a photo gallery or a blog post. WordPress is an easy and free platform that provides all the tools you need to create an organized and visually appealing product while offering potential added customization and tools at a low price. Everything for your website is available on this platform!

This course works best for learners who are based in the North America region. We’re currently working on providing the same experience in other regions.",,,,
Die Bits und Bytes von Computernetzwerken,https://www.coursera.org/learn/computer-networking-de,Information Technology,Networking,Google Career Certificates,"Dieser Kurs soll Ihnen einen umfassenden Überblick über das Thema Computernetzwerke bieten. Sie werden die Grundlagen moderner Netzwerktechnologien und -protokolle kennenlernen, einen Überblick über die Cloud erhalten und mehr über praktische Anwendungsfälle und die Behebung von Netzwerkproblemen erfahren. Abschließend werden wir uns ansehen, wie diese Informationen in einem Bewerbungsgespräch auftauchen könnten, und geben Ihnen einige Tipps, wie Sie Netzwerkprobleme im Handumdrehen beheben.

Nach diesem Kurs…
● können Sie Computernetzwerke hinsichtlich des Fünf-Schichten-Modells beschreiben.
● kennen Sie alle Standardprotokolle, die an der TCP/IP-Kommunikation beteiligt sind.
● kennen Sie leistungsstarke Tools und Methoden zur Behebung von Netzwerkproblemen.
● kennen Sie Netzwerkdienste wie DNS und DHCP, die für den Betrieb von Netzwerken erforderlich sind
● wissen Sie, wie Cloud-Computing, Everything as a Service und Cloud-Speicher funktionieren.",,7519.0,4.6,37.0
Développe un site Internet gratuit avec WordPress,https://www.coursera.org/learn/developpe-site-internet-gratuit-wordpress,Information Technology,Networking,Delphine Sangotokun,"À la fin de ce projet, vous apprendrez à développer votre site Web gratuit créé dans WordPress à des fins personnelles ou commerciales.
Ce projet guidé s'adresse aux personnes ayant déjà créé leur site web sur WordPress et souhaitant désormais ajouter des pages, créer des articles et publier des médias.
WordPress offre une grande variété d’options et de possibilités pour la création de sites Web gratuits tels qu’un site commercial, un blog, une galerie de photos, entre autres, vous permettant de créer une plate-forme en ligne esthétique et/ou d'ajouter de la valeur marketing à votre entreprise.
Après avoir terminé ce projet, vous pourrez créer tous les contenus qui vous plaisent, comme une galerie de photos ou un article de blog. WordPress est une plate-forme simple et gratuite qui fournit tous les outils dont vous avez besoin pour créer un produit organisé et visuellement attrayant tout en offrant une personnalisation et des outils supplémentaires potentiels à bas prix. Tout pour votre site web est disponible sur cette plateforme !

This course works best for learners who are based in the North America region. We’re currently working on providing the same experience in other regions.",,,,
Estrutura e Funcionamento das Redes de Computadores,https://www.coursera.org/learn/redes-computadores,Information Technology,Networking,Google Career Certificates,"Este curso foi desenvolvido para apresentar uma visão geral completa das redes de computadores. Falaremos sobre vários aspectos, desde os fundamentos das modernas tecnologias e protocolos de rede, passando por uma visão geral da nuvem, até as aplicações práticas e soluções para problemas de rede. Encerraremos discutindo como essas informações podem aparecer em uma entrevista de emprego e apresentando dicas para solução de problemas práticos.

Até o fim deste curso, você conseguirá:
● descrever as redes de computadores de acordo com o modelo de cinco camadas.
● compreender todos os protocolos padrão usados nas comunicações TCP/IP.
● conhecer poderosas ferramentas e técnicas de resolução de problemas de rede.
● aprender sobre serviços de rede como DNS e DHCP, que ajudam a colocar as redes de computadores em funcionamento.
● entender a computação em nuvem, o tudo como serviço e o armazenamento em nuvem.",9410.0,213485.0,4.8,995.0
Getting Started with IPv6,https://www.coursera.org/learn/ip-address-v6,Information Technology,Networking,Harrison Kong,"In this 1 hour guided project, you will learn about IPv6 (IP address version 6). IPv6 is designed to alleviate the limitations of IPv4. As the last blocks of IPv4 addresses were assigned, the transition of the Internet to IPv6 will certainly accelerate. Get yourself ready for the future! In this guided project, you will learn the fundamentals of IPv6 including prefixes, subnetting and basic setup technique for Windows.",,,,
Getting Started with Junos Operating System,https://www.coursera.org/learn/junos,Information Technology,Networking,Gordon ,"In this course, you will be introduced to the design and architecture of the Junos operating system (Junos OS)—the operating system used on Juniper’s routing, switching, and security portfolio. This course will explore the Junos OS command line interface (CLI) for configuring, managing, and monitoring Junos OS-powered network devices. The J-Web interface will also be examined as the graphical use interface (GUI) option for configuring, managing, and monitoring Junos OS devices. You will then be shown initial system configuration tasks and some basic interface configuration. A brief overview of Juniper hardware and software products will also be provided.",,2433.0,4.8,10.0
Gmail: Getting Started,https://www.coursera.org/learn/googlecloud-gmail-getting-started-mstes,Information Technology,Networking,Google Cloud Training ,"We help millions of organizations empower their employees, serve their customers, and build what’s next for their businesses with innovative technology created in—and for—the cloud. Our products are engineered for security, reliability, and scalability, running the full stack from infrastructure to applications to devices and hardware. Our teams are dedicated to helping customers apply our technologies to create success.",,,,
Hands-On Labs in Google Cloud for Networking Engineers,https://www.coursera.org/learn/hands-on-labs-google-cloud-networking-engineer,Information Technology,Networking,Google Cloud Training,"Networking is a principal theme of cloud computing. It’s the underlying structure of Google Cloud, and it’s what connects all your resources and services to one another. In this series of hands-on labs, completed on Qwiklabs, you will gain additional practice with specialized tools for developing mature networks. 

This course is unlike other courses, in that it consists of one module of background videos, followed by a series of hands-on practice exercises on Google Cloud via Qwiklabs. The practice modules include no videos, lectures, or quizzes - just more practice on real Google Cloud.",3864.0,3768.0,4.8,89.0
How To Build a Network Topology Using GNS3,https://www.coursera.org/learn/how-to-build-a-network-topology-using-gns3,Information Technology,Networking,Moustafa Ashmawy,"In this 1-hour 30-mins long project-based course, you will learn how to build a network topology using GNS3, as well as configuring network devices and troubleshooting them. You’ll also learn how to create subnets and how to secure your network devices.


Note: This course works best for learners who are based in the North America region. We’re currently working on providing the same experience in other regions.",,,4.5,28.0
How to Secure your Network Device using Cisco Packet Tracer,https://www.coursera.org/learn/how-to-secure-your-network-devices,Information Technology,Networking,ahmed elshorafa,"In this 1-hour long project-based course, you will create a network topology using cisco packet tracer. Throughout the project, you will be able to authenticate the switches and  the router in your the network topology,  make PCs from different VLANs communicate with each other, and Finally configure DHCP protocol on the router and be able to protect your switch ports from attackers. This guided project is for people who are interested in getting started in the network security field and for the people interested in computer networking architecture. This guided project will enhance your skills in the network security field as the security field is one of the most promising fields in the next few years.",,,,
How to configure VLAN's using cisco packet tracer,https://www.coursera.org/learn/how-to-configure-vlans-using-cisco-packet-tracer,Information Technology,Networking,Ahmed Elsayed,"In this 1-hour long project-based course, you will learn how to create a network topology using cisco packet tracer. Throughout the project, we will be able to configure Vlan on switches , allow devices from different VLANs to communicate and configure VTP between switches. 


Note: This course works best for learners who are based in the North America region. We’re currently working on providing the same experience in other regions.",,,,
Initiation à Wireshark pour l'analyse de paquets sous linux,https://www.coursera.org/learn/initiation-wireshark-capture-analyse-paquets-trames-reseau-linux,Information Technology,Networking,Viranson HOUNNOUVI,"Ce projet guidé “Initiation à Wireshark pour l'analyse de paquets sous linux” est destiné principalement aux Administrateurs réseaux et Administrateurs Systèmes. Il est aussi destiné à toute personne intéressée par la capture et l’inspection de paquets avec Wireshark.
Dans ce projet guidé d'une heure, vous apprendrez à installer Wireshark sous Linux, capturer des paquets de données avec Wireshark pour les analyser, filtrer les données de paquets et obtenir des statistiques sur les paquets capturés.
Pour parvenir à la réalisation de ce projet guidé, nous avancerons pas à pas sur un ensemble de 7 tâches avec deux exercices pratiques auto-évaluatifs 
Ce projet guidé, totalement présenté en Français, est spécialement conçu avec des explications approfondies sur les différents éléments qui y sont abordés.
Pour profiter au maximum de ce projet guidé qui se déroulera dans un environnement Linux, il vous sera nécessaire d’avoir des connaissances sur les protocoles réseau et le modèle TCP/IP et aussi d’avoir les bases du shell Linux, spécifiquement maîtriser les commandes d’installation et de gestion de paquets logiciels sous Linux",,,,
Intel® Network Academy - Network Transformation 101,https://www.coursera.org/learn/network-transformation-101,Information Technology,Networking,Intel Network Academy ,"Welcome to the Intel® Network Academy – a comprehensive training program on network transformation.  In this program, we will be covering the topic areas of software defined infrastructure (SDI) network functions virtualization (NFV), software-defined networking (SDN) and beyond. The Network Academy includes a broad collection of online content and technical training aimed to assist technical professionals in the network industry to improve their knowledge of key Intel® technologies, industry trends, and technical aspects of NFV deployments.

After completing this training course, please find Network Transformation 102 offered by Intel® Network Academy to advance your technical expertise.",29200.0,18796.0,4.5,471.0
Intel® Network Academy - Network Transformation 102,https://www.coursera.org/learn/network-transformation-102,Information Technology,Networking,Intel Network Academy ,"Welcome to the Intel® Network Academy – a comprehensive training program on network transformation.  In this program, we will be covering the topic areas of software defined infrastructure (SDI) network functions virtualization (NFV), software-defined networking (SDN) and beyond.

Network Transformation 102 covers topics such as VNF Operations & Development, Cryptography, and Hyperscan technology, students will dive into the benefits of Intel hardware and software and explore how to accelerate compute-intensive operations with Intel® QuickAssist Technology (Intel® QAT). 
Students will also have a chance to learn more about open source standards including DPDK and FD.io.",7180.0,4314.0,4.6,126.0
Introducción y creando oráculos en Blockchain,https://www.coursera.org/learn/oraculos-blockchain,Information Technology,Networking,Nestor Nicolas Campos Rojas,"En este proyecto, aprenderás a usar los oráculos para obtener información externa desde los contratos inteligentes.",,,,
Introduction to Networking and Storage,https://www.coursera.org/learn/introduction-to-networking-and-storage,Information Technology,Networking,Skills Network,"Designed for beginners, this course is for anyone new to networking and storage. Develop the skills you need to diagnose and repair basic networking and storage problems. 

This course Is for you if you are kickstarting an IT Support role, network technician role, or building your base knowledge for system administration.

Using videos and virtual, online, hands-on labs, you'll learn about network types, topologies, and models. 

You’ll see how data travels across a network, and discover what protocols and standards are and how they enable all network activity. 

Next, you’ll get familiar with devices and cables and learn how to set up and configure wired and wireless connections 

Then, you’ll learn to diagnose and troubleshoot network connectivity issues, and discover how to use command line utilities and network tools in Windows Settings. 

And finally, you’ll learn to identify different types of storage drives, and find out the features of local, hosted, and cloud storage and when to use each.   

Get the skills you need to keep users connected.",5735.0,46081.0,4.7,110.0
Introduction to Networks and Cisco Devices,https://www.coursera.org/learn/ccna-introduction-networks-cisco-devices,Information Technology,Networking,Mohammed Al M.,"In this 2-hours guided project, you will identify different components such as end devices, intermediary devices, and connection media and simulate network topologies in the Packet Tracer, manage Cisco network devices using telnet, SSH, and Console connections, and secure access to Cisco devices using passwords and password encryption services. 

By the end of this project, you will be able to use the Packet Tracer to create network topologies that are like the one you’re seeing on the screen, connect to network devices using telnet, SSH, and Console, and manage basic security settings on Cisco devices.

This project is one of a kind because it teaches foundational computer network skills to learners from a variety of experience levels using entirely simulated experience. In this project, learners will acquire what they need in simulation environments as if they were working on real devices.",8736.0,,4.6,263.0
Introdução a Mapas de Relação com Kumu,https://www.coursera.org/learn/intro-kumu,Information Technology,Networking,Danilo Oliveira Vaz,"Neste curso de aproximadamente 1 hora, com base em projeto, você aprenderá a criar mapas de relações interativos na plataforma Kumu. Essa jornada de aprendizagem vai desde criar uma conta no Kumu e escolher os templates de mapa mais apropriados às suas necessidades, até adicionar e decorar elementos, conexões e loops. Além disso, várias dicas e truques também são compartilhados ao longo do caminho.

A arte e ciência de criar e comunicar mapas de relações é aplicável a uma ampla gama de áreas, desde design e engenharia de software até consultoria organizacional e construção de comunidades. E este projeto é uma oportunidade acessível para qualquer pessoa adquirir experiência prática nesse assunto. Então, vamos mapear!

Nota: Este curso funciona melhor para aprendizes da região da América do Norte. No momento, estamos trabalhando para proporcionar a mesma experiência em outras regiões.",,,,
Juniper Networks Automation Using Ansible and the REST API,https://www.coursera.org/learn/juniper-automation-ansible-rest-api,Information Technology,Networking,Gordon ,"This  course demonstrates how to automate the Junos OS using DevOps automation tools, protocols, and technologies. This course focuses on using Ansible, and the Junos Representational State Transfer (REST) API to automate Junos platforms.",,,,
