name,url,category,subcategory,instructors,description,enrollment,views,rating,raters
4G : Principes des réseaux mobiles,https://www.coursera.org/learn/4g-principes-des-reseaux-mobiles,Information Technology,Networking,Xavier Lagrange,"Ce MOOC vous expliquera les principes qui ont présidé à la définition de l’architecture des réseaux 4G et les protocoles entre les différents éléments du réseau.

Il comprend 6 séquences de cours réparties sur 6 semaines que l'apprenant peut suivre à son propre rythme. Pour toute question, il peut solliciter l'assistant pédagogique.

Une attestation de suivi avec succès est attribuée par Coursera aux apprenants réussissant à obtenir une note supérieure à 50 %.

Ce MOOC a reçu le soutien financier de la Fondation Patrick & Lina Drahi.",,7630.0,,
4G Network Fundamentals,https://www.coursera.org/learn/4g-network-fundamentals,Information Technology,Networking,Xavier Lagrange,"4G is the cutting-edge network technology that links millions of smartphones to the internet. But how does it actually work?

Ideal for network engineers, sales engineers, application developers, and many other telecoms pros, this course will help you to understand the technology behind the apps and devices we use every day.

You’ll get a solid overview of LTE/EPC (Long Term Evolution / Evolved Packet Core) 4G networks, how they work, how the network architecture is designed, and which protocols are used.

First, you’ll gain exposure to the global architecture of the network, how the radio interface works, and how security is guaranteed. Then you’ll dive into the operational side. What is a bearer? How is it quickly configured and released? How does 4G handle millions of terminals that are on the move all the time?

A certificate of completion is awarded by Coursera to learners who achieve a grade above 50%.

This course has received financial support from the Patrick & Lina Drahi Foundation.",,17999.0,4.6,13.0
5G : Principes de fonctionnement,https://www.coursera.org/learn/5g-principes-de-fonctionnement,Information Technology,Networking,Xavier Lagrange,"Ce MOOC présente les services et l’architecture des réseaux 5G, les évolutions de l’interface radio et de la gestion des flux de données.

Depuis quelques années, les opérateurs déploient la technologie 5G sur les réseaux commerciaux mobiles. Cette dernière est annoncée comme une rupture technologique majeure avec des débits au delà du Gbit/s, de très faibles latences et surtout une diffusion dans de nombreux secteurs d'activités (industrie, transports, médecine, etc.).

Au delà des effets d'annonce, cette technologie s'appuie fortement sur la 4G. La forme d'onde pour la transmission radio est identique, la gestion des flux de données est similaire. La 5G étend cependant notablement les options possibles tant dans les choix d'architectures que dans les configurations d'interface radio ainsi que dans les mécanismes de sécurité.

Une attestation de suivi avec succès est attribuée par Coursera aux apprenants réussissant à obtenir une note supérieure à 50 %.

Ce MOOC a reçu le soutien financier de la Fondation Patrick & Lina Drahi.",,9035.0,,
APIs Explorer: Qwik Start,https://www.coursera.org/learn/googlecloud-apis-explorer-qwik-start-3gtd4,Information Technology,Networking,Google Cloud Training ,"We help millions of organizations empower their employees, serve their customers, and build what’s next for their businesses with innovative technology created in—and for—the cloud. Our products are engineered for security, reliability, and scalability, running the full stack from infrastructure to applications to devices and hardware. Our teams are dedicated to helping customers apply our technologies to create success.",,,,
"Advanced Junos Concepts (Firewall Filters, IPv6, CoS)",https://www.coursera.org/learn/junos-concepts,Information Technology,Networking,Gordon ,"This course will describe some advanced Junos OS concepts such as firewall filters and their use as a means of protecting a device from excessive traffic. An overview of the benefits and purpose of class of service (CoS) will be provided along with the implementation of traffic classification, queuing, and scheduling. Recommended Juniper Networks Technical Assistance Center (JTAC) procedures will be described along with the Juniper tools available online to help manage and support Juniper products. The course will be rounded out with a discussion of Juniper security concepts and components.",,5204.0,,
Analyze Network Traffic with TCPDump,https://www.coursera.org/learn/analyze-network-traffic-with-tcpdump,Information Technology,Networking,Harrison Kong,"In this 1 hour guided project, you will learn how to use one of the most versatile Linux networking utilities tcpdump to capture and analyze TCP traffic. Popular among all ranks of networking professionals, tcpdump will definitely empower you in daily networking operations. Basic network experience and shell script basics are highly recommended as prerequisites.",,,,
Aruba CX Switching for Cisco Professionals,https://www.coursera.org/learn/aruba-cx-switching-for-cisco-professionals,Information Technology,Networking,Aruba Education Services,"The Aruba CX Switching for Cisco Professionals course bridges the gap between Aruba and Cisco switching

technologies by teaching the necessary skills for a Cisco Certified Routing and Switching
Professional to use the Aruba AOS-CX technology. This course consists of approximately
40% lecture and 60% hands-on lab exercises to help you learn how to implement and validate
AOS-CX solutions. Self-directed Labs can be purchased separately on HPE Press. This course prepares already certified Cisco professionals for the Aruba Certified Switching Associate (ACSA) exam.",,2685.0,4.5,11.0
Aruba Mobility Basics,https://www.coursera.org/learn/aruba-mobility-basics,Information Technology,Networking,Aruba Education Services,"In Aruba Mobility Basics, you will learn how Radio Frequency (RF) works! You will compare the differences between a wired and a wireless network, identify WLAN organizations that set Wi-Fi standards and the basics of radio communication. This course introduces you to what goes into setting up a wireless network and how wireless functions at a basic level without requiring any technical experience. Typical candidates for this course are individuals who are new to networking and want to learn the basics of wireless networking.",1581.0,2850.0,4.9,19.0
Aruba Mobility Basics for Portuguese Speakers,https://www.coursera.org/learn/aruba-mobility-basics-portuguese,Information Technology,Networking,"Ricardo Cobos, Aruba Education Services","Em Aruba Mobility Essentials, você aprenderá as diferenças entre uma rede com e sem fio, identificará as organizações WLAN que estabelecem padrões Wi-Fi e as bases da comunicação por rádio. O objetivo deste curso é apresentar a você o que vai na criação de uma rede sem fio e como a rede sem fio funciona em um nível básico, sem exigir qualquer experiência técnica. O curso é dividido em duas partes: 

- A Parte 1 introduz tecnologias sem fio, padrões e conceitos de planejamento. 

- A Parte 2 explica as arquiteturas de redes sem fio, passado, presente e futuro. 

Os candidatos típicos para este curso são indivíduos que são novatos em redes e querem aprender o básico de redes sem fio.",,,,
Aruba Mobility Basics for Spanish Speakers,https://www.coursera.org/learn/aruba-mobility-basics-spanish,Information Technology,Networking,"Aruba Education Services, Ricardo Cobos","En Aruba Mobility Basics, aprenderá las diferencias entre una red cableada y una inalámbrica, identificará las organizaciones WLAN que establecen los estándares Wi-Fi y los fundamentos de la comunicación por radio. El objetivo de este curso es presentarle lo que implica la configuración de una red inalámbrica y cómo funciona la tecnología inalámbrica a un nivel básico sin que sea necesario tener experiencia técnica. El curso se divide en dos partes: 

- La parte 1 presenta las tecnologías inalámbricas, los estándares y los conceptos de planificación. 

- La parte 2 explica las arquitecturas de las redes inalámbricas, el pasado, el presente y el futuro. 

Los candidatos típicos para este curso son las personas que son nuevas en el mundo de las redes y quieren aprender los fundamentos de las redes inalámbricas.",,,,
Aruba Network Automation Basics,https://www.coursera.org/learn/aruba-network-automation-basics,Information Technology,Networking,"Aruba Education Services, Tyler McMinn","Aruba networking technologies are purpose-built with automation in mind to meet the increasing demands on IT’s ability to achieve business outcomes more efficiently. In Aruba Network Automation Basics you'll get an introduction to network automation concepts, key automation tools including Python

and Ansible, and how to apply network automation in practice with Aruba products. This course is great for the networking professionals who want an introduction to the world of coding, scripting, and automation.",,1566.0,,
Aruba Network Security Basics,https://www.coursera.org/learn/aruba-network-security-basics,Information Technology,Networking,Aruba Education Services,"In Aruba Network Security Basics, you will explore what threats pose a risk to a basic computer network and what security technologies are available to harden your devices against these attacks. How do messages get encrypted? What exactly is Malware? What technologies can we deploy that will allow networks to defend themselves? Our lives and business rely on having trusted secure access to our networks, but what does it take to ensure that security? The Aruba Network Security Basics course is a starting point for individuals interested in a career as a security professional, and for anyone to who wants to get familiar with Aruba’s security technologies. To get deeper technical knowledge with Aruba network security, see the Aruba Certified Network Security Associate (ACNSA) here: www.arubanetworks.com/support-services/training-services/certified-network-security-associate/",,3571.0,,
Aruba Networking Basics,https://www.coursera.org/learn/aruba-networking-basics,Information Technology,Networking,"Aruba Education Services, Tyler McMinn","In Aruba Networking Basics, you will learn what a basic computer network is, compare local and wide area networks, use cases, and implementation types. Communication over these networks relies on protocols. Once you learn about those, you will be well on your way to understanding network communications and well prepared to learn VLANs and how to configure an Aruba OS Switch! This course includes a free Hands-On Lab to help you comprehend the concepts. 

Typical candidates for this course are individuals who are new to networking and want to learn the basics of wired networking.",15067.0,8033.0,4.7,241.0
Aruba Networking Basics - Arabic  أساسيات شبكات أروبا,https://www.coursera.org/learn/networking-basics-arabic,Information Technology,Networking,"Ahmad Enaya, Aruba Education Services",في هذه الدورة ستتعلم تعريف شبكات الحاسوب وستستطيع المقارنة بين الشبكات المحلية وشبكات المنطقة الواسعة، وستعرف حالات الاستخدام وأنواع التنفيذ لكل منها. يعتمد الاتصال عبر شبكات الحاسوب على البروتوكولات، بمجرد التعرف على هذه البروتوكولات بشكل جيد ستكون في طريقك لفهم طرق الاتصال في شبكات الحاسوب وستكون مستعدًا بشكل جيد لتعلم الشبكات الافتراضية VLANs وكيفية برمجه و تهيئة محولات الشبكة من نوع Aruba OS-CX Switches. تتضمن هذه الدورة الكثير من التمارين العملية لمساعدتك على فهم المبادئ الأساسية للشبكات.,,2109.0,,
Aruba Networking Basics for Portuguese Speakers,https://www.coursera.org/learn/aruba-networking-basics-portuguese,Information Technology,Networking,"Aruba Education Services, Ricardo Cobos","No Aruba Networking Essentials, você aprenderá o que é uma rede básica de computadores, comparará redes locais e de longa distância, casos de uso e tipos de implementação. A comunicação por meio dessas redes depende de protocolos. Depois de aprender sobre eles, você estará no caminho certo para entender as comunicações de rede e bem preparado para aprender VLANs e como configurar um Switch Aruba OS-CX! Este curso inclui um Laboratório Prático gratuito para ajudá-lo a compreender os conceitos. 

Os candidatos típicos para este curso são indivíduos que são novos em redes e que desejam aprender o básico sobre redes com fio.",,,,
Aruba Networking Basics for Spanish Speakers,https://www.coursera.org/learn/aruba-networking-basics-spanish,Information Technology,Networking,"Aruba Education Services, Ricardo Cobos","En el curso Aruba Networking Basics aprenderá los conceptos de red básica de computadoras, comparará las redes de área local y amplia, examinará casos de uso y tipos de implementación. Las comunicaciones en estas redes dependen de protocolos. ¡Ya que aprenda sobre ellos estará iniciando el camino de entender las comunicaciones de red y estará preparado para aprender sobre VLANs y como configurar un switch Aruba OS-CX! Este curso incluye un laboratorio práctico como auxiliar en la compresión de los conceptos.",,2369.0,,
Automating the Deployment of Networks with Terraform,https://www.coursera.org/learn/googlecloud-automating-the-deployment-of-networks-with-terraform-ukngs,Information Technology,Networking,Google Cloud Training ,"We help millions of organizations empower their employees, serve their customers, and build what’s next for their businesses with innovative technology created in—and for—the cloud. Our products are engineered for security, reliability, and scalability, running the full stack from infrastructure to applications to devices and hardware. Our teams are dedicated to helping customers apply our technologies to create success.",,,,
Become a CBRS Certified Professional Installer by Google,https://www.coursera.org/learn/google-cbrs-cpi-training,Information Technology,Networking,Google,"This six-module program, developed by Google, will train you to be a Certificated Professional Installer (CPI) of radios which utilize the Citizens Broadband Radio Service (CBRS) band to provide communications infrastructure. You can expect to leave this training with the skills you need to get started as a Certified Professional Installer. 

Through a mix of video lectures, step-by-step explanations, and quizzes, the program will introduce you to CBRS terminology and concepts, the role of a CPI, and how to fulfill your responsibilities to determine installation parameters, provide information to the Spectrum Access System (SAS), and troubleshoot. Upon completing the course and passing the online certification exam, you will receive your CPI credentials and your information will be automatically registered with WinnForum.

If you want to learn about CBRS in general, but don’t need to be certified, check out our CBRS Professional Training course <coursera.org/learn/google-cbrs-professional-training>.",2422.0,16774.0,4.6,163.0
Build a Small Simulated Network With Cisco Packet Tracker,https://www.coursera.org/learn/build-a-small-simulated-network,Information Technology,Networking,Hussam El Aassar,"By the end of this project, you will create a small simulated network from scratch using Cisco Packet Tracer. You will be able to identify the basic fundamentals of computer networking and the very basic architecture behind the network devices (Routers and Switches). Moreover, you will learn and practice how to get all these devices and components connected together.  Finally, you will be able to troubleshoot the issues and write some basic commands to get the network fully functioning. The skills gained from this project are very essential in the computer networking field.

Note: This course works best for learners who are based in the North America region. We’re currently working on providing the same experience in other regions.",,,4.5,13.0
Búsqueda avanzada y verificación de información,https://www.coursera.org/learn/busqueda-avanzada-y-verificacion-de-informacion,Information Technology,Networking,MANUEL SANTIAGO AGUILAR GUTIERREZ,"Este curso trata de facilitar una serie de competencias y destrezas necesarias para combatir la desinformación y así afrontar mejor los desafíos que plantea la era digital. Desarrollar unas habilidades esenciales a la hora de buscar información por medio de Internet mediante el uso de herramientas audiovisuales, recursos digitales, aplicaciones y programas, sin olvidar las fuentes humanas directas, para contrastar los materiales que circulan por las redes sociales.",,2194.0,,
CBRS Professional Training,https://www.coursera.org/learn/google-cbrs-professional-training,Information Technology,Networking,Google,"This course, developed by Google, is for installers and network managers who work with Certified Professional Installers. 

Through a mix of video lectures, step-by-step explanations, and quizzes, the program will introduce you to the concept of shared spectrum and the components of the CBRS ecosystem. At the end of this training you will receive a course completion certificate.

If you want to become a Certified Professional Installer, check out the Become a CBRS Certified Professional Installer (CPI Package) course https://www.coursera.org/learn/google-cbrs-cpi-training.",,,,
Cloud-Based Network Design & Management Techniques,https://www.coursera.org/learn/cloud-based-network-design-and-management,Information Technology,Networking,Aruba Education Services,"This 2-part eLearning course builds an understanding of modern cloud-network design and management techniques, crystalizing lofty ideas of ""cloud"" and ""edge"" so you can embrace the latest industry trends and best-practices.

A successful modern network architect requires a keen understanding of business requirements, network components, and the challenges of architecting good solutions. In the 1-hour Aruba Modern Cloud Network Design course you’ll get a high level overview of key network design topics trending in the Edge era. 

The devices we manage constantly evolve as new protocols, security mechanisms, and redundancy solutions emerge; and so the techniques we use to manage these dynamic systems must respond to and even anticipate this changing landscape. In the Modern Cloud Network Management Techniques 1-hour course you’ll learn about key aspects of the network management journey and the newer technologies and techniques to help you embrace the Edge. Learn about the network management challenges that drive new technologies, get familiar with classic Network Management System (NMS) tools, and learn about the modern NMS tools like Aruba ESP developed to reduce overhead, speed diagnosis, and improve situational awareness. 

Typical candidates for this course are IT Professionals and/or Network Engineers who want to learn about Aruba’s modern approach to network design.",,,4.7,10.0
Competencias y recursos básicos para entornos digitales,https://www.coursera.org/learn/competencias-recursos-entornos-digitales,Information Technology,Networking,"Pedro Soler Rojas, Ignacio Navarro Nozal","Este curso está dirigido no solo a profesionales de los los medios de comunicación, sino también a cualquier persona interesada en manejarse con fluidez en el actual entrono digital. Aprenderás habilidades esenciales para utilizar herramientas, programas y aplicaciones  de carácter audiovisual que te facilitarán hacer uso de las redes sociales con seguridad cualquiera que sea tu edad o formación.",,2774.0,,
Configure Dynamic Routing with RIP in Packet Tracer,https://www.coursera.org/learn/configure-dynamic-routing-with-rip-in-packet-tracer,Information Technology,Networking,Priya Jha,"In this 1-hour long project-based course, you will learn how to Design, Create and Configure Network topology using Packet Tracer. You will learn to configure Dynamic Routing using the Routing Information Protocol (RIP v1). You will get an Introduction to Packet Tracer and different components available in Packet Tracer. You will learn to configure your devices both using the Command line and GUI. You will also learn to trace the packets over different networks and you will learn to stimulate your network topology in the simulation mode.

Basics of Networking is recommended.


Note: This course works best for learners who are based in the North America region. We’re currently working on providing the same experience in other regions.",,,,
Configure Standard Access Lists on Cisco Routers,https://www.coursera.org/learn/configure-standard-acl-cisco-routers,Information Technology,Networking,Mohammed Al M.,"Welcome to the CCNA 1.8: Configuring Standard Access Lists (ACLs) on Cisco routers. This project is the eighth in a CCNA learning series that is designed to help you acquire the hands-on skills required to pass the CCNA certification exam. 

In this 2-hour guided project, you will identify the difference between standard inbound and outbound Access Control Lists (ACLs), configure inbound and outbound ACLs on Cisco routers, and setup ACLs to permit exclusive traffic on Cisco routers.",,,,
Configure VLANs on Cisco Switches,https://www.coursera.org/learn/configure-vlans-cisco-switches,Information Technology,Networking,Mohammed Al M.,"Welcome to the CCNA 1.4: Configuring VLANs on Cisco Switches. This project is the fourth in the guided-projects series that is designed to help you acquire the hands-on skills required to pass the CCNA certification exam.

In this 2-hour guided project, you will create virtual LANs on Cisco switches and assign switch ports to them, you set up data and voice VLANS, verify VLANS settings, delete VLANs, and set up VLANs routing.",,,4.9,34.0
Configure and Test Basic Network Connectivity,https://www.coursera.org/learn/configure-test-basic-network-connectivity-ccna-1-2,Information Technology,Networking,Mohammed Al M.,"Welcome to this guided project about Configuring and Testing Basic Network Connectivity
This project is designed for IT security professionals and aspiring network engineers.

To succeed in this project, it’s recommended to have a good background in computer networks.
A Cisco networking academy ID is also required to use the Packet Tracer in this project.

In this project, you will configure and test basic network connectivity by managing configuration on Cisco devices such as IP addresses, virtual interfaces, and DHCP servers and verifying end-to-end network connectivity.

By the end of this project, you will be able to configure small-size computer networks and test their end-to-end connectivity. 

This project is one of a kind because it teaches foundational computer network skills to beginners and professionals alike. Moreover, it is based on an entirely simulated environment where learners can practice as if they have access to real devices.",2576.0,,4.5,60.0
Configure and Verify EIGRP,https://www.coursera.org/learn/configure-verify-eigrp,Information Technology,Networking,Mohammed Al M.,"Welcome to the CCNA 1.7: Configuring and Verifying EIGRP. This project is the seventh in a CCNA learning series that is designed to help you acquire the hands-on skills required to pass the CCNA certification exam.

In this 2-hour guided project, you will configure EIGRP on Cisco routers, troubleshoot EIGRP connectivity, and verify EIGRP routes on Cisco routers.",,,,
Configure and Verify NAT on Cisco routers,https://www.coursera.org/learn/configure-verify-nat-cisco-routers,Information Technology,Networking,Mohammed Al M.,"Welcome to the CCNA 1.9: Configure and Verify NAT on Cisco routers. This project is the ninth in a CCNA learning series that is designed to help you acquire the hands-on skills required to pass the CCNA certification exam. 

In this 2-hour guided project, you will configure static and dynamic Network Address Translation (NAT) on Cisco routers, you will also setup NAT overloading with Port Address Translation (PAT), and verify NAT configuration on Cisco routers.",,,,
Configure and Verify OSPF Operation,https://www.coursera.org/learn/configure-verify-ospf-operation,Information Technology,Networking,Mohammed Al M.,"Welcome to the CCNA 1.6: Configuring and Verifying OSPF operation. This project is the sixth in a CCNA learning series that is designed to help you acquire the hands-on skills required to pass the CCNA certification exam.

In this 2-hour guided project, you will setup OSPF on Cisco routers, configure OSPF router ID and priority to influence OSPF operation, set up unequal path load balancing, and verify OSPF configuration and operation.",,,,
Configure and verify PPP and Frame Relay on Cisco Routers,https://www.coursera.org/learn/configure-verify-ppp-frame-relay-cisco-routers,Information Technology,Networking,Mohammed Al M.,"Welcome to the CCNA 1.10: Configure and Verify PPP and Frame Relay on Cisco Routers, In this guided project, you will configure and verify WAN connections on Cisco routers, you will setup PPP connection and authentication, configure and verify frame-relay, and setup frame-relay sub-interfaces.",,,,
