name,url,category,subcategory,instructors,description,enrollment,views,rating,raters
Academic Discussions in English,https://www.coursera.org/learn/academic-discussion-english,Language Learning,Learning English,"Tamy Chapman, Meg Parker, Helen Nam, Brad Gilpin","This is the third course in the Learn English: Advanced Speaking and Listening specialization. In this class you will learn about different types of conversations you will have in academic settings. You will also learn some strategies for helping you understand other people's meaning and for helping you express yourself effectively. Learners will record several videos of themselves participating in assigned group discussions with their own friends and upload the videos for peer feedback. While this might seem intimidating, it will be a great opportunity for you to practice and improve your discussion skills.

Please note that the free version of this class gives you access to all of the instructional videos and handouts. The peer feedback and quizzes are only available in the paid version.",28096.0,9689.0,4.5,104.0
Academic Listening and Note-Taking,https://www.coursera.org/learn/note-taking,Language Learning,Learning English,"Tamy Chapman, Dana Saito-Stehberger, Brad Gilpin","This course will help non-native English speakers improve their listening and note-taking skills for the purpose of listening to academic lectures. You will learn techniques for improving your understanding and skills for taking more effective notes, and you will get lots of practice in using these. If you're planning to attend college classes in English, then this class is for you.

Upon completing this course, you will be able to:
1.       Understand and follow a lecture
2.       Take better lecture notes
3.       Discuss courses with classmates and professors
4.       Give an effective academic presentation

Please note that the free version of this class gives you access to all of the instructional videos and handouts. The peer feedback and quizzes are only available in the paid version.",111181.0,210811.0,4.5,863.0
Adjectives and Adjective Clauses,https://www.coursera.org/learn/adjective-clauses,Language Learning,Learning English,"Tamy Chapman, Judy Hu, Brad Gilpin","Being able to adeptly use adjective clauses in speaking and writing is useful for upper level English learners. Adjectives and adjective clauses are very common in English, so students need to be able to understand them when they see them or hear them. Students often struggle to bring complexity to their speaking and writing and adjective clauses can be a great way to do this.

Please note that all of the lectures and practice activities are available for free, but taking the quizzes and getting feedback on assignments are only available in the paid version",52504.0,40489.0,4.8,1147.0
Advanced Grammar & Punctuation Project,https://www.coursera.org/learn/advanced-grammar-project,Language Learning,Learning English,"Tamy Chapman, Brad Gilpin","If you have taken the three courses in this specialization, you have learned a lot of grammar in the past few months. This will be a big help to your studies or your career. This project will help you process what you've learned and help you remember it forever. In this course, you will create a grammar portfolio of the difficult or interesting English grammatical structures that you studied in the previous courses. Your portfolio will include several items that you create, such as two scripts that you will write, in which you showcase proper use of grammar points you've learned. You will then record a video performing each script and using the grammar. You can record these two videos alone or with friends. You can be creative and make funny skits like your teachers did in all of the fun videos you watched in this specialization or use your own creative style. The items you create for your portfolio will help you review the material you've learned and will be a memorable project that you can keep with you long after this course ends.

You must be able to create and share videos in order to complete this course.",10188.0,27657.0,4.8,92.0
Advanced Interviewing Techniques,https://www.coursera.org/learn/interview-techniques,Language Learning,Learning English,"Charles Duquette, Daniela C. Wagner-Loera","People interviewing for jobs today often fail because they are using yesterday's strategies. Recruiting technology has become more sophisticated, and the best employers are constantly changing the way interviews are done. This course gives you detailed strategies for handling tough competency-based, or behavioral,  interviews so that you can communicate the knowledge, skills, and abilities that you have and that employers demand.

You will be able to:

1.  Identify what the hiring organization is looking for in using behavioral interviewing techniques.

2.  List the steps in the S.T.A.R. response strategy and apply the steps, using reasonably correct language, to respond to  behavioral interview questions.

3.  Use your responses to behavioral and competency-based questions to communicate your personal values.

4.  Identify what the hiring organization is looking for in asking situational and wild-card interview questions.

5.  List the steps in the P.R.E.P. and 5 W's response strategies and apply the steps, using reasonably correct language, to answer at least one wild-card and two situational interview questions.

6.  Develop an optimal strategy for responding to the weaknesses question, based on recognizing why a hiring organization asks these questions.

7.  Demonstrate your personal strengths and maturity through your responses to the weaknesses question.

8.  Correctly apply hedging language to soften a negative and boosting language to emphasize a positive aspect of your professional and/or academic background.

9.  Ask questions to determine how well an organization fits with your personality, career goals and salary objectives.

10. Ask questions that communicate your competencies and strengths.

11.  Negotiate the best job offer and compensation package for yourself.

12.  Perform successfully on telephone interviews.",37380.0,17408.0,4.7,137.0
Advanced Speaking and Listening Project,https://www.coursera.org/learn/speaking-listening-capstone,Language Learning,Learning English,"Tamy Chapman, Brad Gilpin","Learners will present a well-organized academic speech on a topic in an academic field of the learner's choice. The learner will need to recall all of the skills learned in the previous three courses and complete several steps to complete the project. The learner will choose an academic topic and will then need to do some research, interview a couple of experts in the field, create visual elements, and record a video of the presentation. The presenter will use techniques for preparing and practicing a presentation and demonstrate effective verbal and non-verbal skills. Doing this will help prepare you for presentations in school or work.",6210.0,32418.0,4.9,31.0
Advanced Writing,https://www.coursera.org/learn/advanced-writing,Language Learning,Learning English,"Tamy Chapman, Helen Nam, Brad Gilpin","Course 3: Advanced Writing

This is the third course in the Academic English: Writing specialization.  By raising your level of academic writing, this course helps prepare you for college-level work.

After completing this course, you will be able to: 
 - plan and write a more sophisticated argument essay
 - identify plagiarism and explain how to prevent it
 - read and analyze several articles to form your own opinion on a topic
 - make connections between several articles
 - form thesis statements from your readings
 - use sources effectively when writing an essay

Please note that the free version of this class gives you access to all of the instructional videos and handouts. The peer feedback and quizzes are only available in the paid version.",196154.0,176313.0,4.7,1786.0
American Deaf Culture,https://www.coursera.org/learn/deaf-culture,Language Learning,Learning English,Terrell Brittain,This is a six-week course providing a historical overview of the American Deaf community and its evolving culture.  Theoretical frameworks from sociology are explored.  Deafness as a culture and not a disability is explained as participants are guided into the world of Deaf culture.,11027.0,11449.0,4.5,317.0
Better Business Writing in English,https://www.coursera.org/learn/business-writing-english,Language Learning,Learning English,Amalia B. Stephens,"Do you need to write more easily and effectively in English? This course will provide the tools to help you do just that. You will develop your personal voice in your writing. You will develop strategies to plan and produce clear, understandable text. You will learn and practice specific writing skills to use in different types of business communications including cover letters, mission and vision statements, proposals , instructions and reports. You will organize, design and write clear text for Power Point Productions. Writing skills include how to choose correct noun and noun modifiers; how to choose correct verb forms and tenses; how to write a variety of clauses and sentences.

As you work through the course, you will complete self- and peer-evaluations. Many of the peer assignments will have 2 or more options so that you can choose the best path depending on your current situation. Through a combination of lectures, quizzes, supplementary resources, practice and performance, you’ll gain the skills and confidence to write well in English for your business and professional purposes.",79256.0,26695.0,4.7,479.0
Big data and Language 1,https://www.coursera.org/learn/big-data-language-1,Language Learning,Learning English,Seonmin Park,"In this course, students will understand characteristics of language through big data. Students will learn how to collect and analyze big data, and find linguistic features from the data. A number of approaches to the linguistic analysis of written and spoken texts will be discussed.

The class will consist of lecture videos which are approximately 1 hour and a quiz for each week. There will be a final project which requires students to conduct research on text data and language.",6315.0,4352.0,4.5,111.0
Big data and Language 2,https://www.coursera.org/learn/big-data-language-2,Language Learning,Learning English,Seonmin Park,"In this course, students will understand characteristics of language through big data. Students will learn how to collect and analyze big data, and find linguistic features from the data. A number of approaches to the linguistic analysis of written and spoken texts will be discussed.",2802.0,1989.0,,
Blended Language Learning: Design and Practice for Teachers,https://www.coursera.org/learn/blended-language-learning-design-practice-for-teachers,Language Learning,Learning English,Edwige Simon,"This course is for language educators who wish to learn how to build and teach a blended language course. You may receive 1.5 Graduate Teacher Education credits (GRTE) for completing this course. See below for more information. 

This course is divided into four modules. 

In the first module we are going to discuss the origins and effectiveness of the blended learning model.

In the second module, we are going to look at course level considerations such as how to choose a blended format or how to build a blended course syllabus. 

In the third module, we are going to focus on the unit level. We are going to discuss how to plan a blended unit, how to go about presenting content, designing blended activities and assessment strategies.

In the fourth module, we're going to turn our attention to the teaching aspect of the blended learning experience. 
At the end of the course, you have the option to put what you have learned into practice through an optional peer-reviewed assignment (Honors lesson). This assignment is not required to complete the course unless you wish to obtain Graduate Teacher Credits (GRTE). 

This course includes short quizzes, discussion questions, and an optional scaffolded peer-reviewed assignment.  If you complete all the assignments, at the end of this course you will have fairly fleshed out a blended unit and you will be well on your way to building your own blended language course. 

Upon completion of this course, students will be able to:

Explain blended learning as a teaching modality and discuss its effectiveness
List and discuss the main instructional design steps involved in building a blended language course
Select tools and technologies to support blended language learning
Discuss effective blended teaching strategies

GRTE credits: Credits earned for GRTE courses are not applicable toward a degree program offered at the University of Colorado Boulder but may be used for teacher professional enhancement, including relicensure and school district salary advancement. You may receive 1.5 GRTE credits for completing this course ($225). The form is provided at the end module 5.",10301.0,6192.0,4.8,237.0
Build Your Professional ePortfolio in English,https://www.coursera.org/learn/eportfolio-english,Language Learning,Learning English,Karen Peterson,"Roughly half of the world’s population is already online and so setting yourself apart from the crowd is more important than ever before.  One of the best ways to do that is by creating your own ePortfolio.  An ePortfolio is a site that showcases or shows your background, your resume, and samples of your work.  In this course, you will learn step by step how to build the site and you’ll learn the grammar, vocabulary and writing skills needed to create it.  You will learn how to apply information from your ePortfolio to other online tools like LinkedIn, Twitter, Instagram and YouTube in order to network with others so that you get a job or connect with other professionals.  For each step in that process, you will listen to lectures, take comprehension quizzes, and learn how to use English appropriately to each part of your site.  You will also complete self and peer assessments and gain the needed skills to make your ePortfolio a reality and establish yourself online.

By the end of this course, you will be able to 
•	Write a proper headline or title for your ePortfolio
•	Describe your work in 1 sentence and in longer forms
•	Identify how to use hashtags effectively
•	Write an effective summary about yourself and your work
•	Apply appropriate vocabulary to write your education and professional experience for your resume 
•	Understand how to write a tweet to get a job 
•	Discover how to write specific comments and network work with others 
•	Apply what you have on your portfolio to other tools like Instagram, Twitter, LinkedIn or YouTube.",92468.0,93257.0,4.7,1515.0
Business Case Analysis,https://www.coursera.org/learn/business-case-analysis,Language Learning,Learning English,"Kin Tang, Delian Gaskell, Sean McMinn","The Capstone project is the culmination of your journey through the Business English for Non-Native Speakers specialization. It is aimed at applying the written and spoken skills that you have gained to an authentic business situation. You will be able to choose a business case provided by HKUST, or use an example from your own work experience and: 

(1) prepare an online video presentation (approx. ½ hour) that analyses the case and provides recommendations, and

(2) prepare a business recommendation report to coincide with the presentation (approx. 2,000 words). The report should include an executive summary, analyses of the case and recommendations.",5903.0,2414.0,4.6,24.0
Business English for Cross-cultural Communication,https://www.coursera.org/learn/cross-cultural-communication-business,Language Learning,Learning English,"Kin Tang, Delian Gaskell, Sean McMinn","This course aims to prepare you for working in an cross-cultural Business setting. We'll learn about common cross-cultural theories and how they are relevant to everyday business practices in a globalised world. By combining all of your vocabulary, reading, speaking, and writing skills that you acquired in the previous three courses, you will learn how language plays an important role in cross-cultural communication. You will also enhance your cross-cultural understanding and will be able to use vocabulary, tone and style, and spoken and written communication skills within a cross-cultural Business context. Skills learned in this course help prepare you to deliver the professional business presentation in the Capstone project.

After completing this course, you will be able to:

- identify possible cross-cultural issues and misunderstandings in communication
- apply strategies to overcome possible cross-cultural issues and misunderstandings in communication
- produce documents with an appropriate style for business communication purposes within a cross-cultural situation
- deliver a speech with an appropriate style for business communication purposes within a cross-cultural situation",26999.0,10662.0,4.7,366.0
Business English: Basics,https://www.coursera.org/learn/business-english,Language Learning,Learning English,"Kin Tang, Delian Gaskell, Sean McMinn","This course aims to improve your Business English language skills by developing your vocabulary and reading skills and your understanding of tone, style and knowledge of communication methods. We'll also cover how these language skills can enhance audience analysis, business case analysis and basic business communication strategies. Skills learned in this course will often be referred to and needed to complete the speaking, writing and cross-cultural communications courses of this Specialization.

After completing this course, you will be able to:

- describe things and events in the context of Business English
- make requests in the context of Business English
- support arguments in the context of Business English
- use appropriate tone and style according to the context of Business English
- conduct an audience analysis
- match audience with the purpose and medium of communication
- analyse and summarise business data",114504.0,77760.0,4.5,1063.0
Business English: Capstone Project,https://www.coursera.org/learn/business-english-capstone,Language Learning,Learning English,Richard Moore,"The capstone project will give you opportunities to demonstrate your competence in the learning objectives for this Specialization. For the project, you’ll use formal, written methods and more casual visual and audio methods of communication to demonstrate your ability to use language appropriate for different business contexts. The goal of this course is to demonstrate competence in writing and presenting a plan using skills and language appropriate for business.

Course Learning Objectives
•	Use appropriate vocabulary to write a mini business plan
•	Communicate a business plan orally in an organized and engaging presentation",10586.0,9540.0,4.8,138.0
Business English: Final Project,https://www.coursera.org/learn/english-for-business-project,Language Learning,Learning English,"Andrea Mürau Haraway, Wanda Huber, Jenny Young","A common necessity among business professionals who are new to an international work environment is the ability to create a plan of action to launch a new product. In this task, one has to communicate with many different departments within a company including finance and marketing. In this capstone project, you will create a plan of action to launch a new product. This plan will include:

·      A project status report
·      A copy of the marketing campaign
·      A basic budget analysis for the project
·      A short presentation for upper management with details on the project’s status
 
This project will give you the opportunity to apply your English skills learned in the courses to develop a useful document for your current job or a document that you could use as an example to demonstrate your new abilities and skills.",6354.0,3072.0,4.8,26.0
Business English: Finance and Economics,https://www.coursera.org/learn/finance-economics-english,Language Learning,Learning English,"Andrea Mürau Haraway, Wanda Huber, Jenny Young, Beatriz Fuentes-Anderson","Do you work in finance or interact with finance professionals? Is it necessary to speak, write or understand English in your career? Follow the authentic characters in this course as they work through common business situations in finance and economics. Learn from your successes and failure, and think critically about your own communication options. After taking this course, you will be able to read and create efficient e-mails, reports, and impactful presentations with words and phrases commonly used in finance and economics. Communicate clearly under pressure utilizing recently learned strategies, and obtain immediate feedback about the efficiency of your business communication skills in English from other finance professionals around the world! Gain the English communication skills that you desire and that global managers expect.",33606.0,16184.0,4.7,579.0
Business English: Making Presentations,https://www.coursera.org/learn/business-english-presentations,Language Learning,Learning English,Richard Moore,"This course teaches you language and techniques that will help you make effective presentations in English. The final task is to develop a well-organized, persuasive presentation using charts and graphs that sells your city as a venue.

The course focuses on students who have an intermediate level of English, with a minimum of two years of formal language study.

Course Learning Objectives

•	Present information in an organized and engaging way
•	Share data in charts and graphs
•	Use persuasive language in a presentation",68515.0,34429.0,4.8,666.0
Business English: Management and Leadership,https://www.coursera.org/learn/management-leadership-english,Language Learning,Learning English,"Wanda Huber, Andrea Mürau Haraway, Jenny Young","Are you a business executive or a manager who uses English in your career? Then you know that good business communication in English requires focus, vocabulary, and specific linguistic structures. In this course, you will follow along a recently promoted manager as she builds and leads her team to success. Together, you will practice the language and styles of communication  needed in English for

•	Recruiting and training a professional team to work together with integrity and respect
•	Managing and participating in well-organized meetings
•	Making telephone conferences more efficient
•	Writing professional emails that are easy to read
The activities in this course will give you the opportunity to share your experience and receive immediate feedback from other business professionals around the world.",61954.0,51230.0,4.8,1307.0
Business English: Marketing and Sales,https://www.coursera.org/learn/marketing-sales-english,Language Learning,Learning English,"Andrea Mürau Haraway, Wanda Huber, Jenny Young, Beatriz Fuentes-Anderson","If you work in marketing, sales, or advertising, you already know that effective communication is a requirement. This can be even more difficult when expressing your ideas in a persuasive manner in English.  In this course, you will learn to use English more efficiently while joining successful global professionals around the world. Develop your skills along with authentic characters that work in marketing and also work hard to improve their communication skills. Learn from your successes and failures, reflect on your own style, strengths, and improvement areas. After taking this course, you will be able to:

·      Express your ideas through efficient emails, reports and persuasive presentations
·      Learn words and phrases related to market research, branding, direct marketing, advertising costs, etc.
·      Get instant feedback about the efficiency of your business communication skills in English from sales and marketing professionals from around the world
·      Become part of a global community of business professionals who are developing their English communication skills",41578.0,15041.0,4.7,643.0
Business English: Meetings,https://www.coursera.org/learn/business-english-meetings,Language Learning,Learning English,Richard Moore,"This course will teach you vocabulary and skills related to participating in meetings. You will learn terms and phrases used both in email and in speaking to arrange, participate in, and conclude meetings. The goals of this course are to enable you to participate effectively in on-site meetings and teleconferences and to prepare you to write a proposal as an outcome of a meeting.

Course Learning Objectives

•	Arrange a meeting though email and by telephone 
•	List expectations and protocols related to on-site meetings and teleconferences
•	State phone numbers, dates, currencies and sales figures accurately 
•	Write a proposal with appropriate organization and vocabulary",82721.0,67947.0,4.8,895.0
