name,url,category,subcategory,instructors,description,enrollment,views,rating,raters
Introduction to Household Water Treatment and Safe Storage,https://www.coursera.org/learn/water-treatment,Physical Science and Engineering,Environmental Science and Sustainability,"Rick Johnston, Sara Marks","It is well known that water treatment at the household level can lead to dramatic improvements in drinking water quality. But does Household Water Treatment and Safe Storage (HWTS) also have global relevance? What are the potential treatment solutions and how do they function? Is there a standard strategy for successful HWTS implementation, or can we identify key components which make programs more likely to succeed? 

In this course you will learn about the most important water treatment methods at household level, successful implementation strategies and about assessing the impact of HWTS.

MOOC SERIES “SANITATION, WATER AND SOLID WASTE FOR DEVELOPMENT” : This course is one of four in the series “Sanitation, Water and Solid Waste for Development"".

FRANçAIS: Dans ce MOOC, vous allez apprendre les plus importantes méthodes de traitement de l'eau au niveau des ménages, les stratégies pour une mise en œuvre réussie et l’évaluation de l’impact du traitement et stockage sûr de l'eau à domicile. 

ESPAñOL: Aprende acerca de los métodos más importantes de tratamiento de agua a nivel domiciliario, de estrategias de implementación eficientes y de la evaluación del impacto del tratamiento doméstico y almacenamiento seguro del agua.",21948.0,12932.0,4.8,936.0
Introduction to Public Health Engineering in Humanitarian Contexts,https://www.coursera.org/learn/engineering-humanitarian,Physical Science and Engineering,Environmental Science and Sustainability,"Christoph Lüthi, Javier Cordoba","The world is facing unprecedented humanitarian needs. Today’s humanitarian crisis tend to be greater in number, often in urban settings, longer in duration and broader in regional impact. They generate human sufferings on a greater scale, disrupt essential services, such as water supply or sanitation and put health of large population at risk. Engineers and technical specialists in water, sanitation, energy, environment, and in other related fields play a vital role to respond to these challenges and growing needs. In the humanitarian sector, they are called the public health engineers and today they are increasingly needed! Why public health engineering matters so much in humanitarian crises? And how its related activities are carrying out in such complex environment? This is what this MOOC is all about!

The EPFL, EAWAG-SANDEC and ICRC have decided to partner to guide you through this introduction to the fascinating field of public health engineering in humanitarian contexts.",9521.0,15046.0,4.8,327.0
Introduction to Sustainability,https://www.coursera.org/learn/sustainability,Physical Science and Engineering,Environmental Science and Sustainability,Dr. Jonathan Tomkin,"This course introduces the academic approach of Sustainability and explores how today’s human societies can endure in the face of global change, ecosystem degradation and resource limitations. The course focuses on key knowledge areas of sustainability theory and practice, including population, ecosystems, global change, energy, agriculture, water, environmental economics and policy, ethics, and cultural history.

This subject is of vital importance, seeking as it does to uncover the principles of the long-term welfare of all the peoples of the planet. As sustainability is a cross-disciplinary field of study, this foundation requires intellectual breadth: as I describe it in the class text, understanding our motivations requires the humanities, measuring the challenges of sustainability requires knowledge of the sciences (both natural and social), and building solutions requires technical insight into systems (such as provided by engineering, planning, and management).",131155.0,86436.0,4.8,2388.0
Introduction to solar cells,https://www.coursera.org/learn/solar-cells,Physical Science and Engineering,Environmental Science and Sustainability,"Morten Vesterager Madsen, Anders Skovbo Gertsen ","How do solar cells work, why do we need, and how can we measure their efficiency? These are just some of the questions Introduction to solar cells tackles. Whether you are looking for general insight in this green technology or your ambition is to pursue a career in solar, “Introduction to Solar Cells” is an excellent starting point.

The course is a tour through the fundamental disciplines including solar cell history, why we need solar energy, how solar cells produce power, and how they work. During the course we cover mono- and multi-crystalline solar cells, thin film solar cells, and new emerging technologies. The course includes hands-on exercises using virtual instruments, interviews with field experts, and a comprehensive collection of material on solar cells.

At the end of the course you will have gained a fundamental understanding of the field. This will allow you to identify the most interesting or relevant aspects to be pursued in your future studies or in your professional career.",56980.0,39732.0,4.8,2331.0
Introduction to the Arctic: Climate,https://www.coursera.org/learn/arctic-introduction-climate,Physical Science and Engineering,Environmental Science and Sustainability,"Paul Myers, Ph.D","The University of Alberta, the University of Tromso and the University of the Arctic invite you to explore this four week course that examines the environment and climate of the circumpolar North. This course is the result of an international collaboration and provides you with an insight into our planet's North. Following an overview of regional geography, we will focus on the cryosphere (ice), as well as the atmosphere and ocean of the region. We will learn why the Arctic is cold and ice covered, and how that impacts its climate and ecosystems. We will also consider how the Arctic is connected to the rest of the world. Finally, we will examine present day climate change, the processes driving it, and evidence for it in the Arctic, before looking at the implications in the rapidly evolving North. Watch a preview of the course here: https://uofa.ualberta.ca/courses/arctic-climate",14769.0,5936.0,4.6,455.0
Journey Conversations: Weaving Knowledge and Action,https://www.coursera.org/learn/journey-knowledge-action,Physical Science and Engineering,Environmental Science and Sustainability,"John Grim, Mary Evelyn Tucker","Journey of the Universe weaves together the discoveries of the evolutionary sciences together with humanities such as history, philosophy, art, and religion.  This course draws on the Journey of the Universe Conversations, a series of 20 interviews with scientists and environmentalists. The first 10 interviews are with scientists and historians who deepen our understanding of the evolutionary process of universe, Earth, and humans. The second 10 interviews are with environmentalists, teachers, and artists who explore the connections between the universe story and the practices for a flourishing Earth community.",6681.0,3148.0,4.8,154.0
Las estaciones del año y el clima,https://www.coursera.org/learn/estaciones-clima,Physical Science and Engineering,Environmental Science and Sustainability,"Alejandro Aguilar Sierra, Rene Garduño López","¿Sabes por qué hay animales que migran cada año? ¿Cómo saben los campesinos cuándo sembrar y cuándo cosechar?

¿Sabes qué gobierna el ciclo anual de frío y calor y de lluvias y secas?

Las estaciones del año son el fenómeno climático más perceptible por el ser humano y se manifiestan de diferente forma en distintas regiones; por ejemplo cuando es invierno en la mitad del mundo,  es verano en la otra mitad.  Entender el mecanismo de las estaciones es el primer paso para entender el clima, que afecta a casi todas las actividades humanas.

En este curso estudiaremos los procesos que provocan las estaciones del año, las repercusiones que tienen éstas para las actividades humanas y su relación con los  fundamentos del sistema climático terrestre. A través de simulaciones visuales haremos comprensibles conceptos y procesos físicos y te propondremos experimentos. Si estas considerando estudiar ciencias de la Tierra o si quieres comprender mejor cómo funciona el clima, este curso es para ti. 

¡Acompáñanos! Y conoce más sobre nuestro hogar el planeta Tierra.",21010.0,4932.0,4.8,372.0
Mobilités et véhicules électriques,https://www.coursera.org/learn/mobilites-vehicules-electriques,Physical Science and Engineering,Environmental Science and Sustainability,"Virginie BOUTUEIL, Émeric FORTIN","L’objectif de ce MOOC est d’aider ses apprenants, quel que soit leur profil, leur formation ou leur pays d’origine, à construire une réponse personnelle à des questions comme celles-ci : 

- Les voitures électriques seront-elles les dernières à circuler dans les métropoles du XXI° siècle ? 
- Le gain environnemental associé à l’électrification des véhicules justifie-t-il des investissements massifs dans les infrastructures de charge ? 
- Le véhicule électrique est-il réservé aux riches des pays du Nord ?

Grâce à ce MOOC, les participants pourront acquérir des connaissances issues des sciences de l’ingénieur, de la sociologie, des sciences de l’environnement, de l’économie, de la géographie et des sciences politiques pour évaluer, analyser et mettre en œuvre le déploiement des véhicules électriques là où il est pertinent.

Le Groupe Renault et les écoles de ParisTech collaborent depuis bientôt 15 ans sur des sujets liés à la mobilité durable. Ensemble, ils ont créé deux Masters (Transport et développement durable en 2004, Mobilité et véhicules électriques en 2010) et l’Institut de la Mobilité Durable (IMD), en 2009, pour accompagner les mutations en cours. Le MOOC Mobilités et véhicules électriques est issu de cette histoire commune et a été élaboré à partir d'un cours délivré au sein du Master Mobilités et Véhicules Électriques, piloté par Arts et Métiers ParisTech en partenariat avec Ensta ParisTech, Mines ParisTech et l’École des Ponts ParisTech.

Ce cours est en français, cependant des sous-titres en anglais sont disponibles pour toutes les vidéos et vous pouvez écrire vos messages dans le forum en anglais si vous le désirez./ This course is given in French, nevertheless English subtitles are available for all videos and you can write your posts in the forum in English if desired.",4818.0,6508.0,4.7,99.0
Modelo de Ecossistema com Insight Maker,https://www.coursera.org/learn/ecossistema-insightmaker,Physical Science and Engineering,Environmental Science and Sustainability,Danilo Oliveira Vaz,"Neste curso baseado em projeto de 1 hora de duração, você criará um modelo que simula a dinâmica de três populações de espécies diferentes em um ambiente: formigas, tamanduás-bandeira e lobos-guará.

Durante a criação de tal modelo você será apresentado ao Insight Maker, um ambiente de simulação online gratuito que permite diferentes tipos de modelagem como modelagem de sistemas dinâmicos e  baseada em agente. E tal experiência irá equipá-lo com tudo o que você precisa saber para construir modelos e simulações para diferentes situações e cenários.

Nota: Este curso funciona melhor para aprendizes da região da América do Norte. No momento, estamos trabalhando para proporcionar a mesma experiência em outras regiões.",,,,
Mountains 101,https://www.coursera.org/learn/mountains-101,Physical Science and Engineering,Environmental Science and Sustainability,"Zac Robinson, David Hik","Mountains 101­­ is a broad and integrated overview of the mountain world. This 12-lesson course covers an interdisciplinary field of study focusing on the physical, biological, and human dimensions of mountain places in Alberta, Canada, and around the world. Specifically, we'll study the geological origins of mountains, how they’re built-up and worn-down over time; we’ll learn about their importance for biodiversity and water cycles, globally and locally; we’ll explore their cultural significance to societies around the globe, and how that relationship has evolved over time; and we’ll learn how mountains are used, how they’re protected, and how today they’re experiencing rapid change in a warming climate. 

At the end of each lesson, Mountains 101 will also provide learners with some smart tricks -- Tech Tips -- to safely enjoy time in the high alpine environment: from how to pick the best footwear for hiking to making smart decisions in avalanche terrain. 

We’ll be delivering your online lessons from valley bottoms to mountaintops, from museums and labs, to alpine huts and other spectacular alpine sites, and we’ll do so with the help of a whole host of experts.
 
We invite you to join us for this online adventure! The mountains are calling...",70383.0,44376.0,4.9,2389.0
Municipal Solid Waste Management in Developing Countries,https://www.coursera.org/learn/solid-waste-management,Physical Science and Engineering,Environmental Science and Sustainability,"Dr. Christian Zurbrügg, Imanol Zabaleta, Félix Schmidt","Have you come across large piles of garbage in neighbourhoods and streets and smelly waste disposal sites polluting the environment of low- and middle-income countries? Do you want to know what kind of sustainable solutions are appropriate to better manage waste and enhance recycling and recovery? If yes, this course is for you! 

This course provides you with an overview of the municipal solid waste management situation in low- and middle-income countries. It covers key elements of the waste management system, such as its technical, environmental, social, financial and institutional aspects. Besides understanding the challenges, you will be introduced to appropriate and already applied solutions through selected case studies.",85091.0,41569.0,4.8,3166.0
Mycelium Growth with NetLogo Web,https://www.coursera.org/learn/mycelium,Physical Science and Engineering,Environmental Science and Sustainability,Danilo Oliveira Vaz,"Underneath our feet, spreading across the globe, a magnificent being resides. As a living network, it breaks down compounds from minerals and dead plants and animals in the soil (and pollutants as well), only to distribute these nutrients to other living organisms. Therefore, providing the cyclical nature characteristic of Nature. When conditions are right, some of these organisms will fruit into beautiful mushrooms, some of which are incredibly nutritious and with miraculous medicinal properties. The organism described is the Mycelium, or the vegetative part of a fungus organism.

In this project we will create an agent based model that simulates possible mechanisms through which fungi mycelium grows, as observed through microscopic lenses. For that we will be working with NetLogo Web, a very powerful online modeling environment. Learns will be introduced to this environment, as well as the basics of the Logo programming language.

Note: This project works best for learners who are based in the North America region. We’re currently working on providing the same experience in other regions.",2051.0,,4.4,35.0
"Natural Attenuation of Groundwater Contaminants: New Paradigms, Technologies, and Applications",https://www.coursera.org/learn/natural-attenuation-of-groundwater-contaminants,Physical Science and Engineering,Environmental Science and Sustainability,"Pedro Alvarez, Charles Newell, David Adamson          ","Cleaning up the large number of groundwater contamination sites is a significant and complex environmental challenge.  The environmental industry is continuously looking for remediation methods that are both effective and cost-efficient. Over the past 10 years there have been amazing, important developments in our understanding of key attenuation processes and technologies for evaluating natural attenuation processes, and a changing institutional perspective on when and where Monitored Natural Attenuation (MNA) may be applied.  Despite these advances, restoring groundwater contaminated by anthropogenic sources to allow for unrestricted use continues to be a challenge. Because of a complex mix of physical, chemical, and biological constraints associated with active in-situ cleanup technologies, there has been a long standing focus on understanding natural processes that attenuate groundwater contaminant plumes.

We will build upon basic environmental science and environmental engineering principles to discover how to best implement MNA as a viable treatment for groundwater contamination plumes.  Additionally we will delve into the history behind and make predictions about the new directions for this technology.  

Any professional working in the environmental remediation industry will benefit from this in-depth study of MNA.  We will use lectures, readings, and computational exercises to enhance our understanding and implementation of MNA.  At the completion of this course, students will have updated understanding and practical tools that can be applied to all possible MNA sites.",15586.0,8179.0,4.8,481.0
Oceanografía: una clave para entender mejor nuestro mundo,https://www.coursera.org/learn/oceanografia,Physical Science and Engineering,Environmental Science and Sustainability,"Jordi Salat, Jordi Serra ","En este curso, el estudiante aprenderá las bases de la ciencia oceanográfica. Cómo se clasifica y se ha formado el fondo marino, cómo funcionan los actuales sistemas de análisis del mar por satélite, la química del océano y los procesos que han llevado a su formación.

Este curso enfoca la meteorología y climatología oceánicas desde la perspectiva de los conocimientos básicos que necesitan los navegantes para participar en una regata como la Barcelona World Race, la única una vuelta al mundo sin escalas con dos tripulantes.",18218.0,5013.0,4.7,327.0
Oceanography: a key to better understand our world,https://www.coursera.org/learn/oceanography,Physical Science and Engineering,Environmental Science and Sustainability,Jordi Serra ,"The course for a round the world regatta leads the boats through the Mediterranean Sea and the Atlantic, Southern Indian and South Pacific Oceans. On their voyage, the skippers come across a large variety of oceanographic situations: strong currents, floating ice, wave formations of every kind and biological diversity.

In this course the student will learn about the foundations of the science of oceanography. You'll learn about the classification and formation of the ocean floor, how current sea satellite analysis systems work, the chemistry of the oceans and the processes that led to its formation.



To follow this course does not require previous knowledge of oceanography.",21453.0,15844.0,4.5,229.0
Oil & Gas Industry Operations and Markets,https://www.coursera.org/learn/oilandgas,Physical Science and Engineering,Environmental Science and Sustainability,Lincoln Pratson,"The oil and gas industry has an enormous impact on all aspects of daily life. Individuals, corporations, and national governments make financial and policy decisions based on the cost, use, and availability of these two natural resources. This two-week course looks at the two most fundamental aspects of the oil and gas industry, its operations and markets, each of which is addressed as a separate module in the course. In the operations module, the course provides an overview of the production of oil and gas, from initial exploration to final transport. The second module focuses on the forces that drive the industry's operations, the oil and gas markets, including the cost of wells, seasonal impacts on prices, and the role of oil reserves. After every lesson, learners will take short quizzes to test their newly acquired knowledge, participant in crowd-sourced discussions about global markets, and complete a final project.",113499.0,76742.0,4.8,5292.0
Our Earth's Future,https://www.coursera.org/learn/earth-climate-change,Physical Science and Engineering,Environmental Science and Sustainability,"Debra Tillinger, Ph.D.","Our Earth’s Future is about the science of climate change and how to talk about it. You will learn from scientists in the fields of climatology, oceanography, Earth science, and anthropology who study how climate change is affecting people, populations, and ways of life. Explore the multiple lines of evidence for the human-induced climate change that is happening today, and consider what that means for the future of our planet. At the end of this course you will be able to understand key scientific principles, identify and address misconceptions, and contribute confidently to conversations about climate change.",33517.0,9199.0,4.7,726.0
"Our Earth: Its Climate, History, and Processes",https://www.coursera.org/learn/our-earth,Physical Science and Engineering,Environmental Science and Sustainability,"Prof. David M. Schultz, Dr Rochelle Taylor, Dr Jonathan Fairman","Develop a greater appreciation for how the air, water, land, and life formed and have interacted over the last 4.5 billion years.",18852.0,15690.0,4.7,289.0
Our Energy Future,https://www.coursera.org/learn/future-of-energy,Physical Science and Engineering,Environmental Science and Sustainability,Dr. Stephen Mayfield,"This course is designed to introduce students to the issues of energy in the 21st century – including food and fuels – which are inseparably linked – and will discuss energy production and utilization from the biology, engineering, economics, climate science, and social science perspectives. 

This course will cover the current production and utilization of energy, as well as the consequences of this use, examining finite fossil energy reserves, how food and energy are linked, impacts on the environment and climate, and the social and economic impacts of our present energy and food production and use. After the introductory lectures, we will examine the emerging field of sustainable energy, fuel and food production, emphasizing the importance of developing energy efficient and sustainable methods of production, and how these new technologies can contribute to replacing the diminishing supplies of fossil fuels, and reduce the consequences of carbon dioxide release into the environment. This course will also cover the importance of creating a sustainable energy future for all societies including those of the developing world.  Lectures will be prepared and delivered by leading UC San Diego and Scripps Institution of Oceanography faculty and industry professionals across these areas of expertise.",63361.0,24936.0,4.7,1111.0
Photovoltaic Systems,https://www.coursera.org/learn/photovoltaic-systems,Physical Science and Engineering,Environmental Science and Sustainability,"Rasmus Nielsen, Sune Thorsteinsson","This course offers you advanced knowledge within the field of photovoltaic system technology. We'll learn about the solar resource and how photovoltaic energy conversion is used to produce electric power. From this fundamental starting point we'll cover the design and fabrication of different solar cell and module technologies, the various photovoltaic system components, how to design a photovoltaic plant and carry out energy yield simulations, essentials in energy economics, O&M and reliability assessment, as well as the role of photovoltaic energy in sustainable energy systems.

This course is unique in that it takes you from the nanoscale physics of a solar cell to the modelling of a utility scale solar farm. The course is made up of 9 sections with an estimated workload of 2-3 hours each. The academic level is targeted at master students at technical universities and engineers from the energy industry. Passing this course offers you a great basis for a career in the field of photovoltaics.",6262.0,18512.0,4.6,89.0
Planet Earth...and You!,https://www.coursera.org/learn/planet-earth,Physical Science and Engineering,Environmental Science and Sustainability,"Dr. Stephen Marshak, Dr. Eileen Herrstrom","Earthquakes, volcanoes, mountain building, ice ages, landslides, floods, life evolution, plate motions—all of these phenomena have interacted over the vast expanses of deep time to sculpt the dynamic planet that we live on today.  Planet Earth presents an overview of several aspects of our home, from a geological perspective.  We begin with earthquakes—what they are, what causes them, what effects they have, and what we can do about them. We will emphasize that plate tectonics—the grand unifying theory of geology—explains how the map of our planet's surface has changed radically over geologic time, and why present-day geologic activity—including a variety of devastating natural disasters such as earthquakes—occur where they do.  We consider volcanoes, types of eruptions, and typical rocks found there. Finally, we will delve into the processes that produce the energy and mineral resources that modern society depends on, to help understand the context of the environment and sustainability challenges that we will face in the future.",24337.0,19182.0,4.9,510.0
