name,url,category,subcategory,instructors,description,enrollment,views,rating,raters
21st Century Energy Transition: how do we make it work?,https://www.coursera.org/learn/21st-century-energy-transition,Physical Science and Engineering,Environmental Science and Sustainability,Brad Hayes,"Affordable, abundant and reliable energy is fundamental to human well-being and prosperity. For the past 150 years, more and more people have gained access to energy, primarily in the form of fossil fuels – coal, petroleum and natural gas. But now, even while half of humanity cannot access adequate energy supplies, we are beginning a profound transition to more diverse energy sources. Climate change, environmental sustainability, and energy poverty are all important – and sometimes conflicting – drivers as we strive to supply more energy to more people with fewer negative impacts on Earth’s environments. 

In this course from the University of Alberta and Canadian Society for Evolving Energy, you will join us to learn about the many energy sources available, and where technology is providing exciting new solutions to energy and environmental challenges. Find out what roles energy storage must play to support the transition, and discuss how we can optimize transition processes. Examine competing viewpoints (“realities”) to enable energy transition, focusing on the practical challenges in bringing about change on a global basis. Finally, you will bring all these issues together to examine how the energy transition process is progressing and what we must do to create pathways to achieve our goals.",,19180.0,,
A Circular Economy of Metals: Towards a Sustainable Societal Metabolism,https://www.coursera.org/learn/circular-economy-metals,Physical Science and Engineering,Environmental Science and Sustainability,Ester van der Voet,"Metals are present everywhere around us and are one of the major materials upon which our economies are built. Economic development is deeply coupled with the use of metals. During the 20th century, the variety of metal applications in society grew rapidly. In addition to mass applications such as steel in buildings and aluminium in planes, more and more different metals are in use for innovative technologies such as the use of the speciality metal indium in LCD screens.  

A lot of metals will be needed in the future. It will not be easy to provide them. In particular in emerging economies, but also in industrialised countries, the demand for metals is increasing rapidly. Mining and production activities expand, and with that also the environmental consequences of metal production.  

In this course, we will explore those consequences and we will also explore options to move towards a more sustainable system of metals production and use. We will focus especially on the options to reach a circular economy for metals: keeping metals in use for a very long time, to avoid having to mine new ones.  

This course is based on the reports of the Global Metals Flows Group of the International Resource Panel that is part of UN Environment.  An important aspect that will come back each week, are the UN Sustainable Development Goals, the SDGs. Those are ambitious goals to measure our progress towards a more sustainable world. We will use the SDGs as a touching stone for the assessment of the metals challenge, as well as the solutions we present in this course to solve that challenge.",5586.0,8480.0,4.7,78.0
"Act on Climate: Steps to Individual, Community, and Political Action",https://www.coursera.org/learn/act-on-climate,Physical Science and Engineering,Environmental Science and Sustainability,Michaela Zint,"Are you concerned about climate change? Would you like to learn how to address and respond to this challenge? If so, this course is for you.  

Act on Climate: Steps to Individual, Community, and Political Action is intended to help learners understand, address and respond to climate change as individuals and in partnership with their communities and political leaders. The course focuses on how to translate learning into action on climate change in the areas of food, energy, transportation and the built environment (cities). This course was co-developed and taught by Michaela Zint, Professor of Environmental Education and Communication, and University of Michigan Students. A range of academic climate change experts and professional leaders are featured.

As a result of completing this course, you will be able to:

1) Identify individual, community, and political actions you can engage in to effectively address and respond to climate change.

2) Describe how insights from the social sciences can be employed to create change at the individual, community, and political levels.

3) Feel empowered to continue to influence how you, your community, and political leaders address and respond to climate change.

Use #UMichActonClimate on social media to share what you're doing and connect with other learners.",13642.0,25759.0,4.8,140.0
Advanced Functional Ceramics,https://www.coursera.org/learn/advanced-functional-ceramics,Physical Science and Engineering,Environmental Science and Sustainability,Lee Kyu Hyoung,"To realize next-generation devices, novel ceramic materials with ultimate physical and chemical properties are required. For this purpose, a few intrinsic and extrinsic approaches for the development of new functional ceramics are proceeding. This course provides the fundamentals of functional ceramics and the materials design rules for developing advanced ceramics with ultimate physical and chemical properties.",3955.0,3581.0,4.7,123.0
Algae Biotechnology,https://www.coursera.org/learn/algae-biotechnology,Physical Science and Engineering,Environmental Science and Sustainability,"Dr. Stephen Mayfield, Ira ""Ike"" Levine","For decades, researchers have been studying microalgae to understand their biological functions and how we can use technology to harness algae’s power to create a wide range of commercial products. 

In this course, we will cover how synthetic biology, genetic engineering, and metabolic engineering is used in algae biotechnology, and also examine the current state of algae biotechnology research and tools.

We’ll also explore some of the common bio-products we can make from algae, and take a look at some real-world algae companies that are using algae biotechnology to create products consumers can buy today. 

This course is part of a series of courses produced by the Algae Technology Educational Consortium and UC San Diego with funding from the Algae Foundation, National Renewable Energy Lab, and the U.S. Department of Energy.",7998.0,14077.0,4.8,370.0
Análisis de Sistemas de Transporte,https://www.coursera.org/learn/analisis-sistemas-de-transporte,Physical Science and Engineering,Environmental Science and Sustainability,"Ricardo Giesen, Felipe Delgado, Juan de Dios Ortuzar","Este curso es una introducción a las metodologías fundamentales para la gestión, planificación y evaluación de sistemas de transporte de pasajeros. Se aprenderán técnicas usadas en la práctica para estimar la demanda, modelar la operación y realizar análisis económicos de proyectos de transporte. Algunos temas estudiados incluyen: modelo clásico de transporte de cuatro etapas, modelo de distribución de viajes gravitacional, modelo de elección discreta logit, teoría de colas, análisis de redes, paradoja de Braess, tarificación por congestión y evaluación social de proyectos de transporte.",25455.0,8738.0,4.7,724.0
Aprendizajes en Ingeniería y Agricultura con Arduino: Construcción y automatización de un invernadero,https://www.coursera.org/learn/aprendizajes-en-ingeniera-y-agricultura,Physical Science and Engineering,Environmental Science and Sustainability,"Paola Carmona Castañeda, Cristian David Dallos Loaiza, Julio Cesar Garcia Alvarez","En la sociedad actual con un ritmo acelerado de vida, mantener las plantas, cultivos o huertos domésticos resulta ser una tarea difícil, debido a que los suelos se secan por falta de hidratación o exceso de ella. Para evitar esto, este curso, enseñará a diseñar, construir e implementar un sistema de riego automatizado que una la ingeniería, la agricultura y las ciencias de la computación en un proyecto que permita solucionar esta problemática.

En el curso utilizarás Arduino, el cual permite trabajar en múltiples plataformas como Mac, Windows, Linux; tiene un entorno de programación simplificado, es de código libre (Open Source), permite flexibilidad para la conexión de elementos de entrada como sensores (nivel, humedad, temperatura, etc.) y elementos de salida como actuadores (motores, electrobombas, etc.), con el cual realizaras una aplicación real donde se automatizará un invernadero a escala.

En el curso encontrarás videos donde podrás ver como armar el invernadero, como descargar Arduino, el paso a paso para desarrollar el código, como programar, hacer la conexión y ensamblar todos los elementos, como construir un sistema de riego para el hogar entre otros; Además, encontraras lecturas que te llevaran paso a paso en el proceso, ilustraciones, listada de materiales que debes conseguir y herramientas que le facilitaran como estudiante, realizar el armado de un invernadero a escala y programar su automatización. Todos los elementos que requieres son de fácil adquisición en tiendas de electrónica, ferreterías y en el comercio electrónico para todos los países. 

Al final del curso se espera que puedas tener un sistema de riego automatizado funcional para tu hogar, oficina o cualquier entorno al que desees adaptarlo; además de desarrollar nuevas formas de aprender, crear, investigar, aprovechar las tecnologías de la información, comunicaciones y trabajo autónomo.

¡Esperamos que lo disfrutes!",,5950.0,4.7,11.0
Ash-Related Operational Challenges in Energy Utilization of Sustainable Fuels,https://www.coursera.org/learn/sustainability-fuels-ash-chemistry-deposits-corrosion-additives,Physical Science and Engineering,Environmental Science and Sustainability,Flemming Jappe Frandsen,"The basic idea behind this MOOC, is to present recent data on fuel characterization, slagging, fouling, corrosion, and trace element transformations, in a course that can be readily provided for students and industry people.

This ensures understanding and application of the research, and provides the students and industry with a forum for discussion of the very latest research results, as well as feedback from industry to the research group at DTU, on important new research subjects in the field.

The specific aim of the MOOC, is that students will be able to;
Explain basic physical and chemical differences between solid fuels like coal, biomass, waste etc., be able to characterize solid fuels, and to interpret fuel analyses of them
Interpret and utilize data from advanced fuel and ash analyses (SEM, DTA/TGA, chemical fractionation, ash melting temperatures)
Describe chemically and physically, how critical ash-forming elements are released to the gas phase, the mechanisms for formation of aerosols and fly ash particles, and explain how ash is transported from bulk gas to heat transfer surfaces
Quantify the processes of deposit build-up, sintering and shedding
Explain the fundamentals of high-temperature corrosion in thermal fuel conversion systems
Can calculate viscosities as a function of temperature and composition, temperature profiles in a deposit, rates of deposit build-up and sintering, as well as porosity changes vs. time.",1605.0,2622.0,4.8,23.0
Biosphere 2 Science for the Future of Our Planet,https://www.coursera.org/learn/biosphere-science-future,Physical Science and Engineering,Environmental Science and Sustainability,"Kevin E. Bonine, PhD","Are you ready to take an incredible journey around Planet Earth and beyond? In this course, you will delve into a world of innovative science and learn from a team of Biosphere 2 and University of Arizona researchers. From plants and soils, to oceans and rainforests, the Moon, Mars, and more, this course is an exciting opportunity for anyone interested in science and Earth stewardship. 

Learn how a unique research station in the Arizona desert is used to investigate big ideas, such as how Earth systems interact, the effects of climate change, and what our future holds. Go back in time thousands of years with information locked in ancient trees, and travel into an imagined future where humans become Martians. Collect and analyze your own scientific data, discuss big questions with participants from around the world, and gain novel insights and understanding about our wonderfully unique planet.",4893.0,4490.0,4.9,100.0
CAD/BIM技術與應用專項課程（CAD/BIM Specialization),https://www.coursera.org/learn/cad-bim-shiwu,Physical Science and Engineering,Environmental Science and Sustainability,謝尚賢,"本課程專題之設計乃與世界知名的Arup工程顧問公司合作，讓學員透過解決工程實務問題的過程，一方面能複習與綜整本系列課程中所學到的知識與技能，另一方面能更理解CAD/BIM在工程實務的運用上，可能遭遇的挑戰與相對應的解決方案，並期能激發學員之創意，讓本系列課程之學習成果更加豐富。修習完此課程之學員，將成為具有職場競爭力的初階CAD/BIM專業人才。本課程會先說明要學員解決的工程實務問題，及解決問題之階段性任務，接著便由學員逐步完成各階段性任務及提出期中報告，最後於期末時針對所完成的基本解決方案與創意加值部份，提出一期末報告。每期的頂尖學員，將可獲得提送履歷表給Arup公司的難得機會。

您可以單獨註冊此門課程，不需要完成專項課程中的所有課程才能加入。但因本門課縱整了專項課程中所學的知識與技術，因此建議學習者需具備專項課程的課綱中所列的知識與技術，否則難以順利地完成本課程的課程項目。
CAD/BIM技術與應用 專項課程： https://www.coursera.org/specializations/cad-bim-jianmo",,1690.0,,
Careers in Sustainability,https://www.coursera.org/learn/sustainability-careers,Physical Science and Engineering,Environmental Science and Sustainability,Christopher Boone,"This course is an introduction to careers in sustainability, focusing primarily on the role of a sustainability analyst at public and private organizations. Through a mix of video, print, peer review, and interactive content, learners will be able to explain sustainability and the specifics of a sustainability analyst’s job within an organization. 

The course is structured around two elements: topical knowledge and practical application. Throughout the course, learners can practice what they learn and get feedback from their peers to build their skills. Additionally, knowledge checks provide milestones for learners to ensure that they understand the necessary information about each topic presented. Each module begins with a video that introduces the concepts taught in the lesson, including interviews with ASU School of Sustainability professors.

Interactive activities and hands-on application are central to the learner experience in this course. They include participating in mini-application experiences, trying out real-life skills with expert feedback, and creating personalized tools like presentation slide decks and spreadsheet templates to use in the role on day one of a new job. The interactive and hands-on activities are specifically designed to teach not only sustainability skills but also professional skills like professional writing, presentation skills, and conducting successful video meetings. This combination of practical skills and specialized content makes this course a unique foundation for the rest of the specialization.",,13031.0,,
Circular Economy - Sustainable Materials Management,https://www.coursera.org/learn/circular-economy,Physical Science and Engineering,Environmental Science and Sustainability,"Philip Peck, Jessika Luth Richter, Karl Vrancken, Saskia Manshoven, Jeroen Gillabel, Erika Faigen, Konstantinos Modis, Sophie Sfez, Julia Nußholz, Katherine Whalen, David Peck, Dr. Yuliya Voytenko Palgan","This course looks at where important materials in products we use every day come from and how these materials can be used more efficiently, longer, and in closed loops. This is the aim of the Circular Economy, but it doesn’t happen on its own. It is the result of choices and strategies by suppliers, designers, businesses, policymakers and all of us as consumers. 

In addition to providing many cases of managing materials for sustainability, the course also teaches skills and tools for analyzing circular business models and promotes development of your own ideas to become more involved in the transition to a Circular Economy.

You will learn from expert researchers and practitioners from around Europe as they explain core elements and challenges in the transition to a circular economy over the course of 5 modules:

Module 1: Materials. This module explores where materials come from, and builds a rationale for why society needs more circularity. 

Module 2: Circular Business Models. In this module circular business models are explored in-depth and a range of ways for business to create economic and social value are discussed.

Module 3: Circular Design, Innovation and Assessment. This module presents topics like functional materials and eco-design as well as methods to assess environmental impacts.

Module 4: Policies and Networks. This module explores the role of governments and networks and how policies and sharing best practices can enable the circular economy.

Module 5: Circular Societies. This module examines new norms, forms of engagement, social systems, and institutions, needed by the circular economy and how we, as individuals, can help society become more circular.

This course is brought to you by: 
LUND UNIVERSITY
INTERNATIONAL INSTITUTE FOR INDUSTRIAL ENVIRONMENTAL ECONOMICS (IIIEE)
EIT RAWMATERIALS
VITO
GEOLOGICAL SURVEY OF DENMARK AND GREENLAND
NATIONAL TECHNICAL UNIVERSITY OF ATHENS
GHENT UNIVERSITY
DELFT UNIVERSITY OF TECHNOLOGY",49661.0,127597.0,4.8,1563.0
Cities and Consumption: Urban Sustainability and the Sharing Economy,https://www.coursera.org/learn/sharing-cities,Physical Science and Engineering,Environmental Science and Sustainability,"Dr. Kes McCormick, Dr. Yuliya Voytenko Palgan","How can we govern consumption and the sharing economy in our cities?

This course explores cities, consumption and the sharing economy in Europe and around the world. We connect together the key themes of the sharing economy, cities, governance, consumption and urban sustainability. We explore how the sharing economy can contribute to increasing social, environmental and economic sustainability. And we argue that it is imperative that the sharing economy is shaped and designed to advance urban sustainability.

This course was launched in May 2020, and it was updated in September 2021 with new podcasts, films and publications. This course is produced by Lund University in cooperation with partners from Sharing Cities Sweden – a national program for the sharing economy in cities with a focus on governance and sustainability. It features researchers, practitioners and entrepreneurs from a range organisations.",6827.0,7075.0,4.7,147.0
Climate Adaptation in Africa,https://www.coursera.org/learn/climate-adaptation,Physical Science and Engineering,Environmental Science and Sustainability,Mark New,"This course explores why climate change adaptation is important in the African context. Africa is considered one to be one of the most vulnerable regions to climate change.   Historically, climate-related hazards such as drought, flooding, pest and disease outbreaks, coastal storms and heat waves have had devastating impacts on people and the environment in which they live. Often the damage knocks back progress that has been made in social and economic development, slowing down the achievement of development goals.  Climate models suggest that many of these climatic hazards will intensify as the global climate warms. Building resilience to climate risks, through adaptation, is critically important for future development in Africa.

The course will examine adaptation in theory and in practice, through a focus on four sectors that are critically important for climate resilient development in Africa: Water Security, Agriculture and Food Security, Ecosystems and Ecosystem Services and Resilient Cities.",5778.0,9676.0,4.8,84.0
Climate Change Mitigation in Developing Countries,https://www.coursera.org/learn/climate-change-mitigation,Physical Science and Engineering,Environmental Science and Sustainability,Harald Winkler ,"This course challenges you to consider how one might lift societies out of poverty while also mitigating greenhouse gas emissions. We explore the inherent complexity of developing country governments wanting to grow their economies in a climate friendly way. You will be introduced to an approach with which to address this challenge. The approach consists of a facilitated process whereby academic researchers and high-level influential actors within society co-produce knowledge. You will track this process in four Latin American countries - Brazil, Chile, Colombia, Peru, and South Africa. You will hear from various professionals about their contexts and the different challenges and opportunities the process includes.

This course will cover topics such as facilitation process techniques, energy modeling, scenario building, innovation and policy making. You will have the opportunity to respond to these topics with ideas and reflection from your own context. Whether you are a climate change practitioner, work in development or are simply curious about how climate mitigation is understood, this course will give you insights into the complexity of how countries from the South pursue development goals while addressing climate mitigation.

The course is free to enroll and take. You will be offered the option of purchasing a certificate of completion, which you become eligible for if you successfully complete the course requirements.  This can be an excellent way of staying motivated!  Financial Aid is also available.",40525.0,20296.0,4.7,474.0
Climate Change and Water in Mountains: A Global Concern,https://www.coursera.org/learn/climate-changes-mountains-water,Physical Science and Engineering,Environmental Science and Sustainability,"Martin Beniston, Markus Stoffel","What is climate change ? How are mountain regions affected by the evolution of water resources and their uses ? What kind of risks need to be considered ? 

Mountains are recognized as particularly sensitive physical environments where intense and rapid changes have in the past, and may increasingly in the future, place pressure on their resource base. 

In this context, a team of roughly 100 experts worked from 2008 to 2013 for the European ACQWA project (www.acqwa.ch) which was coordinated by the University of Geneva. The primary objectives of the project were to assess the impacts of a changing climate on the quantity and quality of water originating in mountain regions, particularly where snow- and ice melt represent a large, sometimes the largest, streamflow component. A further objective of the project was to determine the potential disruptions to water-dependent economic activities related to the climate impacts on hydrological systems, and to propose a portfolio of possible adaptation strategies.

This particular MOOC is inspired by the ACQWA Project and offers a better understanding of climate change, its impacts on the quality and quantity of water in mountain regions and the risks related to changing water resources. From an interdisciplinary perspective, the participation of twenty-five instructors from five different countries (Switzerland, England, South Korea, India and Nepal) and fourteen institutions (UNIGE, RTS, UNIFR, UZH, ETHZ, Meteodat GmbH, WGMS, Imperial College London, Agroscope, République et Canton de Genève, Yonsei University, IHCAP, ICIMOD, SDC, FOEN) highlights the diversity of both theoretical and practical viewpoints related to these issues.

By the end of this course, you will be able :

- to define the general concept of climate change in mountain regions
- to understand the concepts associated with climate change such as adaptation and water governance strategies
- to consider the impacts of climate change on water resources in mountain regions
- to identify the impacts of climate change on hydropower, agriculture, aquatic ecosystems and health 
- to enumerate risks that can occur in mountain areas and lead to disruptions in water availability and use.

Your acquired knowledge will be evaluated through multiple-choice quizzes at the end of each unit of the course.

This MOOC on “Climate Change and Water in Mountain Regions : A Global Concern” was initiated and financed by the University of Geneva, through its Institute for Environmental Sciences. 

We look forward to you joining us !",11340.0,15604.0,4.7,262.0
